screen_name,user_id,location,description,url,gender,party,state,district
RepBrianMast,814103950404239360,,"Proud husband, father of 4 & Army veteran.  Humbly serving the 18th Congressional District of Florida. Please contact me if you need assistance.",https://t.co/FobaV8QhPg,M,R,FL,18.0
RepTrey,811986281177772032,Indiana's 9th District,Proudly serving my fellow Hoosiers of Indiana's 9th District. Member of the House Financial Services Committee.,,M,R,IN,9.0
RepPaulMitchell,811632636598910976,,"Official account for Congressman Paul Mitchell #MI10
Follow me on Instagram ➡️ https://t.co/PbbvZmjrjJ",https://t.co/zSBYj2y0i6,M,R,MI,10.0
SenCortezMasto,811313565760163844,,U.S. Senator from the great state of Nevada.,https://t.co/v6sRnbH7nI,F,D,NV,
RepOHalleran,808416682972770304,"Arizona, USA","Proud husband, father, and grandfather. Fighting for #AZ01 families and co-chairing the @HouseBlueDogs Coalition.",https://t.co/qWMQM5cABj,M,D,AZ,1.0
RepRaskin,806906355214852096,Maryland's 8th District,Proudly serving MD's 8th District. Member of: @rulesdemocrats | @housejudiciary | @oversightdems | @houseadm_dems. https://t.co/EkyEyszJWc,https://t.co/bo0IGrClrq,M,D,MD,8.0
RepDrewFerguson,806583915012046854,"West Point, GA",Proud to serve the good people of Georgia's 3rd District in Congress,,M,R,GA,3.0
SenKamalaHarris,803694179079458816,,United States Senator for California,https://t.co/d7fwQc0xoD,F,D,CA,
RepValDemings,798973032362606600,"Washington, DC I Orlando, FL",U.S. Representative Florida's 10th Congressional District. Public Servant. Former Orlando Police Chief. Christian. Wife. Mother. Grandmother. Harley Enthusiast.,https://t.co/9DRF1GBZ3J,F,D,FL,10.0
RepJimmyPanetta,796736612554117120,,I'm honored to serve as the Congressman for California's Central Coast (CA-20) in the U.S. House of Representatives.,https://t.co/9QMrnfxHRG,M,D,CA,20.0
RepStephMurphy,796183515998068736,"Winter Park, FL",Fighting for progress and proudly representing Seminole & Orange Counties in the U.S. House of Representatives. #FL07,https://t.co/7stdgh39et,F,D,FL,7.0
RepMarshall,752364246218862592,"Great Bend, KS","Physician, Grandpa, Congressman representing Kansas' Big 1st District",https://t.co/gU0Halbo1e,M,R,KS,1.0
WarrenDavidson,742735530287304704,"Washington, DC",U.S. Congressman serving Ohio's 8th District. Constitutionalist and former Army Ranger. It's not compassionate to bankrupt America!,https://t.co/EbtGc7u36x,M,R,OH,8.0
CongBoyle,4304448314,,"Official Leg. account of Rep. Brendan Boyle. Co-Chair @BlueCollarDems, Proud Father, Loyal Philly sports fan and Fighter for the PA-02 Congressional District",https://t.co/jKJoNseYtJ,M,D,PA,2.0
GReschenthaler,4205133682,,Representing the people of PA-14 in the U.S. House of Representatives.,https://t.co/BBptULmIUQ,M,R,PA,14.0
RepLaHood,3686482216,IL-18 Congressional District,Proudly representing the 18th Congressional District of Illinois. Member of @WaysandMeansGOP.,https://t.co/4Vsi29h4ty,M,R,IL,18.0
RepTrentKelly,3317799825,,"Proudly serving Mississippi's First Congressional District in the U.S. House of Representatives. 
Rt's & likes ≠ Endorsements",http://t.co/qE8a4JH0Dl,M,R,MS,1.0
DonaldNorcross,3122099613,,"Congressman, NJ-01 • Electrician • Born & Raised in South Jersey • Husband, Dad, Granddad • @EdLaborCmte Member • @HASCDemocrats TAL Chair",https://t.co/yD13GE8LK4,M,D,NJ,1.0
RepTedLieu,3044993235,"Los Angeles, CA & Washington, DC","Official Twitter account for the Office of Rep @TedLieu, serving #CA33 in the U.S. House of Representatives • https://t.co/cSZYg2t9ap • https://t.co/oA7bA0mWrM",https://t.co/gVv4Qfdiiu,M,D,CA,33.0
RepAmata,3026622545,"Washington, D.C.","Congresswoman proudly representing American Samoa. Serving on the @NatResources, @HouseVetAffairs, and @HouseSmallBiz",https://t.co/L7B6x0yzTS,F,R,AS,0.0
RepPeteAguilar,3018670151,"San Bernardino, CA","Pete Aguilar represents CA’s 31st Congressional District. A former mayor, Rep. Aguilar is committed to strengthening the Inland Empire’s middle class.",http://t.co/o4deRoUnuK,M,D,CA,31.0
RepGrothman,2976606250,"Washington, D.C.","Official account of Congressman Glenn Grothman, proudly representing Wisconsin's Sixth District.",http://t.co/MY3WTtaAeb,M,R,WI,6.0
CongressmanHice,2975091705,"Greensboro, GA; Washington, DC","I'm honored to serve Georgia's 10th Congressional District. Communications Chair, @freedomcaucus.",https://t.co/apR1dqYCIk,M,R,GA,10.0
RepBuddyCarter,2973870195,,Proudly serving Georgia's 1st Congressional District,https://t.co/zGq0mX8dEy,M,R,GA,1.0
RepKathleenRice,2970462034,"Long Island, NY",U.S. Representative for #NY04 (Long Island). Former Nassau County DA.,http://t.co/XBMpgvbVZ1,F,D,NY,4.0
RepDebDingell,2970279814,"Washington, DC","Proudly serving the people of Michigan's 12th Congressional District.
http://t.co/e7qwdRk0zg
http://t.co/q9q7Jj0s26",http://t.co/tsIQhHRnwP,F,D,MI,12.0
RepBonnie,2968451607,"New Jersey, USA",Proudly serving the people of New Jersey’s 12th Congressional District. Proud #BlackWoman. Progressive Dem. Member of the #Resistance. Co-Chair of @CBWGCaucus.,https://t.co/nnqUnDnLfU,F,D,NJ,12.0
RepDeSaulnier,2968007206,"Concord, CA","Representing CA-11. Member of @transportdems @EdLaborCmte @oversightdems @RulesDemocrats. Dad, amateur historian, marathon runner & former small business owner.",https://t.co/pa3PJQ8V5B,M,D,CA,11.0
RepJohnKatko,2966765501,"Syracuse, New York",Official Twitter account of Rep. John Katko. Proudly representing New York's 24th Congressional District.,https://t.co/GLTSxMTZwp,M,R,NY,24.0
RepRubenGallego,2966570782,"Phoenix, AZ",Proud representative of Arizona's 7th Congressional District. #AZ07,http://t.co/isis6YaDPG,M,D,AZ,7.0
RepMarkWalker,2966205003,,US Congressman. @housegop Vice Chair. Ranking Member on Subcommittee for Intelligence and Counterterrorism. Former Pastor gratefully representing #NC06.,https://t.co/uvTWAFvWvC,M,R,NC,6.0
SenMcSallyAZ,2964949642,"Arizona, USA",First female fighter pilot to fly in combat. Veteran. Dog mom to Boomer. Proudly representing the people of Arizona in the U.S Senate.,https://t.co/ZaC11aNF6e,F,R,AZ,
RepBost,2964877294,IL-12 Congressional District,"Member of Congress proudly representing IL-12. Serving on @TransportGOP, @HouseAgGOP, and @HouseVetAffairs Committees. Find me on FB at https://t.co/cjWY9Itiyr",https://t.co/4tXoH7NdiQ,M,R,IL,12.0
RepAlexMooney,2964526557,"Charles Town, WV","Husband, Father, Conservative Representing West Virginia's 2nd Congressional District. #wv02 #wvpol Member of @financialcmte",https://t.co/dKSBzlN9IY,M,R,WV,2.0
RepRickAllen,2964287128,"Augusta, GA and Washington, DC",Proudly representing Georgia's 12th Congressional District,https://t.co/WfV96n5LQo,M,R,GA,12.0
SenThomTillis,2964174789,"North Carolina, USA",Official Twitter account of North Carolina U.S. Senator Thom Tillis.,https://t.co/mLVkKiULqh,M,R,NC,
HurdOnTheHill,2963445730,#TX23,"Serving #TX23 in Congress on @HouseAppropsGOP & #Intel, #SanAntonio native, @TAMU grad, formerly undercover @CIA",https://t.co/AZDfh0jDnz,M,R,TX,23.0
SenSasse,2962923040,,The press office account of U.S. Sen. Sasse. His (less political/hopefully more interesting) personal account is @ BenSasse.,,M,R,NE,
RepAbraham,2962891515,,"Proudly representing Louisiana's 5th District. Rural family physician, veteran, farmer, pilot, former veterinarian, husband, father & grandfather.",,M,R,LA,5.0
RepDonBeyer,2962868158,Northern Virginia & DC,"Representing Northern Virginia’s #VA8 in Congress. Serve on @WaysMeansCmte, @HouseScience. Co-Chair @CaucusOnClimate. #StopGunViolence #EqualPay",https://t.co/GLUWQ3oyIM,M,D,VA,8.0
RepStefanik,2962813893,,"Official Twitter Account for Congresswoman Elise Stefanik, proudly representing New York's 21st District.",https://t.co/OrCTHWbOd1,F,R,NY,21.0
SenatorRounds,2955485182,"Pierre, South Dakota",U.S. Senator for South Dakota,http://t.co/gMVH2AwcFu,M,R,SD,
RepFrenchHill,2953974395,"Little Rock, AR",Official account of Rep. French Hill. 9th generation Arkansan. @FinancialCmte Subcommittee Ranking Member. Proudly representing AR-02.,https://t.co/TggD8rLd3M,M,R,AR,2.0
RepGarretGraves,2951574214,Follow us on Facebook: ,Official Twitter Page of Congressman Garret Graves (LA06),https://t.co/glkM2IIXms,M,R,LA,6.0
RepNewhouse,2930635215,,Proud to represent Washington's 4th District in the U.S. Congress,https://t.co/qIftHgI639,M,R,WA,4.0
RepBrianBabin,2929491549,,Honored to serve citizens of #TX36 in U.S. Congress. Ranking Member of Space and Aeronautics Subcmte & serve on @HouseScienceGOP and @TransportGOP Committee.,https://t.co/tJRjOi3OmN,M,R,TX,36.0
RepAdams,2916086925,,Congresswoman representing NC’s 12th District. Educator. Artist. Founder & Co-Chair of the Bipartisan HBCU Caucus.,https://t.co/wPfZolUQ4r,F,D,NC,12.0
RepTomEmmer,2914515430,"Otsego, MN | Washington, D.C.","Husband, father, hockey fan, and Congressman for Minnesota's 6th District.",http://t.co/jU8TYBqqHL,M,R,MN,6.0
RepLoudermilk,2914163523,,"Rep. Barry Loudermilk represents Georgia's 11th Congressional District, which includes all of Bartow and Cherokee counties and portions of Cobb and Fulton.",https://t.co/FWd4vPQ7Po,M,R,GA,11.0
SenDanSullivan,2891210047,,Official twitter account for U.S. Senator Dan Sullivan.  Proudly serving the state of Alaska.,http://t.co/9uIoLCChCm,M,R,AK,
sendavidperdue,2863210809,Georgia,Official Twitter account for U.S. Senator David Perdue of Georgia.,https://t.co/I3Xla8NlsK,M,R,GA,
RepLawrence,2863006655,"Washington, DC","Congresswoman for Michigan's 14th District: Detroit, Southfield, Oakland and Wayne Counties. Instagram: Repbrendalawrence, Facebook: Rep.BLawrence",https://t.co/jik2CxOIWT,F,D,MI,14.0
RepKenBuck,2862577383,"Windsor, CO | Washington, DC",Proudly representing the wonderful people of Colorado (CO-04). Member on @JudiciaryGOP & @HouseForeignGOP,https://t.co/Tl3R8080cP,M,R,CO,4.0
USRepGaryPalmer,2861616083,,Proudly serving the people of Alabama's 6th Congressional District.,https://t.co/f5XX8JEE0I,M,R,AL,6.0
SenJoniErnst,2856787757,Iowa,Follow for news and updates from the Office of Iowa Senator Joni K. Ernst. Tweets from Joni are signed JKE.,http://t.co/zUYK5PQEOd,F,R,IA,
RepWesterman,2852998461,"Hot Springs, Arkansas",Representing the 4th District of Arkansas. Husband. Father of 4. Hot Springs native. Engineer. Forester.,,M,R,AR,4.0
RepRatcliffe,2847221717,"Heath, TX","U.S. Congressman for Texas' 4th District. Member of House Intelligence Committee, @JudiciaryGOP & House Ethics. Former federal prosecutor.",https://t.co/RaXZihuHYU,M,R,TX,4.0
RepLeeZeldin,2750127259,,Proudly representing New York's First Congressional District. Ranking Member of @HouseForeignGOP Subcommittee on Oversight & Investigations.,https://t.co/Kj9kXazM0U,M,R,NY,1.0
StaceyPlaskett,2724095695,"U.S. Virgin Is. | Wash., DC",Proudly representing the Virgin Islands of the United States,http://t.co/T9tJ8F2eLe,F,D,Virgin Islands,
RepMoolenaar,2696643955,,Representing Michigan's Fourth Congressional District. This is the Twitter page of the official House office.,http://t.co/cwXZtKCJhJ,M,R,MI,4.0
RepHastingsFL,2433737761,Florida 20th,Congressman Alcee L. Hastings represents parts of Broward and Palm Beach counties in the U.S. House of Representatives.,http://t.co/g0E2ojpNr4,M,D,FL,20.0
RepRobWoodall,2382685057,"Lawrenceville, GA; Wash., D.C.","U.S. Representative for the Seventh District of Georgia. Serving on the Rules Committee, Transportation & Infrastructure Committee, and House Budget Committee.",http://t.co/twbdtrZomN,M,R,GA,7.0
RepJimmyGomez,2371339658,"Los Angeles, CA","Official account for U.S. Congressman Jimmy Gomez (CA-34, Los Angeles). Cmtees: @WaysMeansCmte @OversightDems Find us on FB: https://t.co/1pRH7kHn00",https://t.co/PTPcf8ooHN,M,D,CA,34.0
RepKClark,2293131060,,Vice Chair of the House Democratic Caucus. Proudly representing the people of the 5th District of Massachusetts.,https://t.co/qWMKEO845O,F,D,MA,5.0
RepByrne,2253968388,Southwest Alabama,I am proud to represent Alabama's First Congressional District in the U.S. House of Representatives. Official Congressional Account,https://t.co/u2pktSNMc6,M,R,AL,1.0
SenBooker,2167097881,"New Jersey * Washington, DC","The U.S. Senate Office of Cory Booker, D-NJ. Tweets by staff.",http://t.co/bl28yzvbjQ,M,D,NJ,
RepGuthrie,1908143071,Kentucky's Second District,Fighting for conservative values in Washington while representing the people of Kentucky's 2nd Congressional District,https://t.co/o8TdiWaWnj,M,R,KY,2.0
USRepKCastor,1880674038,,"Tampa Bay's Congresswoman 🇺🇸 Chair, House Committee on the Climate Crisis",https://t.co/H9etkVz65v,F,D,FL,14.0
RepBlaine,1849261916,Missouri's 3rd District,Proudly serving Missouri's 3rd Congressional District. House @FinancialCmte and @HouseSmallBiz Commitee member.,https://t.co/HAAAI7JpAI,M,R,MO,3.0
RepJasonSmith,1623308912,MO-08,Honored to represent the families of Missouri's 8th Congressional District in the United States House of Representatives.,http://t.co/dxAOG6A9MK,M,R,MO,8.0
RepBeatty,1531521632,Ohio's Third District,"Official Twitter account for Congresswoman Beatty, representing Ohio's Third Congressional District in the U.S. House of Representatives.",https://t.co/ZrsTik4dBm,F,D,OH,3.0
USRepLong,1444015610,,Representing Missouri’s 7th District in the United States Congress - Member of the House Energy and Commerce Committee,https://t.co/uG5DCdtUfQ,M,R,MO,7.0
PeterWelch,1410590874,"Vermont and Washington, DC","Official Twitter Account for Congressman Peter Welch, proudly representing the great state of Vermont in the U.S. House of Representatives.",http://t.co/P7VlnuEP0v,M,D,VT,0.0
RepRobinKelly,1339931490,,"Official Twitter account for Robin Kelly, U.S. Representative #IL02.",https://t.co/7pZornDHqs,F,D,IL,2.0
Rep_Hunter,1305596696,,Proudly representing California’s 50th District https://t.co/0yyKBsCmQe,https://t.co/JmFka1DZNM,M,R,CA,50.0
RepChrisSmith,1289319271,,"Proud to represent the 4th Congressional District of New Jersey.

Social media policy: https://t.co/vKjnDqaOS5",http://t.co/a3ZJUqfRSg,M,R,NJ,4.0
RepJuanVargas,1260172386,"SD/Imperial Counties, CA","Official Twitter account of Rep. Vargas, representing southern San Diego County, all of Imperial County and California's entire U.S.-Mexico border. #CA51",http://t.co/m3QdRCZFO0,M,D,CA,51.0
senatemajldr,1249982359,"Washington, DC",U.S. Senate Majority Leader Mitch McConnell,https://t.co/J5RQpHiTgo,M,R,KY,
RepBrownley,1243902714,"Ventura County & Washington, DC",Serving #CA26 & fighting for Ventura County. Chairwoman of @VetAffairsDems Health Subcommittee & #WomenVetsTaskForce. Member of @TransportDems & @ClimateCrisis.,,F,D,CA,26.0
RepCardenas,1222257180,"San Fernando Valley, CA",Proud to represent California's 29th District - the San Fernando Valley - in The People’s House. Member of @EnergyCommerce,https://t.co/LEayHjDmFc,M,D,CA,29.0
SteveScalise,1209417007,"Jefferson, LA",House Republican Whip. Dad. LSU & Saints fan. Proudly representing Louisiana’s First District.,https://t.co/vKBoGD7Spm,M,R,LA,1.0
repmarkpocan,1206227149,"Madison, WI",Honored to serve the people of Wisconsin's Second District. Co-Chair of @USProgressives and @LGBTEqCaucus. Member of @AppropsDems. He/Him/His.,https://t.co/IvGB2NpiqX,M,D,WI,2.0
RepDonaldPayne,1155335864,www.facebook.com/DonaldPayneJr,The NRA gave me an F because I want to end gun violence. Father of triplets. Son of Newark. Proudly serving New Jersey's 10th Congressional District.,,M,D,NJ,10.0
RepDWStweets,1140648348,Weston & Washington,U.S. Congresswoman proudly representing the people of Florida's 23rd District in our nation's capital.,http://t.co/L7PfQxOrER,F,D,FL,23.0
RepScottPeters,1135486501,"San Diego, Poway, Coronado","Serving #CA52. I will support and defend the Constitution of the United States against all enemies, foreign and domestic.",https://t.co/IHSIVY4ZHZ,M,D,CA,52.0
MartinHeinrich,1099199839,,United States Senator from New Mexico,https://t.co/97adkYcq3x,M,D,NM,
SenatorRisch,1096059529,Boise,U.S. Senator for Idaho,https://t.co/QMGG1eEAGz,M,R,ID,
RepCheri,1092979962,"Illinois & Washington, D.C.","Serving Illinois’ 17th District. Former reporter working in Congress #ForThePeople. Athlete, wife and mother of three sons. Facebook & Instagram: RepCheri.",https://t.co/o22FqkWab3,F,D,IL,17.0
CongressmanRuiz,1089859058,,Emergency medicine physician and public servant. Proudly serving California's 36th Congressional District.,http://t.co/sgTdElO4,M,D,CA,36.0
RepAndyBarr,1089334250,"Lexington, KY",Honored to represent Kentucky's Sixth Congressional District.  Fighting to get Kentuckians back to work and restore fiscal responsibility to Washington,http://t.co/XNnauaj5,M,R,KY,6.0
RepFilemonVela,1083448909,"District 34, Texas",U.S. Congressman for the 34th District of Texas - Privileged to represent South Texans.,https://t.co/PYuChi0OLA,M,D,TX,34.0
SenatorSinema,1080844782,,"Official Twitter feed of U.S. Senator Kyrsten Sinema, serving Arizona.",https://t.co/WrlaMe6YPs,F,D,AZ,
RepBillFoster,1080509366,"Naperville, IL",Congressman Bill Foster is a scientist and businessman representing the 11th Congressional District of Illinois,https://t.co/MUUnxZciRU,M,D,IL,11.0
RepRWilliams,1077446982,Central Texas,I am honored to represent the 25th Congressional District of Texas. Member of @FinancialCmte.,http://t.co/JVoBEX18T4,M,R,TX,25.0
RepLoisFrankel,1077121945,,Representative from Florida's 21st Congressional District. Co-Chair of @HouseDemWomen.,https://t.co/37xQooMGQ9,F,D,FL,21.0
SenatorBaldwin,1074518754,"Washington, D.C.","Official Twitter account of United States Senator Tammy Baldwin's office, proudly working for the State of Wisconsin.",http://t.co/p7vErFeoRD,F,D,WI,
SenTedCruz,1074480192,"Houston, Texas",Representing the State of Texas in the United States Senate.,https://t.co/9HWCyvsTvJ,M,R,TX,
RepPaulCook,1074412920,"Apple Valley, California",Twenty-six year retired @USMC Colonel serving as a United States Congressman from California's 8th Congressional District. Join the conversation #CA08 #Semperfi,http://t.co/vy6a8Rp8SU,M,R,CA,8.0
RepVeasey,1074129612,"Dallas-Fort Worth, Texas",Represent Dallas-Fort Worth | Assistant Whip | @energycommerce & Small Biz | #GunViolencePrevention Taskforce Whip | Voting Rights Caucus 🗳 +@bluecollardems,https://t.co/o4DuQsMYT7,M,D,TX,33.0
SusanWBrooks,1074101017,,Serving the good people of Indiana’s 5th District in Congress. Facebook: https://t.co/LPD9s9AMeh Instagram: @susanwbrooks,https://t.co/JSQOTU8q0S,F,R,IN,5.0
RepSeanMaloney,1072467470,"Cold Spring, NY",Representing NY’s 18th Cong’l Dist. Husband & dad w/ 3 amazing kids. Goal is to remain adult in Washington. Working on Intel to keep USA safe & free. 🇺🇸🏳️‍🌈,https://t.co/TJD06OL7bP,M,D,NY,18.0
RepChrisStewart,1072008757,Utah and DC,"Utah's 2nd District Congressman. Former Air Force B-1 pilot, author, House Intelligence, Budget, & Appropriations Committees. Visit https://t.co/GUW6weAva6",http://stewart.house.gov,M,R,UT,2.0
RepTedYoho,1071900114,,Representing Florida's 3rd Congressional District; large animal veterinarian; conservative business owner; Member of @HouseForeignGOP  & @HouseAgGOP Committees,https://t.co/9wBRsUS6FX,M,R,FL,3.0
RepSchneider,1071840474,Illinois,Proud to represent the people of Illinois's 10th Congressional District,http://t.co/sVfHx7ZP,M,D,IL,10.0
SenatorFischer,1071402577,,U.S. Senator and Cherry County rancher working to bring some Nebraska common sense to Washington,http://t.co/0O49SY7v,F,R,NE,
RepHuffman,1071102246,California's North Coast,Congressman for California's North Coast. On Facebook at https://t.co/a4QfL2Jw5p.   Listen to my brand new podcast at https://t.co/XDE8MuHKxF,http://t.co/1EuZeNQsh6,M,D,CA,2.0
RepLaMalfa,1069124515,Northern California,"Representing California's First District including Siskiyou, Shasta, Tehama, Butte, Glenn, Modoc, Lassen, Plumas, Sierra, Nevada and Placer Counties",http://t.co/zhUYypSZHQ,M,R,CA,1.0
RepDennyHeck,1068499286,"South Puget Sound, WA","Proudly representing #WA10 in Congress. Husband, (gran)dad, @GonzagaBulldogs fan & #12thMan.  Serves on @HouseIntel (#FollowtheFacts), @FSCDems, and @JECDems.",https://t.co/MntdmHywxT,M,D,WA,10.0
SenAngusKing,1068481578,,News from the office of Independent U.S. Senator Angus King of Maine. Operated by the Press Team. Following/retweeting does not equal an endorsement.,http://t.co/i9TZOoGqOm,M,,ME,
RepWalorski,1065995022,,Representing Indiana's Second Congressional District,http://t.co/1c3JNm0kJ5,F,R,IN,2.0
TulsiPress,1064206014,,"Aloha - Official account of Rep Tulsi Gabbard (HI-02), managed by staff. (Use of TG's military rank, title, or photo do not imply Army or DoD endorsement.)",https://t.co/v6vyBxswOs,F,D,HI,2.0
RepDougCollins,1060487274,"Gainesville, Georgia","Working for Georgia's 9th Congressional District. Pastor, attorney, military chaplain. Ranking Member of @JudiciaryGOP.",https://t.co/6yvc1EfV0T,M,R,GA,9.0
RepMullin,1060370282,Oklahoma,Father of six. Small business owner. Honored to represent Oklahoma’s conservative values in Congress. https://t.co/0jHkAECORk,https://t.co/Qv5teppuYQ,M,R,OK,2.0
RepDerekKilmer,1058917562,,"Representing Washington's 6th District in the House of Representatives           
Facebook: https://t.co/Q846OoBuMH
Instagram: https://t.co/4fkuLkAa0e",http://t.co/Gxq1ZBnp,M,D,WA,6.0
RepAnnieKuster,1058717720,NH's 2nd District,Honored to serve the people of New Hampshire’s Second District in Congress.,http://t.co/1ApjVskz3y,F,D,NH,2.0
SenDuckworth,1058520120,,"Official Twitter account for U.S. Senator Tammy Duckworth. For more information, visit",https://t.co/LDObT9hkrZ,F,D,IL,
RepHolding,1058460818,,Raleigh native representing North Carolina's 2nd district in Congress.,http://t.co/zH2CxxmUzu,M,R,NC,2.0
RepTomRice,1058345042,,Former CPA and tax lawyer. Proudly representing South Carolina's 7th Congressional District. Find me on FB at https://t.co/1YXogZ4l3N.,http://t.co/S6o0ATa6,M,R,SC,7.0
TXRandy14,1058051748,"Friendswood, TX",Representative for the 14th Congressional District of Texas. https://t.co/3YiUH3WeW6 | Instagram: TXRandy14,https://t.co/8FFRq1l3TV,M,R,TX,14.0
RepJoeKennedy,1055907624,,"Official Twitter account of Congressman Joe Kennedy III, representing Massachusetts' 4th Congressional District.",https://t.co/rYNEysanC2,M,D,MA,4.0
RepLowenthal,1055730738,"Long Beach, CA",Proudly serving California's 47th Congressional District. http://t.co/pHmhAyCM6J,http://t.co/0MV3JJn9EM,M,D,CA,47.0
RepAnnWagner,1051446626,"Ballwin, MO",Official Twitter account for Congresswoman Ann Wagner-- proudly Representing the 2nd Congressional District of Missouri https://t.co/6TKCrqRcSw,https://t.co/tFjsHUzj16,F,R,MO,2.0
RepGraceMeng,1051127714,,"Representing NY's 6th Congressional District - Parts of West, Central and Northeast Queens.

For specific questions or concerns, please contact my office.",http://t.co/P1ajY4Fn,F,D,NY,6.0
SenKevinCramer,1048784496,,Representing the great people of North Dakota in the United States Senate.,https://t.co/M4l7PNHhUi,M,R,ND,
RepDanKildee,1045110018,Michigan,"Honored to represent Michigan's Fifth Congressional District. Born & raised in Flint. @HouseDemocrats Chief Deputy Whip. Proud husband, father & grandfather.",https://t.co/XBl61H6hY5,M,D,MI,5.0
RepMarkTakano,1037321378,"Riverside, CA","Proudly Representing California's 41st District. Chairman: @VetAffairsDems. Member: @EdLaborCmte, @USProgressives, @LGBTEqCaucus, and @CAPAC.",https://t.co/deOAwy64tV,M,D,CA,41.0
RepLipinski,1009269193,,Proudly representing the people of Illinois' 3rd Congressional District. Follow me on Facebook at https://t.co/oqe6Q8PbEE,https://t.co/QEykShdHO4,M,D,IL,3.0
RepDelBene,995193054,,U.S. Congresswoman representing Washington's 1st Congressional District (#WA01),http://t.co/qnvcd0Kg,F,D,WA,1.0
RodneyDavis,993153006,"Taylorville, IL",Proudly representing #IL13 and marginalized Nickelback fans everywhere. Leader of @HouseAdminGOP and member of @TransportGOP and @HouseAgGOP.,http://t.co/foaAG4Df,M,R,IL,13.0
RepDaveJoyce,976969338,"Washington, DC","Father, husband, and former prosecutor proudly representing #OH14",http://t.co/w7lVGg29p2,M,R,OH,14.0
RepThomasMassie,975200486,,"U.S. Rep for KY's 4th District, Chairman 2nd Amdt Caucus, Political Science Denier, Greenest Congressman, MIT '93 SB, '96 SM #sassywithmassie",https://t.co/WWJJaM6jJD,M,R,KY,4.0
SenWarren,970207298,,"U.S. Senator, Massachusetts. She/her/hers. Official Senate account.",http://t.co/wsbNrrUt,F,D,MA,
SenTomCotton,968650362,,U.S. Senator proudly serving the state of Arkansas.,http://t.co/gR93LLUqRV,M,R,AR,
RepMarkMeadows,963480595,"Jackson County, NC","Businessman, husband, and father proudly representing North Carolina's 11th Congressional District. Former Chairman of @freedomcaucus.",https://t.co/NrTi758TXL,M,R,NC,11.0
RepAndyHarrisMD,960962340,Maryland's First District,"Proud to represent MD-01; Anesthesiologist; Dad to Joe, Becky, Irene, Jessica, & Danny; Grandpa to Charles, Abigail, Arthur, Andrew, Camilla, James, & Sylvia.",https://t.co/LI7VqoSoP7,M,R,MD,1.0
RepBera,950783972,"Elk Grove, California","Father, husband, doctor. Proudly representing Sacramento County in the House of Representatives #CA07. 

Chair @HouseForeign Oversight & Investigations Subcmte.",https://t.co/sQPbW1JPOd,M,D,CA,7.0
SenatorHassan,946549322,,"New England sports fan, mom, crossword enthusiast, former governor, U.S. Senator for New Hampshire.",https://t.co/BxeyYfMTaA,F,D,NH,
RepSwalwell,942156122,"East Bay, CA & DC (CA-15)","Husband & Papa to Nelson/Cricket. CA Congressman @HouseJudiciary/@HouseIntel. Promise of America: if you work hard, you do better & dream bigger #FreedomToDream",https://t.co/tq8A1WWg2Y,M,D,CA,15.0
MikeKellyPA,935368364,"Washington, DC",U.S. Representative Mike Kelly proudly serves the people of Pennsylvania's 16th District (#PA16) and is a member of the House Ways & Means Committee. 🇺🇸🇺🇸,https://t.co/O8oPMeVTSn,M,R,PA,16.0
