tweet_id,text,created,retweet,user_id
1196103200698335233,"Harmful algal blooms endanger public health, hurt businesses &amp; decimate our waterways. While we've made great progress this year to prevent toxic discharges from Lake O through operational change, I’m working with @RepStephMurphy to find more long-term solutions to combat HABs. https://t.co/e8xb93BSz6",2019-11-17 16:30:00,False,814103950404239360
1196137174552334336,We cannot let partisan politics get in the way of passing a bipartisan budget. I introduced the NOPE Act to hold lawmakers accountable and withhold members' salaries if a budget is not passed. #AZ01 https://t.co/ah9rYlQbJm,2019-11-17 18:45:00,False,808416682972770304
1196135222556995584,"We need to end solitary confinement, and that includes ICE's inappropriate use of it with detained individuals. I introduced a bill last week with @SenatorDurbin to combat the rampant and unnecessary use of solitary confinement in ICE operated and ICE contract facilities.",2019-11-17 18:37:14,False,803694179079458816
1195862498634862595,"Earlier this week, the Supreme Court heard arguments in a case that will determine the fate of DACA. Let me be clear about one thing: there shouldn’t be a “left” or “right” when it comes to protecting DACA recipients. There is a right and wrong. Period. #HeretoStay",2019-11-17 00:33:32,False,803694179079458816
1195836266388115456,"Gracie and Dominic had so much life to live. Instead, their lives were senselessly cut short by gun violence this week at Saugus High School.
 
Say their names. Remember them. We can’t let this be our normal. https://t.co/iDT2QnlhUI",2019-11-16 22:49:18,False,803694179079458816
1196140697750929414,"Open enrollment health care for 2020: Deadline to sign up for coverage starting January 1, 2020 is December 15. Sign up now at https://t.co/DUiMb7alzc 
#GetCovered",2019-11-17 18:59:00,False,796736612554117120
1196099425916948480,"On this day in 1800, Congress moved to Washington, DC from Philadelphia. My commute would have been heckuva a lot easier if it hadn't! (jk)",2019-11-17 16:15:00,False,4304448314
1195821845083230216,Today on @ANHQDC I discussed how @realDonaldTrump has worked to reverse the Obama Administration's mindset on the military so our nation's warfighters can be warfighters. He's got their six. https://t.co/GaPINzY3ZC,2019-11-16 21:51:59,False,4205133682
1196103941131505666,"#ICYMI Great news for McDonough County! I was pleased to announce that the @USDA awarded Illinois Cooperative Development Center at WIU grant funding to support their efforts to grow cooperative businesses in Illinois.
https://t.co/8FbXDTXNJx",2019-11-17 16:32:56,False,3686482216
1196102786221518850,Open Enrollment in Health Insurance Marketplace is open. Make sure you #GetCovered on @HealthcareGov for 2020 &gt;&gt; https://t.co/73tbz09rTK https://t.co/JGFcXaV83N,2019-11-17 16:28:21,False,3122099613
1196094644284579840,"Honor Flight is a non-profit organization that helps veterans fly to Washington, D.C. in order to visit the memorial of their respective war. I was honored to support this Honor Flight fundraiser in #Eldorado. Thanks for your service! https://t.co/Gm5ncMstpI",2019-11-17 15:56:00,False,2976606250
1195876708643196928,The #Oshkosh Empty Bowls event is a community fundraiser for Oshkosh food pantries and meal programs with food from local restaurants. I'm always glad to support both local businesses and charities! https://t.co/sql33U6KBW,2019-11-17 01:30:00,False,2976606250
1195829900051017728,This was from the Veterans Day Dinner last weekend in #FDL. Thanks to everyone for your service! https://t.co/0BUjEFlWbS,2019-11-16 22:24:00,False,2976606250
1196067692991696896,"This week we heard very important facts during the public hearings of the impeachment inquiry. I paid close attention.

While they did their work, I had a busy week working on lowering Rx drug prices, investigating vaping illnesses, &amp; building coalitions to act on climate change.",2019-11-17 14:08:54,False,2970279814
1196119305382965249,I am proud to hold a 100% score on this year’s Humane Scorecard put out by @HSLegFund! https://t.co/XgzTjQIr6R… https://t.co/ncEFtklkiF,2019-11-17 17:33:59,False,2968007206
1195868480526008328,Hey #AZ07 - Miss today’s #TownHall? Don’t hesitate to send me a message or call my office to let me know what’s on your mind or how my staff and I can help you. https://t.co/VMWfFOUrP7,2019-11-17 00:57:18,False,2966570782
1195828051969544193,I’ll be joining @TheRevAl on @MSNBC at 5:30 ET to discuss the impeachment proceedings. Tune in!,2019-11-16 22:16:39,False,2966570782
1196141144293421057,"Thank you @tbcmtairy in Mount Airy, North Carolina for the privilege to speak at your Civil Service Sunday honoring our First Responders. Always grateful to be in Surry County! https://t.co/iT9LQYNxTi",2019-11-17 19:00:46,False,2966205003
1196145057373536259,My public lands bill would let local schools &amp; communities benefit from new renewable energy projects nearby. ⬇️,2019-11-17 19:16:19,False,2964949642
1196115028790792192,A big thank you to the @ASU Sun Devils who stepped in to take action! https://t.co/cTGl86nAhO,2019-11-17 17:17:00,False,2964949642
1195816311005294593,"My staff and I always try to move heaven and earth to assist any veteran having issues with a federal agency, and I am proud we’ve closed thousands of cases on behalf of North Carolina veterans. 

Contact us at (919) 856-4630 or visit https://t.co/v0damv9fpe for assistance. https://t.co/6HGASow5ol",2019-11-16 21:30:00,False,2964174789
1196100358000594952,"The President is lying.

American consumers pay the costs of these tariffs. American taxpayer money funds these government bailouts for farmers hurt by Trump’s trade wars, not China. https://t.co/xaN9EaWYY5",2019-11-17 16:18:42,False,2962868158
1195822189121015808,"Jennifer Williams, an aide to Vice President Mike Pence, testified under oath that what President Trump said on his Ukraine call was “inappropriate.” https://t.co/0v50zfxtfz",2019-11-16 21:53:21,False,2962868158
1195875340951937024,A @CreditCardsCom study found South Dakotans handle their finances better than any other state. Another thing the rest of the country could learn from us! #hifromSD https://t.co/9UpFVmDCus,2019-11-17 01:24:34,False,2955485182
1196054052347547649,"Thanks, @RepMikeJohnson! Here’s to a rematch before long #RollTide https://t.co/QCj1P7fH7B",2019-11-17 13:14:42,False,2861616083
1196147896527269889,"It’s past time we modernize family leave policies to serve the needs of parents &amp; families in today’s world. My FAIR Leave Act addresses some of the shortcomings of the FMLA to provide more comprehensive and effective leave for Iowa families.
https://t.co/xKqoQZqs2q",2019-11-17 19:27:36,False,2856787757
1195880032197107713,I’m deeply saddened by the passing of Chief Justice Mark Cady. He was a devoted public servant who loved the people of our state and the judiciary. Chief Justice Cady’s life was marked by service and he will be missed by so many.,2019-11-17 01:43:12,False,2856787757
1196078570663231488,"Looking forward to discussing the latest developments in the Democrats’ impeachment inquiry at 10 a.m. ET on @FoxNews, following the first week of open hearings. https://t.co/za9vdTkqn4",2019-11-17 14:52:07,False,2847221717
1196133029313466369,"The answers yesterday by OMB's Mark Sandy, at the latest closed door impeachment depo, re the hold on $ to Ukraine, definitely didn't fit Schiff's fairy tale bribery narrative...not by a long shot. This transcript &amp; all other transcripts MUST be released BEFORE the next hearing. https://t.co/iu5vnp6mxF",2019-11-17 18:28:31,False,2750127259
1195890022848876545,"With a great American, @RepMarkMeadows, after the latest impeachment circus depo today back in Schiff’s Capitol basement bunker. Dedicated, career staffer Mark Sandy at OMB came to answer about the hold on aid to Ukraine. His response made for a deserved bad day for Democrats. https://t.co/vVxBVoEQ4C",2019-11-17 02:22:54,False,2750127259
1195827084461060096,"Just finished the depo of OMB staffer, Mark Sandy, in Schiff’s Capitol basement bunker. He came in to testify about why there was a hold on aid to Ukraine. His answer was very bad for Schiff’s fairy tale. This transcript needs to be released BEFORE the next public hearing on Tue!",2019-11-16 22:12:48,False,2750127259
1196129278737301504,"The #GOPTaxScam forced actors &amp; stagehands – most of whom are middle class – to pay MORE in taxes.

I talked to @TheGabrielle_C &amp; @AEAPresident about how to fix the #GOPTaxScam so these individuals can make a living without being unfairly taxed for their necessary work expenses. https://t.co/Xgm9IhOHCw",2019-11-17 18:13:37,False,2371339658
1196101803374452742,"The witnesses who've come forward are dedicated public servants, and they all have said the same thing: the President's actions were wrong. They are patriots. https://t.co/cGMHZQHp62",2019-11-17 16:24:27,False,2293131060
1195830367753822208,NEW today from the @HouseIntel: Release Morrison and Williams Transcripts as Part of Impeachment Inquiry | Permanent Select Committee on Intelligence  https://t.co/mGMCkkAUdv,2019-11-16 22:25:51,False,1880674038
1195815968280203264,"White nationalists like Stephen Miller should not be allowed anywhere near the White House. 

It is no surprise that this administration’s immigration policies are inhumane and based on racist rhetoric.

As a member of Congress, I ask that Miller resign immediately. https://t.co/oLHV4qoL1w",2019-11-16 21:28:38,False,1260172386
1196057289112924160,"While we continue the important work of gathering the facts for the impeachment investigation, we must not forget that there is a humanitarian crisis at our border. Thank you @hasanminhaj @patriotact for reminding us of Trump’s cruel &amp; inhumane immigration policies. https://t.co/92bPGp8n8x",2019-11-17 13:27:34,False,1222257180
1195879513948905473,"🚨 Time is running out 🚨 

Open enrollment ends December 15! 
Go to 👉🏽 https://t.co/kdryumDc8x and make sure you #GetCovered https://t.co/XxtD9Mbzbz",2019-11-17 01:41:09,False,1222257180
1196108270135644161,"Schiff controls who testifies.

Schiff controls how Republicans use our question time.

Schiff controls what gets released from his secret depositions.

Schiff shuts out witnesses who would contradict his one-sided narrative.

This is what Pelosi is calling fair? It's a sham. https://t.co/c8gDlO1QE7",2019-11-17 16:50:08,False,1209417007
1195819281855975430,The Annual Fallen Heroes Tree of Honor Dedication in Peoria is such a moving tribute to our Gold Star families &amp; their loved ones who paid the ultimate sacrifice in defense of the freedoms and values we all hold dear. https://t.co/mHo3r4wBrH,2019-11-16 21:41:48,False,1092979962
1195889291253223424,Congratulations to the Operation Recognition Class of 2019 for recently receiving the recognition you earned decades ago through your selfless service to our country.  https://t.co/LKK5SApfc5,2019-11-17 02:20:00,False,1089859058
1195826124942716928,"Our nation's seniors spend their whole lives paying into Social Security, but often have to fight to get the benefits they've earned. If you are struggling to navigate any federal agency, call my office at (760) 424-8888 to find out more about how we can help.",2019-11-16 22:09:00,False,1089859058
1196144995486642176,.@Centerpoint4Hpe partners with first responders and health providers to offer Arizonans on-scene emergency help after natural disasters. Congratulations on a successful first year. https://t.co/Mw118Sgj1u,2019-11-17 19:16:04,False,1080844782
1195870944826462208,"Avondale: Meet our team for mobile office hours if you're having issues with Social Security, Medicare, or any federal agency. We're here to help:
📅 Thursday, Nov. 21
⏰ 2-3:30pm
📍 Avondale City Hall, 11465 Civic Center Dr (Find upcoming dates: https://t.co/kMlhkvkgxH) https://t.co/8cfofWtq23",2019-11-17 01:07:06,False,1080844782
1195816934618681344,Tucson's Catalina Village Assisted Living provides seniors with quality care and affordable housing. Our team proudly celebrated its Commitment to Quality award from @ahcancal. https://t.co/FMYmfKdNNl,2019-11-16 21:32:29,False,1080844782
1196117322563497985,"If the GOP wants to talk about how the kids of powerful people benefit from their parents’ officeholding - I’m happy to have that conversation.

We just need to invite Donald Trump Jr., Eric, Ivanka, and Jared to join it. https://t.co/erJSX1TY6t",2019-11-17 17:26:07,False,1072467470
1196112159660527617,"House Res. 660: “Only the chair and ranking minority member, or [counsel]...may question witnesses during such periods of questioning. At the conclusion of [this] questioning...the committee shall proceed with questioning under the 5-minute rule.” @EliseStefanik @RepAdamSchiff https://t.co/sJXVj5R4Ux",2019-11-17 17:05:36,False,1072467470
1196108914930208768,"Wow, what nonsense. @EliseStefanik was cynically breaking the house resolution, which permits only the ranking member or counsel to use the opening 45 mins. Later, she got her 5 mins like everyone else. https://t.co/6bEAmbFxOd",2019-11-17 16:52:42,False,1072467470
1196106975542689792,"This morning, on @ThisWeekABC I asked my colleague @RepChrisStewart if he’d join me in calling on @StateDept to produce the mountain of evidence - emails, notes, call records, calendar entries, etc. - they’re sitting on.

His answer: “You bet.”

@SecPompeo, what more do you need? https://t.co/mMdhBhH7HC",2019-11-17 16:45:00,False,1072467470
1196103288241954817,"Quid pro quo is Latin for bribery.

Trump’s use of taxpayer-funded military assistance to pressure a foreign leader into helping his reelection campaign IS solicitation of a bribe.

And bribery is an impeachable offense in the Constitution. There’re no ifs, ands or buts about it. https://t.co/SQOOf8B4Vg",2019-11-17 16:30:21,False,1072467470
1196067219341479937,"#SundayMorning with @GStephanopoulos talking Amb. Yovanovitch, David Holmes, next week’s open hearings &amp; more. Now on @ThisWeekABC - tune in. https://t.co/8rFSD9x5iE",2019-11-17 14:07:01,False,1072467470
1196059535485607937,Kicking off Sunday with @GStephanopoulos @ThisWeekABC. Tune in. https://t.co/PKNX94yvtf,2019-11-17 13:36:29,False,1072467470
1196063526441410563,Joining @GStephanopoulos on @ThisWeekABC. Don’t miss it. https://t.co/HC6aXvNz7f,2019-11-17 13:52:21,False,1072008757
1196101707090006016,"Richard Lugar was an American patriot and a true role model of civility and bipartisanship. He left behind a legacy of leadership, a legacy soon to be immortalized as he will be the namesake of a new destroyer is built by the good men and women of Bath Iron Works. https://t.co/VKcyXNb15Q",2019-11-17 16:24:04,False,1068481578
1196113793077727232,"Congratulations, Joshua! Keep following your dreams. 

https://t.co/OCOt2LDwT5",2019-11-17 17:12:05,False,1058917562
1195853312718987264,Part of what makes our region so unique is the amazing military veterans we have in our communities. I deeply appreciate the men and women I was able to meet this morning at the U.S. Navy Submarine Veterans in Bremerton to thank them for their service. https://t.co/cqfC67RBb7,2019-11-16 23:57:02,False,1058917562
1196076445732364288,"The strength of our nation comes from our diversity. This Trump Admin proposal would allow discrimination against LGBTQ youth in foster care – it’s cruel, mean-spirited and will cause harm to countless young people.

https://t.co/vWHp8tkwnW",2019-11-17 14:43:41,False,1058520120
1196134658091581440,"This week I was proud to see the House pass numerous bills to support veterans and servicemembers. From protecting the rights and benefits of women who serve, to strengthening the GI bill, to supporting veteran entrepreneurship, to improving management and care at the VA.",2019-11-17 18:35:00,False,1055730738
1196067213737775105,"We saw the evidence play out again and again: President Trump undermined our interests, acted corruptly, and worked to extort the Ukrainians to meddle in our election. His behavior was not normal. It left us less safe and threatened our democracy.",2019-11-17 14:07:00,False,1055730738
1195804734046621696,"If we don’t accept the facts about climate change, we can’t take vital action to solve this very real problem. Climate change causes instability, conflict, and without question, drives refugee flows. https://t.co/V6ty8iR2Ye",2019-11-16 20:44:00,False,1055730738
1196131818346561537,"Stood with Korean American leaders to highlight the importance of my Divided Families Reunification Act, which seeks to help Korean American families reunite with loved ones in North #Korea. The measure was recently passed by @HouseForeign and now heads to the full House! https://t.co/rPlO1cUFLc",2019-11-17 18:23:43,False,1051127714
1195805635285270528,Racial slurs have no place anywhere in our society. The comment made by this Community Education Council member cannot be tolerated. We must all stand up and denounce this disgusting and unacceptable language. https://t.co/9JwRFUjhhx,2019-11-16 20:47:35,False,1051127714
1195883319315042304,"The NW Straits Region is an integral part of #WA’s economy &amp; our PNW way of life. Thank you @NWStraits for inviting me to speak about the importance of research, community activism, &amp; precious marine habitats at the 21st annual MRC Conference. #2019mrcconference #SuzanShowsUp https://t.co/owISj8qKPZ",2019-11-17 01:56:16,False,995193054
1195821871989690370,So thankful for @Housing_Hope and the work they do to help #SnohomishCounty. Thank you for the tour of the new HopeWorks Station II &amp; for showing us how you help hardworking families access affordable housing and gain the skills to help them achieve a living wage career. https://t.co/UfDxkpU4G6,2019-11-16 21:52:06,False,995193054
1195860391668146177,Congratulations to St. Teresa on their first ever volleyball state championship! https://t.co/PbeAZfNpEP,2019-11-17 00:25:10,False,993153006
1195838961756839937,"We have created a situation of dependency in the Middle East where any withdrawal will be considered 'untimely' by the establishment in Washington, D.C. At some point, we have to start correcting these mistakes.

Watch the video below from a recent hearing on US policy in Syria: https://t.co/VN3B7VBCFJ",2019-11-16 23:00:00,False,975200486
1195861504131784705,The Iranian people are tired of the regime ignoring their basic needs while funneling vast sums to terrorists throughout the Middle East. We must stand with the brave protestors demanding accountability from the ayatollahs.,2019-11-17 00:29:35,False,968650362
1196137577146925057,I am one of them. I called for impeachment the day @realDonaldTrump told @GStephanopoulos he would again take help from a foreign government to win an election. That was June. Little did any of us know he was already trying to do that with Ukraine. https://t.co/8hRP8bIIfg,2019-11-17 18:46:36,False,942156122
1196113123410886656,I’m pleased to see @HouseGOP  @RepChrisStewart has joined @HouseIntel Dems in demanding @realDonaldTrump &amp; @StateDept turn over all subpoenaed Ukraine documents. Innocent people cooperate. The guilty don’t. https://t.co/dl3xTBsGgb,2019-11-17 17:09:25,False,942156122
1195865653003075587,You. You threatened to have him murdered. You changed. https://t.co/dXNcPtv7mA,2019-11-17 00:46:04,False,942156122
1195867501168668672,.@AC360 asked me a thoughtful question last night on why Holmes’ testimony is not hearsay. The reason is that his overhearing Trump’s admission about Biden investigations is admissible under the Federal Rule of Evidence 801 as a party admission. Trump’s admission is not hearsay.,2019-11-17 00:53:25,False,771152516
1195815496911904771,".⁦@BarackObama⁩ humility in saying he would not run the same race as 2008 &amp; that Dems should push for more than the ACA speaks to his unrivaled depth as a leader. He gets the American story is about a continual push, despite setbacks, for progress. https://t.co/fj1DICg4q6",2019-11-16 21:26:46,False,771152516
1196111009846562816,Idaho's abundant outdoor recreation opportunities that make our great state a desirable place to live and raise a family. https://t.co/JWyyX7Ccb8,2019-11-17 17:01:02,False,600463589
1196080801881952260,"Idaho has much to offer on #NationalHikingDay. With over 19,000 miles of hiking trails, it is a great way to see our incredible state! Get out and go hiking! https://t.co/AugtNZv1IU https://t.co/CDTdhLHBGZ",2019-11-17 15:00:59,False,600463589
1195884353517174791,#ExposeTheTruth https://t.co/rUw5mtxuoP,2019-11-17 02:00:22,False,584912320
1195883940726358018,#TruthMatters so does the #RuleOfLaw https://t.co/0TCTVMFoOx,2019-11-17 01:58:44,False,584912320
1196140446189178880,"Thanks to Army veteran Jeff Loeks who has served our community &amp; our country in many ways over the course of his career. This award is well deserved – congratulations!
https://t.co/zWwBUEEe5X",2019-11-17 18:58:00,False,516880804
1195857582079873025,Thousands of U.S. service members suffer from heat-related illnesses each year – right here at home on U.S. military bases – and it’s getting worse. We must #ActOnClimate to ensure that our military members can safely complete their training &amp; missions. https://t.co/sip1XPZuZf,2019-11-17 00:14:00,False,516880804
1195832261360390144,"Who knew tomorrow is National Baklava Day? And after having the baklava at Aleppo Sweets in Providence, who wouldn’t celebrate every day like it's #NationalBaklavaDay https://t.co/UXM3b9XEol",2019-11-16 22:33:23,False,486694111
1196054350784794625,"Trump to Louisiana: You’ve got to give me a big win, OK?

Louisiana to Trump: Get Lost.

Still waiting for that Impeachment Inquiry backlash #BlueWave.
 https://t.co/RaXlXA4WYc",2019-11-17 13:15:53,False,467823431
1195857011033948160,"Thanks to everyone who came out to our Service Academy Day in Howard Beach!

America is great because we are good.

And the school gymnasium today was filled with good young men &amp; women ready to serve our country. 

🇺🇸🇺🇸🇺🇸 https://t.co/abozcNsoLv",2019-11-17 00:11:44,False,467823431
1196098419246403585,"Our police, firefighters &amp; other public employees are indispensable members of our communities, and through my bill #HR4540, we will ensure their retirement protections. I'm meeting today w/ #Springfield Retired Police &amp; Fire Association to give an update on my bill to fix #WEP. https://t.co/6M6x7Qbr1Y",2019-11-17 16:11:00,False,442824717
1195862177250512897,"The initial report from @EcologyWA is just 5 gallons of crude oil spilled into Fidalgo Bay. Thank you to all local, state &amp; federal agencies &amp; refinery workers for responding quickly to the situation &amp; preventing the spill from impacting the shore &amp; wildlife. https://t.co/b8GaDYBLVY",2019-11-17 00:32:15,False,404132211
1195805481815683072,"⁦@austinramzy⁩ story in ⁦@nytimes⁩ outlining the brutal and ruthless detention efforts of the Chinese Communist Party and Xi Xinping and their despicable treatment of the Uighur population in Xinjiang province.
https://t.co/eQXKE9K0iQ via @NYTimes",2019-11-16 20:46:58,False,404132211
1196101816808808448,So excited to join the rest of Louisville in cheering on @LouCityFC to a 3-peat in the @USLChampionship Final tonight! #ForTheCity,2019-11-17 16:24:30,False,384913290
1195810837405032448,"Today at @IndBeefAssoc_ND’s annual meeting, I outlined efforts to help our ranchers &amp; #NDag producers weather challenges by advancing disaster assistance &amp; securing additional access to markets including #USMCA. https://t.co/z7ZiEvQ99Y",2019-11-16 21:08:15,False,382791093
1195804635468050434,"Thank you to our incredible judging panel for coming out to help me select my Service Academy nominees! Being able to make these nominations is an honor and a privilege &amp; it is a responsibility I take with the utmost seriousness. Thank you, panel, for your knowledge &amp; expertise! https://t.co/GeuqWNFNlH",2019-11-16 20:43:36,False,381152398
1196134402389987328,Let's remember Trump's targeted ag bailout has already cost more than twice the auto industry bailout of a decade ago - which saved the American car industry and returned all the money to the treasury. This is just money down the drain to hide effects of his trade war. https://t.co/4Vx4MauoJ4,2019-11-17 18:33:59,False,334894942
1196133501084418048,Trump tweeted 32x today.  Clearly stressing over damning impeachment evidence from admin witnesses; another big election loss in Louisiana; courts ordering release of tax returns; $2M penalty for charity fraud; yet another crony going to prison... &amp; more to come. #JusticeIsComing,2019-11-17 18:30:24,False,334894942
1195963380827217920,Trump loses again. America rising. https://t.co/w326A783Rg,2019-11-17 07:14:24,False,334894942
1195962951007498240,Truth. https://t.co/Kxo6B6esaO,2019-11-17 07:12:42,False,334894942
1195851583184965632,Here's a principled patriotic thing we can all do and it only takes 5 Seconds: follow @TedraCobb https://t.co/8LTmtmo9Hh,2019-11-16 23:50:09,False,334894942
1195850967117266944,Right on. https://t.co/bVjJbFOZZu,2019-11-16 23:47:43,False,334894942
1196067137468674053,Former TTB Administrator John Manfreda was a wonderful man with whom I had the great honor of working with on issues facing our wine community.,2019-11-17 14:06:42,False,303861808
1195904934266494976,Great way to kick off the holiday season in Sonoma Valley at tonight’s Tree Lighting! https://t.co/Ox2rO4OUMW,2019-11-17 03:22:09,False,303861808
1195870528105570305,Joined my friend Hakeem Brown for a Town Hall to discuss issues impacting our local Vallejo community. Thank you to everyone for your engaging and thoughtful questions. https://t.co/X1UXdxQh76,2019-11-17 01:05:26,False,303861808
