tweet_id,text,created,retweet,user_id
1192568198585040896,"Small businesses are the driving force of NV’s economy, &amp; many of them are run by veterans or help veterans succeed as they transition into the civilian workforce. 

Glad to cosponsor bipartisan legislation that passed the Senate recognizing National Veterans Small Business Week. https://t.co/sbWXmpk8AF",2019-11-07 22:23:10,False,818554054309715969
1192548709927653376,"🚨  It’s time to sound the alarm. 

We need serious action to tackle the climate crisis now. 

This can’t wait.

https://t.co/xzUWTo0nC3",2019-11-07 21:05:43,False,818554054309715969
1192523522876362753,Thrilled my team could join @NvComm4women in unveiling Nevada’s new license plate commemorating the 100th anniversary of the #19thAmendment and women’s suffrage! https://t.co/JqcHiApZEs,2019-11-07 19:25:38,False,818554054309715969
1192530030120853505,"Pleased to join our grandson, Cameron, at his school for lunch today in honor of Grandparents Day. https://t.co/ACzA6l8iDr",2019-11-07 19:51:29,False,818472418620608512
1192890336818978817,"Yesterday I toured the @AmericanAir Base Maintenance Hanger and Training Center at @CLTAirport. 

AA employs over 1,000 #NC13 residents and creates $160 million in economic impact for our community. https://t.co/gguBY8OkB4",2019-11-08 19:43:13,False,817138492614524928
1192853309197037568,"I spent this morning at @HighPointU’s 9th Annual #VeteransDay Celebration with my dad.

The keynote speaker, @LeonLeeEllis, is a retired Air Force Colonel and Vietnam POW. We thank him for his message today and his service to our county. 🇺🇸🇺🇸🇺🇸 https://t.co/rtSbdLCO8z",2019-11-08 17:16:05,False,817138492614524928
1192542685376262147,"Today I had the incredible honor of giving the keynote speech at a @USCIS Naturalization Ceremony in Charlotte.

We welcomed 68 new citizens from 33 countries. Participating in events like this one renews your faith in our great country. #NewUScitizen https://t.co/hvTLmnKvro",2019-11-07 20:41:47,False,817138492614524928
1192868341645492224,Delighted to join the Church World Service ⁦@CWS_global⁩ to recognize its efforts to assist immigrants and refugees in #NY13 and around the world. https://t.co/kT72qsg1M6,2019-11-08 18:15:49,False,817076257770835968
1192850723249311744,"My heart is saddened by news of the passing of Joshua Jones who worked with me in the NYS State Legislature for nearly a decade. Joshua was joyous and friendly and we will never forget his kindness. Rest In Peace, dear friend. We will never forget you. https://t.co/AbzvjBTj1c",2019-11-08 17:05:49,False,817076257770835968
1192830111319568384,"As we close out #VeteransSmallBusinessWeek, I want to recognize those that serve our country in the military then continue to contribute by starting a business. I’m proud to support these military heroes by fighting for programs that make it easier for their #Vetbiz to thrive. https://t.co/0K6BSptZfp",2019-11-08 15:43:54,False,817076257770835968
1192829967568125959,"Veterans are vital to our communities and economies. As we close out #VeteransSmallBusinessWeek , I want to recognize the hurdles vets face when trying to transition from service to business. I'm committed to making sure that vets have the resources needed to thrive in #smallbiz. https://t.co/FTHxxOksDi",2019-11-08 15:43:20,False,817076257770835968
1192531104256921600,"We stand in solidarity with Juan Quispe, a long-time resident of our community, to demand equal, accessible &amp; fair housing treatment. Housing is a fundamental right &amp; overcharging residents for accommodations to meet the magnitude of his disability is preposterous and abusive. https://t.co/cohTq7tsH1",2019-11-07 19:55:46,False,817076257770835968
1192528168768409600,"I’ll be hosting my next Congressional Conversation on Friday, November 22nd at 6 p.m. in Dover. This event will be held at the Martin Luther King Jr. Student Center on the campus of @DelStateUniv. 

Registration ⬇️⬇️⬇️
https://t.co/sAz6FUIS9Q",2019-11-07 19:44:06,False,817050219007328258
1192676569308790784,Day 1 of #CHCtoHollywood our delegation met with leaders in Hollywood who are working to increase Hispanic representation in TV and film. We must support and help each other to overcome obstacles Latinos face so they have equal access to opportunities. https://t.co/Mn6ndjNKse,2019-11-08 05:33:47,False,816833925456789505
1192605751140708352,"Thanks to @seiuusww for hosting today’s critical Town Hall on #TPS. @HouseDems #ForThePeople agenda made TPS a priority. We passed #HR6 to provide TPS projections, now we need the Senate to Act! Watch the recap on #Telemundo. https://t.co/lJgf5NpFQr",2019-11-08 00:52:23,False,816833925456789505
1192566442886959105,Great to see the amazing work of @Eisner_Health Center team. Saw their dental &amp; medical facilities and a baby wellness class this morning. Their work is critical for communities to access health care services; that’s why we must renew long-term community health center funding. https://t.co/wr3MQYmdAg,2019-11-07 22:16:11,False,816833925456789505
1192523265035493379,"Watch today’s critical #townhall, hosted by @SEIUUSWW, regarding Temporary Protected Status (#SaveTPS) and the humanitarian crisis at the southern border. It starts at 1:00pm PST and I’ll be appearing around 2:00. Watch the live stream on @Telemundo here: https://t.co/7zEH58eKpc",2019-11-07 19:24:37,False,816833925456789505
1192565511839719425,"Thinking big pays off!
About a yr ago I started promoting the concept of building a rocket on Long Island. I introduced @launcher CEO &amp; founder Max Haot to USAF leaders at a conf I spoke at in NYC. Now, Launcher has recvd a $1.5 million award/contract at the USAF Space Pitch Day. https://t.co/VrOdvpCKTF",2019-11-07 22:12:29,False,816705409486618624
1192893906284957696,"Sen. Shelby &amp; I made a friendly bet on the LSU-Alabama game. Sorry, @SenShelby. The only way we’re losing this one is if they use those refs from the Saints playoff game. Go ahead &amp; send along that Concecuh sausage you promised to send me after LSU wins. https://t.co/mM8QZCUzrR",2019-11-08 19:57:24,False,816683274076614656
1192534794632126466,"As director of @ONDCP, Jim Carroll is on the front lines of the opioid crisis advocating for those struggling with addiction &amp; implementing policies to stop the importation of illegal drugs. I appreciate the great work he has done in Louisiana &amp; across the country. https://t.co/CH0DA6cppP",2019-11-07 20:10:25,False,816683274076614656
1192851627222265856,"Members of the @freedomcaucus have been integral in setting up the defense for @POTUS @realDonaldTrump &amp; advocating for it. We are ensuring that Americans know about the Democrats’ continued efforts to harass, impeach, &amp; remove our duly elected President. https://t.co/Y39HXEUxG9",2019-11-08 17:09:24,False,816652616625168388
1192634474586001409,"#TBT to when Adam Schiff told the American people that the “whistleblower” would testify “very soon.”

Now, it’s no longer politically expedient or advantageous to hear from this individual - especially after yesterday’s revelation about his attorney. https://t.co/U3USkSMuRU",2019-11-08 02:46:31,False,816652616625168388
1192622121626693633,"Congrats, @broomheadshow. Here’s to many more years on air. #AZ05 https://t.co/tc8iZ7RBMe",2019-11-08 01:57:26,False,816652616625168388
1192589800244686848,"This week, my office hosted a successful event for seniors in #AZ05. Special thanks to our emcee, @JeffWeninger, Mayor @KevinHartke &amp; representatives from @SocialSecurity, @IRSnews, @ChandlerFire, &amp; @uscensusbureau for participating.  Team effort. https://t.co/D9nBA4GcGf",2019-11-07 23:49:00,False,816652616625168388
1192524728881336320,"File this away under the things that Democrats don't want the American public to understand in their quest to impeach the President ➡️

"".... @POTUS @realDonaldTrump's Ukraine policy has been an improvement over President Barack Obama's."" @ByronYork

https://t.co/547J7UnzNV",2019-11-07 19:30:26,False,816652616625168388
1192883988555124737,The desperation in the Republicans’ impeachment strategy is staggering. Today they are trying to pin all the blame on Mulvaney. They will throw anyone under the bus to save Trump. https://t.co/dKDgeNAKjk,2019-11-08 19:18:00,False,816298918468259841
1192868889090084864,"Under my bill, 2.9 million uninsured Californians could gain health care. https://t.co/LpZu8qpobe",2019-11-08 18:18:00,False,816298918468259841
1192791593838886912,"While the GOP continues to obstruct progress in DC, my new bill will empower states to have bold leadership and establish their own successful universal health care programs. This step will prove our #MedicareForAll movement is ready for the whole country. https://t.co/Qcc8KCvA74",2019-11-08 13:10:51,False,816298918468259841
1192606409499783169,"Honored to accept this award from the American Academy of Allergy, Asthma &amp; Immunology. I will continue to fight for food allergy research funding to improve the lives of so many Americans dealing with allergies. Thank you to Will, one of my legislative aides, for his hard work. https://t.co/Kxpb4BiEim",2019-11-08 00:55:00,False,816298918468259841
1192579482000875520,"Average price for a year’s supply of a specialty drug: 

2009: $17,838

2019: $52,486

No one should spend their entire paycheck on their prescriptions.",2019-11-07 23:08:00,False,816298918468259841
1192538210129203200,"The United States spends more than $3.2 trillion on health care, but millions of Americans are still one emergency room visit away from going bankrupt. 

The system is broken. Let’s fix it with #MedicareForAll",2019-11-07 20:24:00,False,816298918468259841
1192527388787142656,"We have to convince people that technology is going to be a force for good in their lives, not a force of disruption. When Trump says ‘let’s go back to the past,’ I am here to fight for the future. https://t.co/JRKTnqa17J",2019-11-07 19:41:00,False,816298918468259841
1192824922386714624,"This week, I met with doctors at Covenant Health Radiology Diagnostics to discuss how we can improve our healthcare system in a way that best serves the #WestTexas community.

W/ the expertise &amp; care these physicians provide, #Lubbock continues to be a medical hub for the region. https://t.co/thSDExwMRu",2019-11-08 15:23:17,False,816284664658874368
1192898164442972160,"Happy #FeelGoodFriday! I am thrilled to see that @suffolkvafire has honored their Deputy Fire Chief, Ted Adams with the Fire Chief's Award of Excellence. Thank you for your brave work to make your community a safer place. 
https://t.co/xhkB73JnX9",2019-11-08 20:14:20,False,816181091673448448
1192804003282903040,"🚨ICYMI: According to over 11,000 scientists from around the world, we are in a climate emergency. We must do more to combat climate change and protect our health, economy and the lives of future generations https://t.co/lQUD85lHih #ActOnClimate  🚨",2019-11-08 14:00:10,False,816181091673448448
1192550654742536196,Today @InnovAge PACE Richmond opened a new center in Manchester. I am thrilled that our community has a beautiful new building where members our of senior population can come to socialize and receive clinical services they need while continuing to live in their own homes. https://t.co/aqQMp6ziYN,2019-11-07 21:13:27,False,816181091673448448
1192810691863994368,"One year ago, California experienced its deadliest and most destructive wildfire.

#CampFire took 85 lives and burned over 150k acres of land. I’m thinking of those who lost their loved ones and homes, and I'm grateful to the first responders who showed up in the face of danger.",2019-11-08 14:26:44,False,816157667882373120
1192569352744316929,"The Trump admin marked #NationalAdoptionMonth by proposing a rule allowing @HHSGov foster programs to turn away LGBTQ+ people.

Proud to cosponsor HR 3114, which will prevent this discrimination.

I can’t imagine not being able to raise my kids because of who I am or who I love.",2019-11-07 22:27:45,False,816157667882373120
1192569920242044928,We can’t talk about flood insurance without talking about affordability. Middle class Pinellas families deserve a National Flood Insurance Program that is strong AND affordable. Proud to lead the fight for you! https://t.co/3rye2fvlV4 https://t.co/WvgspTVJb6,2019-11-07 22:30:00,False,816030424778543104
1192851395898204160,"24 years ago, Jerusalem was recognized at the unequivocal capital of Israel. Thank you to @realDonaldTrump for moving the U.S. embassy to Jerusalem last year and reaffirming to the world our commitment to Israel! https://t.co/1PTsmgJlOF",2019-11-08 17:08:29,False,816012124505931780
1192563051024670720,"It is important we do everything we can to ensure our local law enforcement officers are supported. @TheJusticeDept grant not only supports our TN officers, but it provides resources to help combat the opioid crisis devastating families across our state.
https://t.co/S4W6MdY0aa",2019-11-07 22:02:42,False,816012124505931780
1192903696339865601,"25 years ago, California passed Prop. 187, a painful anti-immigrant law. 

Fighting Prop 187 compelled me to become politically active and to run for public office.  

Today, I am honored to represent Orange County as your Congressman and continue the fight in Washington. https://t.co/WosQlzsvQq",2019-11-08 20:36:18,False,815985039485837312
1192846516785946624,Great time in-studio this morning with Matt and Earl on @WTAQMorningNews to talk about a number of things happening in DC and Northeast Wisconsin. Thanks for having me! https://t.co/lo3ZDi17jh,2019-11-08 16:49:06,False,815966620300480514
1192827088795054080,"Thirty years ago tomorrow, the German people tore down the Berlin Wall. This triumph of freedom was not preordained. It took decades of bipartisan effort, in concert with our allies, to defend the free world.",2019-11-08 15:31:54,False,815966620300480514
1192806392102637568,Looking forward to joining @WTAQMorningNews with Matt and Earl at 8:15 am CT! Tune in here: https://t.co/98iZK1lhM6,2019-11-08 14:09:39,False,815966620300480514
1192594735229263875,"Hard to think of a better endorsement of my friend @TomTugendhat and his tireless work defending the interests of the free world. Well done to him and the entire Commons Foreign Affairs Committee. 

Read their outstanding report here: https://t.co/0RRcI7CCgp https://t.co/PDc3gctQZB",2019-11-08 00:08:36,False,815966620300480514
1192895091268050949,"Happy 90th Birthday to Bobby Bowden, who led FSU to victory in two national championships and twelve ACC titles during his coaching career. He is a legendary Nole! #GoNoles",2019-11-08 20:02:07,False,815952318487298048
1192847279222349825,The timber industry is vital to North Florida and unfortunately it took a hard-hit last year. Secretary Perdue’s announcement is welcome news. Our Florida foresters are our best environmental stewards and their livelihood depends on smart and sustainable conservation practices.,2019-11-08 16:52:08,False,815952318487298048
1192886982600466432,"Trump admitted to pressuring a foreign ally to investigate a political opponent. 

Dr. Hill &amp; Lt. Col Vindman both corroborate this betrayal of our national security. https://t.co/paJru4DdHJ",2019-11-08 19:29:54,False,815733290955112448
1192830313606664192,"Progressive state-level accomplishments fuel national change.
I'm proud to support @RepRoKhanna’s bill, building on my state-based universal health care bill from last Congress.
These efforts build grassroots momentum for bold, structural federal reforms through #MedicareForAll https://t.co/1UZCnsjlQB",2019-11-08 15:44:43,False,815733290955112448
1192573801516748801,"’Truly groundbreaking.’
 
This landmark decision is only a small respite for separated families, but essential in holding this Administration accountable for its malice.
 
https://t.co/HQ1FIqS1GF",2019-11-07 22:45:25,False,815733290955112448
1192532172294504449,"Proud that my push to fund the National Estuary Program will benefit ongoing Puget Sound recovery efforts led by state, local, tribal and federal partners in #WA

This program is essential to preserving our beloved salmon and orca for future generations

https://t.co/LLmiKIz20q",2019-11-07 20:00:00,False,815733290955112448
1192900514071109632,"Interested in working in a congressional office? We are now accepting Spring 2020 internship applications for Washington DC, Glen Rock, and Newton. Deadline is 11/22. Come join our team! #NJ5 #TeamGottheimer https://t.co/bDG5rTxN87",2019-11-08 20:23:40,False,815310506596691968
1192831527463399426,"Proud that North Jersey is continuing to claw back more of our federal tax dollars! More than $30,000 will be invested in boosting security for Sussex County's Board of Elections, helping ensure one of our most vital American rights -- our vote -- is protected. https://t.co/VGTPERcaqT",2019-11-08 15:49:32,False,815310506596691968
1192827377346318336,"#TeamGottheimer was honored to join the Hillsdale Fire Department Honor Ceremony. We honored Hillsdale's finest -- former Chief Franklin Gluckler for 60 years active service, former Chief William Butch Franklin for 50 years active service...(1/2) https://t.co/ES3zy4194u",2019-11-08 15:33:03,False,815310506596691968
1192537369603399680,"We must remain vigilant as terrorist organizations, like Hamas and Hezbollah, try to spread hate online. I’m glad that due to my work with @RepTomReed, @RepMaxRose, &amp; @RepBrianFitz, Twitter is finally taking steps to address terrorist organization presence on its platform.",2019-11-07 20:20:39,False,815310506596691968
1192902108296732672,"I spoke with students from Treasure Coast Classical Academy this morning about the importance of honoring those who keep our country safe. As we look toward Veterans Day, we are reminded of the servicemembers living in our community who have all sacrificed so much for our nation. https://t.co/zTanyDF502",2019-11-08 20:30:00,False,814103950404239360
1192822314234261504,"It’s been 50+ years since the last American has stepped foot on the moon. With the help of local companies like Smith Interconnect, I’m confident we can reach NASA’s goal of landing the first female astronaut on the moon by 2024 as a part of the Artemis lunar exploration program. https://t.co/X9j4vJnzon",2019-11-08 15:12:55,False,814103950404239360
1192539720024113153,"I joined Governor DeSantis this week as he launched a new website to help increase transparency when it comes to our waterways, including Lake Okeechobee and the St. Lucie River. You can check it out here! → https://t.co/Aj4h0AH5CX",2019-11-07 20:30:00,False,814103950404239360
1192871129280593920,I’m joining Nevada Health Link certified health insurance broker Alberto Ochoa for a conversation about how Nevadans can sign up for health care on @NVHealthLink. Watch live here⬇️ https://t.co/AOSX2CdTOw,2019-11-08 18:26:54,False,811313565760163844
1192860441313193984,.@WilsonElser’s WAVE is doing great work to help women attorneys in NV by strengthening their skills &amp; providing them with career guidance. I was glad to speak with WAVE Makers today about my experience as an attorney &amp; the importance of fostering talent &amp; diversity in law https://t.co/nKBYlyXQKu,2019-11-08 17:44:26,False,811313565760163844
1192798851389890560,Educating our kids is the first step to combat intolerance and hate across our country. We need the bills like @SenJackyRosen’s Never Again Education Act to make sure students learn about how atrocities like the Holocaust happened so that history is not repeated https://t.co/QcB8keIkNa,2019-11-08 13:39:41,False,811313565760163844
1192647335140118528,.@HHSgov’s latest complaint is a step in the right direction and will make sure companies don’t profit endlessly from groundbreaking government research that has opened the door to HIV prevention drugs. https://t.co/CKwyZAbL9A,2019-11-08 03:37:37,False,811313565760163844
1192597401531568128,"When my grandmother was diagnosed w/ Alzheimer’s, my entire family took part in her care. I know just how important it is for caretakers to have necessary tools to support their loved one. That’s why I’m asking @CMSGov to educate families on planning services available to them. https://t.co/KQK7aqpo4X",2019-11-08 00:19:12,False,811313565760163844
1192581833843761155,"For Latino families living with Alzheimer’s, the privilege of caring for our elders can require more of us than we could ever imagine. Read about my efforts to support Alzheimer’s patients and their families ⬇️ https://t.co/dzfCZk0xs8",2019-11-07 23:17:20,False,811313565760163844
1192557693669724161,"Nevada is home to four minority-serving institutions: @unlv, @CSNCoyote, @NevadaState &amp; @tmccnevada. Each of these schools rely on critical funding that expired 36 days ago. https://t.co/4Cw4O4iIiY",2019-11-07 21:41:25,False,811313565760163844
1192555621847126016,"Right now, minority-serving institutions across the nation are in danger of permanently losing $255M in funding, including 4 in Nevada. We need to invest in the futures’ of the students who attend #MSIs by passing the #FUTUREActNow https://t.co/kFbkaLyuUT",2019-11-07 21:33:11,False,811313565760163844
1192551964451778560,"Minority-serving institutions, like @unlv @CSNCoyote @NevadaState &amp; @tmccnevada, are investing in our nation’s future leaders. I explain why it’s time for the Senate to pass @SenDougJones’ #FUTUREAct in the video below. WATCH ⬇ https://t.co/SgsFfKGgih",2019-11-07 21:18:39,False,811313565760163844
1192538535334690816,".@ABAesq found that interviewees said Lawrence VanDyke was “arrogant, lazy, an ideologue, and lacking in knowledge of the day-to-day practice including procedural rules.”

And this is who the Trump admin thinks is fit to serve the people of Nevada on the 9th Circuit? Disgraceful. https://t.co/RP6fV33cAL",2019-11-07 20:25:17,False,811313565760163844
1192875684047310852,"Earlier this year, I sent a letter to the Dept of Transportation requesting they prioritize BUILD grant funding for State Route 87 in #AZ01. When we invest in rural infrastructure projects we set our communities up for success and economic growth. https://t.co/3zKRC5bX8w",2019-11-08 18:45:00,False,808416682972770304
1192826612338835466,"WATCH: My wife Pat and I were honored to be a part of @Jumpstartkids #ReadfortheRecord initiative promoting the importance of reading to children. Today, I encourage you to make time to read to a child in your life. https://t.co/AqXFNa0gvO",2019-11-08 15:30:00,False,808416682972770304
1192615218364342274,"BEEP BEEP, it's your Congressman! I travel to every corner of #AZ01 to meet with constituents and hear about the different challenges our communities are facing. This year, I've driven over 12,000 miles for official business. https://t.co/foR7AaUbHw",2019-11-08 01:30:00,False,808416682972770304
1192566144223391744,"Last week, the House passed the Grand Canyon Centennial Protection Act, legislation I intro'd to ban uranium mining in &amp; near the Grand Canyon &amp; protect #AZ01 communities from the risks of uranium contamination. Read my op-ed on this important bill:  https://t.co/uT86bYapCj",2019-11-07 22:15:00,False,808416682972770304
1192808163139043328,My district team member Erica Fuentes participated in a Hispanic/Latino 2020 Census coalition meeting. We are committed with our partners to a successful and complete #2020Census count! https://t.co/86AVaAI6jF,2019-11-08 14:16:42,False,806906355214852096
1192560297527201793,George Kent and other State Department officers were trying to dislodge a culture of corruption in Ukraine and end Banana Republic rule there. Trump and Giuliani wanted to reinstate the corruption to help turn America into a Banana Republic. https://t.co/6MSIrWuzlz,2019-11-07 21:51:46,False,806906355214852096
1192558142758014976,"George Kent describes how Rudy Giuliani, operating as the President’s lawyer, conducted a relentless smear and propaganda campaign against our US Ambassador Yovanovitch. Trump and his henchmen viewed her as an obstacle to their corrupt schemes so they drove her from office. https://t.co/8Km2MwQt8q",2019-11-07 21:43:12,False,806906355214852096
1192556414587351040,"Another deposition confirms Trump’s shakedown of Ukraine to produce dirt on political opponents. In George Kent’s words, Trump’s goal was “nothing less” than to get President Zelensky to go to the microphone and say “investigations, Biden, and Clinton.” https://t.co/SKLK1jSw9T",2019-11-07 21:36:20,False,806906355214852096
1192552099772608513,Donald Trump blaming the whistleblower for his Ukraine shakedown is like Richard Nixon blaming Deep Throat for the Watergate break-in. https://t.co/aoDG9jCRID,2019-11-07 21:19:11,False,806906355214852096
1192810067759943680,Congratulations to @sctc_president and @SoCrescentTech for being among the top 20 Best for Vets Career and Technical Colleges for 2020! https://t.co/iSisxIZWZn,2019-11-08 14:24:16,False,806583915012046854
1192895892782796801,"Trump put a target on our Refugee Admissions Program from day 1 and has continued to tear down this program that defines the very heart of America.

We've had enough. We're demanding answers from the administration on the disastrous consequences of their actions.",2019-11-08 20:05:18,False,803694179079458816
1192807887472603136,"Working parents agree: it’s time we ensure they have peace of mind that their children are in a safe, enriching environment after school. My bill would do just that. https://t.co/aXkprK0N0K",2019-11-08 14:15:36,False,803694179079458816
