tweet_id,text,created,retweet,user_id
1203712842228211712,"In Congress, I worked to get legislation signed into law to stop the harassing robocalls we all receive. To learn more about this bill, the TRACED Act, click here to visit my website: https://t.co/PnY4hHmaTb",2019-12-08 16:28:00,False,816012124505931780
1203473906079805440,Congratulations to @MemphisFB on the big win tonight! #GoTigersGo,2019-12-08 00:38:33,False,816012124505931780
1203452446422556672,"This week, the impeachment saga continued and it is clear that the Democrats don’t want to hear the facts. I also am proud to announce that the TRACED Act, a bill I worked on to stop the harassing robocalls we all receive, passed the House. Catch up more on my week below. https://t.co/iDD2DRXz31",2019-12-07 23:13:16,False,816012124505931780
1203418534111563776,A great win today for @PeabodyTide! Congratulations on becoming back to back 2A State Champions!,2019-12-07 20:58:31,False,816012124505931780
1203368793231253505,"Congratulations to Dr. Karen Bowyer, president of @DyersburgState for your induction into the Tennessee Community College Athletic Association Hall of Fame! This is well deserved! https://t.co/iIte6BrPCQ",2019-12-07 17:40:52,False,816012124505931780
1203497593873018881,To be clear: I said baby yoda AND countering the CCP are the two things that unite the country https://t.co/eOLVZujTb4,2019-12-08 02:12:40,False,815966620300480514
1203429099995357184,"78 years ago today, more than 2,000 American servicemen and women lost their lives in the attack on Pearl Harbor. 

Today, we remember the service and dedication of all those who made the ultimate sacrifice on this infamous day. 

https://t.co/nV7TpeRT0l",2019-12-07 21:40:30,False,815966620300480514
1203714895822413824,"Our inhumane &amp; reprehensible detention system comes at a high moral cost. One year later, Congress still doesn't have any of the information we've requested on Jakelin Caal Maquin’s death. https://t.co/bFOa2DuEUC",2019-12-08 16:36:09,False,815733290955112448
1203673974867210240,"My #MedicareforAll bill covers:

✅ mental health, dental &amp; vision care
✅ comprehensive reproductive care
✅ long-term care services
✅ prescription drugs
❌ stolen jewelry

https://t.co/lTJpP7sX9g",2019-12-08 13:53:33,False,815733290955112448
1203471404211068928,"Today is a glorious day for Xiyue’s family! I'm beyond overjoyed for him—and his brave, loving mother, wife and son. 

And as a mother myself, I'm just so inspired by the resolve and perseverance of my constituent, Xiyue’s mom. https://t.co/84oVZrRT2N",2019-12-08 00:28:36,False,815733290955112448
1203465578029207558,"It’s a big step forward for justice that Dr. Shah has been granted a temporary release after four months of being detained without any due process—a clear violation of his human rights. 

Thread ⬇️
https://t.co/ajru2PrS1t",2019-12-08 00:05:27,False,815733290955112448
1203399702148001792,".@UW_MSoccer, congrats on an amazing season! I know it didn't go your way today, but you fought hard all season &amp; made us all so proud! #GoHuskies https://t.co/VRyREmVRW0",2019-12-07 19:43:41,False,815733290955112448
1203366527816404993,"Impeachment is a rarely used remedy, designed to guard against the most egregious abuses of power. The Constitution, the core facts in front of us &amp; the future of our republic require us to move forward. Every single day we have an unchecked President—our democracy is threatened. https://t.co/EFmaxhTQNz",2019-12-07 17:31:52,False,815733290955112448
1203749877458575361,"We must keep sounding the alarm on the State and Local Tax Deduction cap — and push to reinstate it and cut taxes.  The SALT cap has been hurting families, small businesses, and continues to reduce investment in our local services including first responders. (1/2)",2019-12-08 18:55:10,False,815310506596691968
1203694606325563392,#TeamGottheimer attended the Franklin Lakes Annual Christmas Tree lighting at Borough Hall hosted by Mayor Bivona and the council members. The ceremony was sponsored by the Franklin Lakes Public Library and the Borough of Franklin Lakes. (1/2) https://t.co/qklzxCjzsL,2019-12-08 15:15:32,False,815310506596691968
1203460141712117761,"This vote officially put to rest the splinter view of adding new conditions on defense aid to Israel and reinforces our historic commitment to preserving a two-state solution. (1/2)
https://t.co/KA6bAlTwS6",2019-12-07 23:43:51,False,815310506596691968
1203430551761432578,"The Voting Rights Act of 1965 made it possible for millions of people to gain access to the ballot box, who for too long had been left out. Voting is the bedrock of our democracy. We should take whatever steps possible to increase, not eliminate, access to the ballot. https://t.co/hYKGR8OMqo",2019-12-07 21:46:16,False,815310506596691968
1203381723754569728,"Today marks 78 yrs since the attack on Pearl Harbor, a day “which will live in infamy,” where the US lost thousands of brave servicewomen &amp; men. We also remember those lost this week in the tragic attack in Pearl Harbor &amp; we mourn with their families. #PearlHarborRemembranceDay",2019-12-07 18:32:15,False,815310506596691968
1203403807129927680,"We are a nation of immigrants and welcoming refugees has long been part of our identity, regardless of party. We must not abandon the legacy embodied by the beacon-handed statue Emma Lazarus called the ""Mother of Exiles."" https://t.co/RRXb51xJFW",2019-12-07 20:00:00,False,814179031956488192
1203720898936791043,"From #Toxic18 → #Clean19...check out the latest episode of the Tortured Coast to see how real operational change has made a huge difference for our communities!
https://t.co/V2Uz4MMyKT",2019-12-08 17:00:01,False,814103950404239360
1203411356147486721,"78 years ago, the course of our nation’s history changed forever. Today we remember the lives of those we lost at Pearl Harbor and honor the sacrifice of all those who answered the call to serve and defend freedom around the world during World War II. https://t.co/7GDVCeGq2U",2019-12-07 20:30:00,False,814103950404239360
1203726140407455752,".@YvannaCancela is right—skyrocketing drug prices are more than a “lifestyle” issue. We have to keep working to lower drug prices for Nevadans like Charlie &amp; Ashby, who are living w/ #type1diabetes &amp; whose parents fear they will be forced to ration insulin https://t.co/NaWq6Npb8J",2019-12-08 17:20:50,False,811313565760163844
1203496167784484866,Congratulations to all the @unevadareno students who are graduating this weekend! #PackPride,2019-12-08 02:07:00,False,811313565760163844
1203425108708061184,"There’s no justification for detaining pregnant women who don’t pose a danger to themselves or others. Under the Trump admin, they're being held in inhumane conditions. I’ll keep working to hold @DHSgov accountable &amp; advocate for safe alternatives for expectant mothers. https://t.co/JFI8nUeOCS",2019-12-07 21:24:39,False,811313565760163844
1203747319826530304,"My staff holds mobile office hours across #AZ01 to ensure that all constituents are able to access the services my office provides, regardless of zip code. Details for this week's mobile office hours below and on my Facebook page: https://t.co/TC7SFtzqp5 https://t.co/fGcDwe6eQo",2019-12-08 18:45:00,False,808416682972770304
1203437780111708161,"ICYMI: The lack of quality, affordable childcare in America has become a crisis that negatively affects our children's development &amp; our nation's economy. Read my op-ed about my work to address the ways in which this crisis is affecting #AZ01: https://t.co/rbWyoA6rSy",2019-12-07 22:15:00,False,808416682972770304
1203384931889508352,"Today, we honor and remember the brave Americans who lost their lives in the attack on Pearl Harbor. #PearlHarbor78 #AZ01 https://t.co/l5Gozg82ua",2019-12-07 18:45:00,False,808416682972770304
1203450846404579328,Many thanks to my excellent service academy interview panel for their hard work today! It is my honor to nominate 8th District high school students to join the U.S. service academies. https://t.co/vAKRv80Gbd,2019-12-07 23:06:55,False,806906355214852096
1203388382606503936,My district director Kathleen Connor joined @SenatorCardin and dozens of local farmers at the Agricultural Heritage Farm in Derwood for an informative discussion about agricultural growth and the industry’s importance to our state economy. https://t.co/r5vlsUdCxB,2019-12-07 18:58:42,False,806906355214852096
1203744521735090176,"Farmers in the Midwest are facing increasing flooding. Families have been devastated by hurricanes in the South and East. Firefighters in the West are battling wildfires almost year-round.

Climate change is here—and it will get worse if we don't act. https://t.co/OcqJDZdqux",2019-12-08 18:33:53,False,803694179079458816
1203485204905631744,"The gall of the White House to say this immediately after taking action to kick 700,000 Americans off of food assistance. https://t.co/pFfwO3FZoY",2019-12-08 01:23:27,False,803694179079458816
1203416571986808833,Trump arbitrarily ended a policy that effectively prohibited detaining pregnant women in immigrant detention facilities. This is abhorrent. Detaining pregnant women doesn’t make our country safer—it’s cruel and immoral. https://t.co/Qi1qWp49AA,2019-12-07 20:50:43,False,803694179079458816
1203381396313649152,"On the 78th anniversary of the attack on Pearl Harbor, we remember the more than 2,400 who perished that fateful day and the sacrifice of those who answered the call to serve because of it.",2019-12-07 18:30:57,False,803694179079458816
1203422110170959872,"Yesterday Officer Billy Clardy III was shot &amp; killed in the line of duty. He served as a law enforcement officer for 14 years. I extend my prayers and deepest sympathy to his wife, children, and family, and to the Huntsville Police Department and community. May he Rest In Peace. https://t.co/knZzmYV3pB",2019-12-07 21:12:44,False,798973032362606600
1203751094817640448,"Open enrollment health care for 2020: Deadline to sign up for coverage starting January 1, 2020 is December 15. Sign up now at https://t.co/DUiMb7rWXM 
#GetCovered",2019-12-08 19:00:00,False,796736612554117120
1203370839061803008,"This is unacceptable. The administration's decision breaks our nation's promise to military families.

https://t.co/h3X9XyyfQJ",2019-12-07 17:49:00,False,796736612554117120
1203445508573945857,"HAPPENING NOW 👇🏽 #RNDF #flapol 
https://t.co/jJ2qdaGn1u https://t.co/yCF6VZUjHu",2019-12-07 22:45:42,False,796183515998068736
1203374365590609926,"Tune in today at 5:40 p.m. ET/2:40 p.m. PT to listen to senior military leaders, @SenJoniErnst &amp; I discuss with @Kate_OKeeffe the impact that the ongoing U.S.-China trade war may have on our national security at this year's @ReaganInstitute #RNDF #FlaPol https://t.co/NzkUcNueI5",2019-12-07 18:03:01,False,796183515998068736
1203699610209935365,"#TokenTaxonomyAct is the nonpartisan solution our economy needs to regain competitiveness for the emerging Fintech economy. Current cosponsors:
@RepDarrenSoto D 
@RepTedBudd R 
@JoshGottheimer D 
@TulsiGabbard D 
@scottperry R 
@ericswalwell D 
@anthonygonzalez R
@RepJohnRose R",2019-12-08 15:35:25,False,742735530287304704
1203379905028866049,"Remembering those who lost their lives defending freedom 78 years ago, as well as the victims of senseless violence earlier this week. #PearlHarbor78 https://t.co/9JnCB6iFWX",2019-12-07 18:25:01,False,742735530287304704
1203692961478787073,"In 2010, the Dream Act was passed to protect young immigrants and to give them a fair shot at the future they deserve. As the son of an immigrant, I know our country has been, and continues to be, greatly enriched by new generations of immigrants. We must #ProtectTheDream. https://t.co/m1qqzkKSWA",2019-12-08 15:09:00,False,4304448314
1203709549326356480,".@glotwp won 1ST PLACE in its population group in the awards for #NationalNightOut!

The annual event held on Aug. 6 brought local law enforcement, @GloTwpPolice &amp; neighborhood watch groups together with residents for activities, bbqs &amp; more!

Thanks to all who made it a success! https://t.co/ibnnXaDd9s",2019-12-08 16:14:55,False,3122099613
1203430839738077184,"100,155 people in NJ's 1st District are enrolled in a Medicare Part D plan to cover their prescription costs.

It’s time to unlock lower prescription drug prices by finally allowing Medicare to negotiate prices directly with drug makers. #LowerDrugCosts https://t.co/mydnD5zzT0",2019-12-07 21:47:25,False,3122099613
1203367486357491713,"On the 78th anniversary of the attack on Pearl Harbor, we remember the brave servicemen &amp; women who died defending our freedom.

#PearlHarbor78 https://t.co/aUvx2RudxI",2019-12-07 17:35:40,False,3122099613
1203731278283104256,"Public servants—including Presidents, Members of Congress and Justices—take an oath to defend the Constitution, not a person, a party or an ideology. https://t.co/58qAcLg5y9",2019-12-08 17:41:15,False,3044993235
1203390706057916417,"Talofa, On National Pearl Harbor Remembrance Day, thankful for all who served, the many acts of courage, and American Samoa's ties to this history, including Tali Coleman https://t.co/97zOQm0kAj https://t.co/qWCASSDQov",2019-12-07 19:07:56,False,3026622545
1203742538244345857,"I recently toured #BeaverDam High School, where I saw their great facilities and classrooms and met with their top-notch teachers and students. https://t.co/dbs8k3jcDb",2019-12-08 18:26:00,False,2976606250
1203438283491094528,"Last week, I watched a great #Badgers win with my mom. I look forward to today's upset victory to take home the Big 10 title!

P.S. My nephew is Bucky Badger! https://t.co/qk3Lto3RVS",2019-12-07 22:17:00,False,2976606250
1203379395454353408,"The Hmong people have a large, wonderful  community in #WI06. They recently celebrated their new year and I was lucky enough to attend events in #Sheboygan and #Oshkosh. https://t.co/pKz1sEXKlv",2019-12-07 18:23:00,False,2976606250
1203737544493584388,".@RepAdamSchiff is deceiving Americans yet again for his own ends. 

Now he has phone records of opponents and is selectively leaking to fit his own manufactured narrative.

This snooping is a new and disturbing abuse of power, even for Schiff.
 https://t.co/afxJHU8wSE",2019-12-08 18:06:09,False,2975091705
1203668616836796416,".@SpeakerPelosi essentially said she's incapable of hate because she's a good Catholic. 

Yet, previously she claimed Republicans were filled w/ hate to impeach Bill Clinton.

So it's hateful to impeach Clinton (committed crimes) but not @realDonaldTrump (committed no crime)?! https://t.co/2TQIzXlpyT",2019-12-08 13:32:15,False,2975091705
1203410738989207552,"A day that will live in infamy, the attack on Pearl Harbor killed 2,403 Americans and wounded 1,143 others.

We honor &amp; remember their sacrifice — and the generation who stepped forward to avenge them.

Be grateful that we were blessed with the Greatest Generation. #PearlHarbor78 https://t.co/VCVfkiNYpk",2019-12-07 20:27:33,False,2975091705
1203752235953344512,Devastated to learn we lost Cameron Scott Walter from Richmond Hill in the attack in Pensacola. Our prayers are with the Airman Apprentice’s family and all those impacted by the attack. https://t.co/MvUsow5t0N,2019-12-08 19:04:32,False,2973870195
1203725039985557504,"Since 2011, @ARFTweets has assisted local veterans through the “Pets and Vets” program that trains rescue dogs to become service animals for veterans with PTSD, anxiety, depression, and more. On Saturday, they held their annual graduation ceremony for the program’s newest class! https://t.co/l3KnjP2Ras",2019-12-08 17:16:28,False,2968007206
1203531374998671360,"On December 7th each year, the beacon atop Mt. Diablo is lit in honor of the 2,403 American men and women who gave the ultimate sacrifice at Pearl Harbor. Today, our office paid tribute by participating in the annual lighting event held at Cal State East Bay. https://t.co/q67TpMnlDy",2019-12-08 04:26:54,False,2968007206
1203411174903042048,Today’s @HouseJudiciary report is clear - President #Trump abused the power of the presidency for his own personal and political gain. https://t.co/egAzGBpbg4,2019-12-07 20:29:17,False,2968007206
1203378269019619328,Today we remember the lives lost and sacrifices made at Pearl Harbor. https://t.co/VuaIxODpRc,2019-12-07 18:18:31,False,2966570782
1203514880638275585,https://t.co/IQVJyxlDXb,2019-12-08 03:21:22,False,2966205003
1203419705937190912,"ANNOUNCEMENT: Next Saturday, I will join the graduating class of @ECSU – one of North Carolina’s great #HBCUs – as their commencement speaker. I will guarantee each graduate that at some point in their lives they will face a level of adversity.",2019-12-07 21:03:11,False,2966205003
1203752807356088328,"The #USMCA would enrich the already strong working relationship between Arizona and Sonora to create more jobs and opportunities for our people. 

https://t.co/ZwzD7z5wcL",2019-12-08 19:06:48,False,2964949642
1203715451316002817,"Women who’ve answered the call to serve in our military are at risk of injury due to ill-fitting equipment. I joined @SenJoniErnst in introducing a bill to equip female service members with the best possible body armor.
https://t.co/sPT2wgkB3L",2019-12-08 16:38:22,False,2964949642
1203374826456522752,"We remember the crew of the USS Arizona including the 8 Arizonans who lost their lives on December 7, 1941. View from the USS Arizona Mall Memorial @uarizona today. https://t.co/j3G2157lAo",2019-12-07 18:04:50,False,2964949642
1203707614879719424,I signed onto this legislation to protect SNAP benefits for hundreds of thousands of Americans. Shame on those who would make them go hungry. https://t.co/32th7RpXgo,2019-12-08 16:07:13,False,2962868158
1203391134753607688,A beautiful day for the Scottish Walk! Happy holidays to everyone from the Beyers! https://t.co/LDKgVNgX59,2019-12-07 19:09:39,False,2962868158
1203437590638219266,"Earlier this year, I met with “Caesar,” a Syrian defector who risked his life to smuggle photographic proof of the atrocities committed by Bashar al-Assad and his brutal regime to the United States. https://t.co/ZJnd3JH5Lm",2019-12-07 22:14:15,False,2953974395
1203395899306708993,"The holiday season is the best time of year to give back to our community. Today I joined the @TheCentersAR Champions of Hope at the @arfoodbank to pack more than 2,744 kits full of nutritious food which will be delivered to Arkansas schools that the food bank serves. https://t.co/fUFZFiYdlF",2019-12-07 19:28:35,False,2953974395
1203742202402344961,Who Dat! https://t.co/g507HVCXxR,2019-12-08 18:24:40,False,2951574214
1203402552211116032,Good luck #lionup! https://t.co/545O1vClCx,2019-12-07 19:55:01,False,2951574214
1203401083986628608,Good luck @SouthernU_BR Jags! https://t.co/C3guhknjKW,2019-12-07 19:49:11,False,2951574214
1203404149062287371,Even this Yellow Jacket will be cheering “Go Dawgs” today. Good luck to @FrommJake &amp; @GeorgiaFootball in the #SECChampionship!,2019-12-07 20:01:21,False,2863210809
1203471061200908288,In just a few minutes I’ll be joining @SengCenter on @710KNUS to talk about impeachment. Listen live! https://t.co/HMnpoDWWjM,2019-12-08 00:27:15,False,2862577383
1203374844382994432,TUNE-IN: I’m getting ready to join @randycorporon on @710KNUS at 11:20am MT/1:20pm ET. Listen live: https://t.co/HMnpoDWWjM,2019-12-07 18:04:55,False,2862577383
1203459427665403904,"The bipartisan SECURE Act would expand access to retirement plans for Iowans across the state. Earlier this week, I met with @NAIFA members from #Iowa to discuss my efforts to get this important legislation across the finish line. https://t.co/YA8jgD7lDV",2019-12-07 23:41:01,False,2856787757
1203406981400289280,"December 7, 1941, a date that was to live in infamy, changed the course of history. From that terrible day our nation, together w/our allies, rose to the challenge &amp; ultimately defeated tyranny around the world. 78 yrs later, we remember our heroic servicemembers &amp; those we lost. https://t.co/8hs3ly6NiA",2019-12-07 20:12:37,False,2856787757
1203660503622524928,"Abuse of Power.

Now he's subpoenaing &amp; releasing the call records of attorneys, Congressmen &amp; journalists. 

There's no one on Capitol Hill more desperately &amp; dangerously trying to dig up &amp; exploit dirt on political opponents than Adam Schiff.

https://t.co/ljMBBcrxIb",2019-12-08 13:00:01,False,2750127259
1203388272514347008,"Fantastic work House Democrats splitting the House of Representatives in half with your partisan, left wing Israel resolution. The Palestinian Authority formally approves of your efforts yesterday. This is destructive stuff in dangerous times colleagues.
https://t.co/6HIg9w6mAK",2019-12-07 18:58:16,False,2750127259
1203736105880829952,Got a sneak peek of the naughty and nice list. No coal for me! https://t.co/HSKugHml8g,2019-12-08 18:00:26,False,2724095695
1203751088068820992,"Jakelin Caal Maquin died in @CBP custody 1 year ago.

She was only 7.

We are still waiting for accurate info from @ICEgov &amp; CBP regarding the NUMEROUS allegations of misconduct that resulted in her death &amp; the deaths of Mariee, Felipe, Juan, Carlos &amp; Wilmer.

#JusticeForJakelin https://t.co/rIXZr4xUiU",2019-12-08 18:59:58,False,2371339658
1203469745376264194,".@Eisner_Health is one of the many community health centers that provide affordable and accessible care to #CA34 residents.

Thank you to all the volunteers and participants of this year’s Winter Festival for serving our neighbors and keeping them healthy throughout the year. https://t.co/YSFizlbBTe",2019-12-08 00:22:01,False,2371339658
1203412198191616000,"Thanks to those who joined me at @ICSEastLA in #BoyleHeights today for my Coffee with Your Congressman event!

Always grateful for opportunities to speak directly with passionate people who care about the state of our country &amp; talk about what I’m doing to help #WorkingFamilies. https://t.co/spfpzQOo9N",2019-12-07 20:33:21,False,2371339658
1203385479195852801,"Today we remember the 2,300 servicemembers who lost their lives at #PearlHarbor 78 years ago.

It was a day that changed the course of our history. We also honor those who answered the call to serve their country in the days and years that followed. https://t.co/E9Dgt4exlx",2019-12-07 18:47:10,False,2371339658
1203715270776442880,Big wins yesterday for @MHSRedRaiders and @ClockerAD! Congrats to our #MA5 Super Bowl champs! 🏆🏆 https://t.co/7D1vhGPKzr,2019-12-08 16:37:39,False,2293131060
1203509387400224768,"On Dec. 7, 1941, 2,000+ Americans were killed at Pearl Harbor. We were thrown into a war that claimed hundreds of thousands more lives, but we emerged stronger &amp; more united than ever. Let us never forget the sacrifice of those who perished on that date which will live in infamy. https://t.co/qHXYrBGBI3",2019-12-08 02:59:32,False,2253968388
1203381925894926338,"What an honor to be with my wife Rebecca as she christened the new Alabama-built USS Mobile! Celebrating today with friends, family and the community was an unforgettable experience. Thank you to the workers at @Austal_USA who make the LCS program and this special day possible! https://t.co/asHmWXAX0w",2019-12-07 18:33:03,False,2253968388
1203402289307893761,Mayor Chuck Chiarello was a true public servant who dedicated his career to improving the lives of the people of Buena Vista Township. My deepest condolences to his family—he will be dearly missed.,2019-12-07 19:53:58,False,2167097881
1203708040723271680,"We thank the Trump admin &amp; Swiss officials for release of Xiyue Wang-a @Princeton graduate student-held prisoner in Iran. Having worked with his wife, Hua Qu &amp; spoken with her yesterday, I share her deep joy  and look forward to his homecoming. https://t.co/4WqxVjpNGU",2019-12-08 16:08:55,False,1289319271
1203710919756386305,"Adam Schiff is lying to the American people again.

He has 3,500+ pages of phone records on people—including the press—that he's selectively leaking for his own partisan political gain.

That's frightening, wrong, and yet another reason Schiff must testify. https://t.co/yyJWCINuVY",2019-12-08 16:20:21,False,1209417007
1203373424271339521,"Yesterday, all but 1 Republican voted against restoring the core of the 1965 Voting Rights Act.

@HouseGOP, please explain why a bill that will protect against racial discrimination at the ballot box is...bad?

Tip: make sure your complaints aren’t racist.
https://t.co/z6Bd90xuh0",2019-12-07 17:59:16,False,1206227149
1203389567732084737,"Over 2,000 Americans died at Pearl Harbor. The heroes of the Greatest Generation, like Poway’s Ray Chavez, embodied the true meaning of service. We should all salute and uphold the values and dedication exhibited by our WWII servicemembers and veterans. #PearlHarborRemembranceDay https://t.co/R4FbeZqZml",2019-12-07 19:03:25,False,1135486501
1203748920377139201,"With only one week left in the open enrollment period, I urge Illinoisans who receive their coverage through the individual market to review their health insurance options as soon as possible! Learn more at https://t.co/8HydY2mLQ4 ⬇ https://t.co/UPp45HW30L",2019-12-08 18:51:21,False,1092979962
1203501952992260096,The conditions of migrant detention facilities at our southern border are a breeding ground for a flu outbreak. We need the public health standards outlined in my humanitarian standards legislation to prevent future needless loss of life at our border. https://t.co/5CDhxVJSrR,2019-12-08 02:30:00,False,1089859058
1203456906213416960,"Thank you to the Prather, Walker, and McRae families from Indio and LaQuinta for visiting me in DC! Showing you the people's office was one of the best parts of my week. https://t.co/is62Y5W72W",2019-12-07 23:31:00,False,1089859058
