tweet_id,text,created,retweet,user_id
1197639109143138305,"Yesterday, the bipartisan legislation I authored with ⁦@RepDwightEvans⁩, H.R. 5146, “Unlocking Opportunities for Small Businesses Act of 2019,” was unanimously approved by ⁦⁦@HouseSmallBiz⁩. Learn more below: https://t.co/cWlWN7RZu1",2019-11-21 22:13:09,False,1083474782602125318
1197681098714763265,"I’m so proud that I was able to honor Sara for turning her personal tragedy into activism, her efforts will keep so many future children safe. In Congress, I am proud to represent so many young people like Sara who demand action to #StopGunViolence. https://t.co/u3MM0JSzdL",2019-11-22 01:00:00,False,1083472286089396224
1197616212211048458,"This week in @HouseScience, I chaired a subcommittee hearing on the development and implementation of @NOAA’s Earth Prediction Innovation Center (EPIC), which was created to consolidate our government’s efforts on weather modeling to make sure it is as accurate as possible. https://t.co/4O8N9yGsjt",2019-11-21 20:42:10,False,1083472286089396224
1197588491804258311,Happy birthday @SenatorDurbin! Thank you for being a tireless champion for Illinois families and being a great friend &amp; mentor.,2019-11-21 18:52:01,False,1083472286089396224
1197571406923522048,Health care and social service workers are over four times more likely than other workers to suffer injuries from workplace violence according to @BLS_gov.,2019-11-21 17:44:07,False,1083472286089396224
1197586759112101891,"Today on National Rural Health Day I spoke on the importance of Rural Health Care across America. 

We must act on health legislation that supports the development and accessibility of community health centers for these rural communities and ultimately save lives.
@HouseBlueDogs https://t.co/PPSM9r6cio",2019-11-21 18:45:08,False,1083469084648505344
1197682814809989120,Couldn’t join us at our town hall in Edmond on Sunday? Don’t worry — we’ll be back this Saturday for a Community Coffee. See you there! https://t.co/fPql85W8qV,2019-11-22 01:06:49,False,1083019402046513152
1197584705312509952,I am incredibly saddened to hear of the accident this morning at Vance Air Force Base. My thoughts and prayers are with the families and friends of the Airmen killed and the entire Vance AFB community.,2019-11-21 18:36:58,False,1083019402046513152
1197899582371516422,"Too often our focus is on Sunday's is what is happening on @MeetThePress rather than what is happening in the church pews or down the street. 

America isn't great because of what is happening in Washington, D.C. It is great because you--the American people. https://t.co/MLRkBR48Nl",2019-11-22 15:28:10,False,1082790600292925440
1197898606054903809,"Making Washington, D.C. as inconsequential as possible. 

That is what I aspire to do here as a member of Congress. That is not to say there aren't great things we can accomplish here, but because the greatness of this country lies outside of Washington. https://t.co/I4CH0xuR6L",2019-11-22 15:24:18,False,1082790600292925440
1197888743518228482,"#StateOfOurBorder
#EndBorderCrisisNow

https://t.co/AHKjsi7VC7",2019-11-22 14:45:06,False,1082790600292925440
1197873720322412544,"Designate these Mexican drug cartels FTOs. 

Read on: 

https://t.co/hI4hY9haz2",2019-11-22 13:45:24,False,1082790600292925440
1197809946923945985,"Since 2014, the amount of marijuana seized has decreased every year, while the amount of meth, heroin, cocaine, and fentanyl seized continues to increase.

.@CBP seized almost double the amount of cocaine in FY19 than in FY18.

#EndBorderCrisisNow
#StateOfOurBorder",2019-11-22 09:32:00,False,1082790600292925440
1197605568103485440,"What is going on in Washington? #ImpeachmentHearings 

What isn’t? 

- lowering healthcare costs to make it easier for American families to pay for healthcare 
- dealing with our $23 trillion debt 
- securing the border 

We are getting nothing done. Americans see it. #DoOurJob https://t.co/Zcg3Lnt6Pt",2019-11-21 19:59:52,False,1082790600292925440
1197590378616107008,"Too often, airlines blindside travelers with extremely high charges for basic services like increased baggage fees or sky-high cancellation fees. I introduced the FAIR Fees Act w/@RepCohen &amp; @SenMarkey to protect consumers from corporate price gouging.

https://t.co/xa5NOjw6Dc",2019-11-21 18:59:31,False,1082427779583541248
1197890229413265409,What the mainstream media won't show you about our President: https://t.co/m3b6oivnxy,2019-11-22 14:51:01,False,1082416697380913152
1197854836986974209,"LIVE RADIO ALERT 🚨 

Coming up at 7:45 AM with 
@eddeanradio 
to talk about impeachment. 

Tune in at AM 600 &amp; FM 101.1 or listen online here: https://t.co/zBjIae0jCF",2019-11-22 12:30:22,False,1082416697380913152
1197828317912563712,"LIVE RADIO ALERT 🚨 

Coming up at 6:09 AM with 
@MarcBernierShow
to talk about my recent bipartisan Korean War Veterans Memorial volunteer project &amp; the #USMCA. Tune in! 📻",2019-11-22 10:45:00,False,1082416697380913152
1197640528634011648,"Hi everyone!

I’m heading back to #GA06 after a busy week. #McBathMinute https://t.co/68WKz45bVz",2019-11-21 22:18:47,False,1082380458976051202
1197574827441303553,Honored to be able to share my story and grateful for the support of my colleagues in this fight to end gun violence. https://t.co/i51PqGj3Sq,2019-11-21 17:57:43,False,1082380458976051202
1197903001173798912,"🚨TODAY🚨 

Team Greg Pence is hosting Community Office Hours in Rushville! Come by to get help with federal agencies, grants, military academy nominations + more. 

1:30 - 3:00PM

Council Chambers
330 N. Main Street, Suite 200
Rushville, IN 46173

https://t.co/F9dyFIZyql",2019-11-22 15:41:46,False,1082369392229400576
1197587412911820800,"The #DoNothingDemocrats have answered the question: is pursuing a sham impeachment more important than serving the American people? Their infuriating answer: ""YES."" https://t.co/INDmb1zVD8",2019-11-21 18:47:43,False,1082369392229400576
1197893830680420352,"We must recognize that in this country we have a history of housing discrimination. 

#HomesforAll will prohibit ANY form of discrimination in public housing and guarantee housing as a human right. 🏘💪🏽",2019-11-22 15:05:19,False,1082334352711790593
1197636038975467527,"We haven’t made a large-scale investment in affordable housing since the New Deal. 

Since the 1990s, there has been an outright ban on new public housing—fueling the homelessness crisis. 

It's time we end that ban. 
It's time we guarantee #HomesForAll. https://t.co/5I7RitNTCg",2019-11-21 22:00:57,False,1082334352711790593
1197599583305715716,Proud to be one of the 107. 💪🏽 https://t.co/FWFH8H4PNP,2019-11-21 19:36:05,False,1082334352711790593
1197649848276787200,"Rather than pass the USMCA and deliver a fairer deal for Pennsylvania's farmers, the #DoNothingDemocrats wasted another day on their sham impeachment circus. 

It's time to pass #USMCAnow. https://t.co/FVtNxlnl3G",2019-11-21 22:55:49,False,1082311988926124036
1197862682994585601,"Taken far too soon, #JFK inspired us to look beyond ourselves to see how we can help others. Ask not what your country can do for you, ask what you can do for your country? https://t.co/Szj8sKn1ig",2019-11-22 13:01:33,False,1082086081238102018
1197847759853883392,Great substitute teachers are the backbone of our schools. Thank you to all of the professionals who fill the gaps in #CT05 classrooms and around the country! #AmericanEducationWeek #Reach #Educate #Inspire @NEAToday https://t.co/vznpcfYJ2p,2019-11-22 12:02:15,False,1082086081238102018
1197663444629110784,"CT is mourning the loss of leader in our state, State Representative Linda Orange lost her battle with cancer. She is known for being bright, passionate, and witty. Rest In peace.

https://t.co/SkBdEIMCmV",2019-11-21 23:49:51,False,1082086081238102018
1197629033237880850,"Help us celebrate lifetime #NewBritain resident, Anthony Rosenthal, who was honored for his service on the USS Witchita CA-45 during WWII. https://t.co/KnDQmQREOF",2019-11-21 21:33:07,False,1082086081238102018
1197620610173673481,Congratulations to the #Connecticut #FarmBureauAssociation on your 100th anniversary of elevating agriculture in our state and supporting farmers. #CFBA https://t.co/5eBBZGhmtm,2019-11-21 20:59:38,False,1082086081238102018
1197609088974303238,Meeting with the Early Childhood Community Advisory Council. Thank you for all your work to ensure our children &amp; families have the resources necessary for a successful future. #hayesinthehouse https://t.co/XklC9sLF2f,2019-11-21 20:13:51,False,1082086081238102018
1197572796928401410,I thank @RepJoeCourtney for introducing H.R. 1309 and leading the charge to get it passed. I have worked as a CNA and know that protecting caregivers should be important to all of us. https://t.co/UYP3aEVrKH,2019-11-21 17:49:39,False,1082086081238102018
1197640639476682753,"Appreciated Michelle Hee, prez of 1,000-strong Hawai’i State Assn of Letter Carriers, stopping by to discuss issues of concern to letter carriers nationally and at home, including their prep for Hawaii’s first uniform statewide vote by mail elections in ’20 (and they are ready!) https://t.co/f2RtyRtyWS",2019-11-21 22:19:14,False,1081350574589833221
1197600563665526787,"Here’s my floor speech today on introduction with my colleague @Rep_SteveWomack, senior Republican on the House Budget Committee, of our H.R. 5211, the Budget Sustainability Act. https://t.co/HBHi2R0pQ8",2019-11-21 19:39:59,False,1081350574589833221
1197635802207010816,"🚨I am excited to announce a $2.3 million grant for the Greenbrier Valley Airport! This investment will innovate our airport and keep travelers safe for years to come. 
https://t.co/10hYnUxR3o",2019-11-21 22:00:00,False,1081318716573470720
1197613151589548032,Cancer is a horrendous disease that touches us all in heartbreaking ways. This #WorldPancreaticCancerDay I am praying for all those affected. 💜,2019-11-21 20:30:00,False,1081318716573470720
1197599205382139911,"Be sure to stop in the @CongressionalAC Expo at @marshallu! There, students who submitted apps will be presenting to a panel of judges, and the winner’s app will be on display at the U.S. Capitol. https://t.co/CxmN6edL3T",2019-11-21 19:34:35,False,1081318716573470720
1197640701355470849,"Our nation’s veterans represent the very best of America, and they deserve our full support. 

Read more about my legislation to support our veterans and best leverage our resources for veterans’ care here:  https://t.co/NDJhXroYEe",2019-11-21 22:19:28,False,1081312310059253763
1197606863313014789,"Today, we celebrate National Rural Health Day! This day was established to emphasize the importance of rural America and recognize what’s being done to address its unique health care challenges.",2019-11-21 20:05:01,False,1081256295469068288
1197570719854551041,An outstanding Mississippian will turn 100 this week. Happy birthday to Mr. Louis Brinner! Thank you for your service to our state and nation. https://t.co/It0fhzztuU,2019-11-21 17:41:24,False,1081243468327018496
1197660350893772802,"I am committed to bold climate action and am proud to co-sponsor the 100% Clean Economy Act. See my full statement below:

https://t.co/AQYpX8P67q",2019-11-21 23:37:33,False,1081240074946252801
1197603014749626368,Our office attended the monthly Green Valley Council meeting this morning making sure every part of the district has access to our office and services to constituents. https://t.co/OZ3ZVGzxZB,2019-11-21 19:49:43,False,1081240074946252801
1197569270382841856,"Like I have said, humanitarian aid is not and never should be a crime. 
 
https://t.co/gMunV86mhU",2019-11-21 17:35:38,False,1081240074946252801
1197909096231579648,"This week, I joined House colleagues in passing legislation that would protect healthcare workers from workplace violence. Healthcare and social service workers are *four times more likely* to suffer serious workplace injuries than workers in other sectors.",2019-11-22 16:05:59,False,1081222837459996672
1197691770932473856,"Henhouse, meet fox. https://t.co/xxLzqhKyvI",2019-11-22 01:42:24,False,1081222837459996672
1197586274644844549,New @WellsFargo CEO Charles Scharf has said that he plans to address the Bank's years of consumer abuses and make things right by Wells customers. I'm asking him to put his money where his mouth is and refund millions of customers the money they're owed. https://t.co/QaiFXAWq13,2019-11-21 18:43:12,False,1081222837459996672
1197650898832515081,"#TeamCisneros attended the Buena Park 41st Mayor's Prayer Breakfast to celebrate the city &amp; #CA39 w/ Buena Park Mayor Art Brown &amp; his wife. TY to the community members, local leaders, business owners, law enforcement officers &amp; servicemembers for joining the celebration! https://t.co/GYKAEaOrmk",2019-11-21 23:00:00,False,1080986167003230208
1197620702192361473,"Today, I was proud to vote for the #WorkplaceViolence Prevention for Healthcare &amp; Social Services Workers Act. Caregivers suffer workplace violence at a much higher rate than other professions. We need to provide the protections they deserve &amp; promote safe working environments.",2019-11-21 21:00:00,False,1080986167003230208
1197572885147246595,A fully funded #Census2020 will help ensure #CA39 communities receive the investments and public services they need. I was proud to support H.R. 1865 to devote much-needed funding for a fair and accurate census. https://t.co/8ALUIJdtMq,2019-11-21 17:50:00,False,1080986167003230208
1197617921163497472,"As the brother of a nurse, I will always work to ensure every American has a workplace free of violence. That’s why I joined Democrats and Republicans to help pass the Workplace Violence Prevention for Health Care and Social Service Workers Act. https://t.co/zQLdu5jBef",2019-11-21 20:48:57,False,1080978331535896576
1197596667547009025,"In honor of #RuralHealthDay, I spoke on the House floor to urge congressional leaders to pass our Seeding Rural Resilience Act, which will expand mental health services in rural communities like ours and ensure people who are struggling know where to turn for help. https://t.co/8jYBIOxFds",2019-11-21 19:24:30,False,1080978331535896576
1197570011302432770,"Our rural communities are often left behind by a broken health care system that puts politics over solutions. On #RuralHealthDay, we are committed to our fight to ensure all New Yorkers have access to quality, affordable health care, no matter their zip code. https://t.co/MruB175Y2i",2019-11-21 17:38:35,False,1080978331535896576
1197657560372961281,NEW: Sen. Hawley sent letters to @HUDgov and the US attorney for the Eastern District of Missouri to begin investigations of public housing in the STL region after disturbing reports of mismanagement and unsafe conditions for tenants. https://t.co/ODzQWsCzon https://t.co/20mT82oibi,2019-11-21 23:26:28,False,1080960924687704064
1197621966104125440,"Sen. Hawley warned about a loss of community in our nation spanning age, income, region, and race that is helping drive the epidemic of deaths of despair as more people feel isolated and alone.

""What Americans need in this century is not less fellowship, but more."" https://t.co/4PyPmwBJ14",2019-11-21 21:05:02,False,1080960924687704064
1197910230740488192,Defending our democracy cannot be political--it’s time to put country over party. We cannot allow any President to use the office to invite a foreign gov’t to interfere in our elections. #DefendOurDemocracy https://t.co/YyO0Ma3fE2,2019-11-22 16:10:29,False,1080941062028447744
1197895736546992130,"Proud moment for South Florida! 🎨🎉 

Sureily Marestein, the winner of our #CongressionalArtCompetition, is representing our state in the #VotaConmigo Contest! Congrats &amp; good luck, Sureily! @UniNoticias @Univision23 https://t.co/BGgHW0NQnM",2019-11-22 15:12:54,False,1080941062028447744
1197666860021493761,"It’s undeniable that readily-available e-cigarette flavors like gummy bear, fruity cereal &amp; cotton candy are being used to get a new generation addicted to tobacco. I sent a letter to @POTUS w/ my colleagues requesting he ban these flavored products from the market. #TobaccoFree https://t.co/BGQ5DLUBPK",2019-11-22 00:03:25,False,1080941062028447744
1197636619525918721,People should be able to feel safe in their place of work. But health care &amp; social service workers are 4x as likely to suffer a serious #WorkplaceViolence injury compared to other careers. That’s why today I was proud to vote YES to pass legislation to protect those workers. https://t.co/S5EWFfiEUy,2019-11-21 22:03:15,False,1080941062028447744
1197594345949536256,Every day that a documented white nationalist remains in the White House advising the President is dangerous. Stephen Miller must resign. https://t.co/zkMgJMbLyb,2019-11-21 19:15:16,False,1080941062028447744
1197581692866834432,"Americans should be able to access health care no matter their zip code, but Floridians living in rural communities face unique challenges when it comes to getting the care they need. That’s why I am fighting every day to expand access to affordable health care. #RuralHealthDay https://t.co/wqY8LzUEv9",2019-11-21 18:25:00,False,1080941062028447744
1197716971883810816,"Dem debate last night: heavy on slogans and platitudes, light on charisma and realistic policy solutions. My thoughts: https://t.co/66LHY9kQ4z",2019-11-22 03:22:33,False,1080894931311431682
1197632930400669696,"The truth about Pelosi’s partisan drug pricing plan? It kneecaps innovation, which severely limits the ability of and incentive for American innovators to create new cures.
 
Watch @RepGregWalden and me explain how H.R. 3 = #fewercures https://t.co/2yQJQAZA07",2019-11-21 21:48:36,False,1080894931311431682
1197903232951103489,"American workers lost over 950,000 jobs thanks to NAFTA. More than 32,000 of those lost jobs were right here in Maine.

Now, the corporations responsible for outsourcing at least 225,000 jobs are pushing a trade deal they're calling USMCA to “replace” NAFTA. #mepolitics 1/4",2019-11-22 15:42:41,False,1080891667308298240
1197640238870540288,"When you represent one of the U.S.'s most rural districts, every day is National Rural Health Day. I’m working with providers in rural areas to find ways to increase access to care in #ME02. And 1 big barrier to access is the shortage of docs in rural Maine. #powerofrural #NRHD https://t.co/dpX7MjBQUI",2019-11-21 22:17:38,False,1080891667308298240
1197648851269750784,"I look forward every month to our Arizona Congressional Delegation breakfasts. Everyone comes for the free coffee and pastries, but stays for the bipartisanship! (P.S. @RepOHalleran joined too, he's the one behind the camera.) https://t.co/lOpJ35RzFF",2019-11-21 22:51:52,False,1080885078425784320
1197888265573085184,"9 AM: Join me as I speak with community members, local advocates, health experts, and elected representatives at the Rural Poverty and Health Equity Summit at @BAKcollege 
Delano. 

Can't make it? Watch the livestream: https://t.co/1HpvNMFCQk",2019-11-22 14:43:12,False,1080875913926139910
1197622380220170240,"Happy American Education Week! This week we recognize the educators, parents, and the support staff that make up our public schools. #AEW2019 https://t.co/zIIAnNg6f9",2019-11-21 21:06:40,False,1080875913926139910
1197646835193667585,I’ve heard from nurses in Iowa who were afraid for their safety when all they are trying to do is provide care. Proud to support #HR 1039 that combats #Workplace violence against our medical professionals. https://t.co/AVUWKovZY2,2019-11-21 22:43:51,False,1080865917377097728
1197673549076430848,Excited to be heading home today after a busy week in Washington – hope to see you around the Valley! https://t.co/YGTcQaIgFI,2019-11-22 00:30:00,False,1080851152151953410
1197620703098540032,"Thanks to all the hardworking doctors, nurses, and medical professionals who keep rural communities across the Central Valley healthy! https://t.co/lGdgH99346",2019-11-21 21:00:00,False,1080851152151953410
1197653441432170497,"🚨  New @USDA grants and loans will bring in over $32 million to improve water systems and wastewater services in Pueblo of Laguna, Lordsburg, and Truth or Consequences. https://t.co/4chNye1VZA",2019-11-21 23:10:06,False,1080830346915209216
1197629606813196289,"This #NationalRuralHealthDay, I'd like to thank our healthcare providers for all they do. Today – and every day in between – I'm fighting to prioritize the needs of our district's rural communities. https://t.co/8uwiENZQTI",2019-11-21 21:35:23,False,1080830346915209216
1197697276296224768,"Every woman, Indian Tribe, American should be mad about the Senate GOP’s attempts to shortchange our country by introducing a #VAWA that cowers to the #NRA and disparages Tribal Courts. https://t.co/Msnd9C1f7X",2019-11-22 02:04:17,False,1080695666760929280
1197672428488531968,"Proud to say we're ready for #100by50 with @RepMcEachin, @RepDebDingell, @repblumenauer, @ChelliePingree, and @RepPaulTonko. #ForThePeople #ActOnClimate https://t.co/xx5Ast0pBq",2019-11-22 00:25:33,False,1080695666760929280
1197668946142547969,Don't forget to drop by Senator Martin Heinrich and Health Care &amp; Open Enrollment Resource Fair tomorrow for free health screenings and assistance signing up for a health care plan. https://t.co/sPOHGmetvE,2019-11-22 00:11:43,False,1080695666760929280
1197576237197275136,"GOP Senators are cutting VAWA to pieces behind closed doors while falsely claiming that it won’t pass otherwise. 

The House’s strong bipartisan #VAWA that passed earlier this year will protect women across our country &amp; that’s the bill that needs to pass. #PassHB1585 https://t.co/DNdQ4aLAgS",2019-11-21 18:03:19,False,1080695666760929280
1197632800863723520,"There’s no place for a white nationalist in the White House.

#StephenMillerMustGo 

https://t.co/myGNmmxgyz",2019-11-21 21:48:05,False,1080587263132733442
1197618788675522560,"Yesterday Latinas made our voices heard across the country for #LatinaEqualPayDay.

We must continue to speak out every day until we finally close the pay gap that affects us the most.

For the good of our families and communities, we MUST close the Latina pay gap. #LatinaPower https://t.co/s9xAJFRz0W",2019-11-21 20:52:24,False,1080587263132733442
1197596769208717312,"Joined @RepZoeLofgren &amp; colleagues in @HouseJudiciary  to vote for the #FarmWorkforceModernizationAct.

Growing up on my family’s farm picking cotton, I know firsthand how hard it is to work on a farm.

This bill guarantees the dignity and respect of our nation’s farm workers. https://t.co/FzhEJdELJl",2019-11-21 19:24:54,False,1080587263132733442
1197611953151188992,"Housing insecurity is a public health crisis. The evidence is clear - if we do not invest in #HomesforAll today, we will pay the price in people’s health tomorrow. Proud to support my sister in service as she fights to create a new vision for public housing looks in America. https://t.co/tyx81kZ8Dy",2019-11-21 20:25:14,False,1080584229510172678
1197585304271634433,"Statement-T Thursdays. It’s a movement. 

@RepDebHaaland #ForThePeople https://t.co/sowlaosd67",2019-11-21 18:39:21,False,1080584229510172678
1197888048333303808,"You can access quality, affordable health care coverage for yourself &amp; your family. Ensure you have the benefits and protections you need to stay healthy &amp; thrive. Don't wait: open enrollment closes December 15th! https://t.co/4FDMtD6Djx",2019-11-22 14:42:21,False,1080573351914061825
1197650567658688512,"Apprenticeships are America's most successful workforce training program. That's why yesterday, I questioned the Department of Labor's Assistant Secretary for Employment and Training John Pallasch about why funds are being diverted away from Registered Apprenticeships. https://t.co/iwBIumrR6t",2019-11-21 22:58:41,False,1080573351914061825
1197594008656261121,"I had the distinct pleasure of meeting with Ilham Ahmed, President of the Syrian Democratic Council. We have to protect our Kurdish allies and uphold the promises we made years ago. President Trump is wrecking havoc in the region. https://t.co/1Dpt7bCMC8",2019-11-21 19:13:56,False,1080573351914061825
1197887416482353155,"If you need assistance with the VA, Medicare, the IRS, or other federal agencies, stop by the Wayne Municipal Building on Wednesday from 9AM-12PM. Our casework team will be there just before the Thanksgiving holiday! https://t.co/YTCD3ojadh",2019-11-22 14:39:50,False,1080569698536878081
1197605608066818052,"🤔 Can't make it to our town hall next week but have a question? 

🖱️ You can submit it here! We will be live-streaming on Facebook and reading questions from online throughout the night.

https://t.co/XPC4fqf8g3",2019-11-21 20:00:02,False,1080569698536878081
1197580267772350465,"It's #AmericanEducationWeek! 📚🏫 Thanks in large part to all our teachers and administrators, New Jersey has the #1 public school system in the country! Thank you #NJ11 educators for all you do to ensure that every child receives a quality education.

https://t.co/QTkAWS7wrY",2019-11-21 18:19:20,False,1080569698536878081
1197910305428381696,Good news for #IL14 farmers—propane is on the way! @FERC has announced that Illinois will receive emergency shipments of propane to help our farmers finish harvest and prepare grain for storage.,2019-11-22 16:10:47,False,1080539438508400642
1197589922116448256,"In the House, we have passed H.R. 8 &amp; H.R. 1112, bipartisan, common sense legislation to implement universal background checks that more than 90% of Americans support. It’s time for the Senate to take action. https://t.co/RYuV2PFsex",2019-11-21 18:57:42,False,1080539438508400642
