tweet_id,text,created,retweet,user_id
1194049892391501825,"After Sgt. Daniel Somers lost his life to suicide, @danielsparents made it their mission to improve care for American servicemembers. Read about their work: https://t.co/BfllMFEcjU",2019-11-12 00:30:53,False,1080844782
1193991818666483712,"Our new law, the LEGION Act, ensures veterans get the benefits they've earned. https://t.co/XFOUxmgnFX",2019-11-11 20:40:07,False,1080844782
1194280310617313281,"Like so many towns &amp; cities across the US, #HomeIsHere for #Dreamers in my community. They are our friends, neighbors, &amp; colleagues. It’s been 7+ years since President Obama implemented #DACA - now it’s time for Congress to #ProtectTheDream. https://t.co/e07zZvZLpl",2019-11-12 15:46:29,False,1080509366
1193954620269301760,"On Veterans Day, we honor those who have served our country to protect our freedom. Thank you for your service and happy Veterans Day! https://t.co/V8PXqGYIVu",2019-11-11 18:12:18,False,1080509366
1193958302255845377,"To our veterans in the 25th District of Texas and across the country, I want to say ‘Thank You’ for your courage. This generation and the next live freely because of your sacrifice. Have a blessed Veterans Day. https://t.co/qsgTEgLPFc",2019-11-11 18:26:56,False,1077446982
1194303972049379329,"Today, more than 150 rockets have been fired into Israeli communities by the Palestinian Islamic Jihad. I condemn these indiscriminate attacks that have injured civilians, &amp; fully support our ally Israel &amp; its right to defend itself against these attacks. https://t.co/FDhbzc1DKy",2019-11-12 17:20:30,False,1077121945
1194298815773364225,"Trump wants to end #DACA, breaking a promise to nearly 800,000 young people who are either students, serving in our military, or are working in a job contributing to communities across America. The Senate must pass the #DreamandPromiseAct to #ProtectDreamers. #HomeIsHere https://t.co/wekXxcVtOT",2019-11-12 17:00:01,False,1074518754
1194290743835348992,"Wisconsin is home to over 6,000 Dreamers and the House passed the #DreamandPromiseAct five months ago.

The Senate needs to take action and #ProtectDreamers. #HomeIsHere https://t.co/08qEcwVpyM",2019-11-12 16:27:56,False,1074518754
1194045683772379136,"I was pleased to be able to spend this #VeteransDay honoring our Wisconsin veterans and thanking them for their service.
 
Thank you to Madison Veterans Council and @GovEvers for hosting this morning’s Veterans Day Ceremony at the Capitol. https://t.co/LAklcrGpqZ",2019-11-12 00:14:09,False,1074518754
1193995097119100929,"There have been alarming incidents of veterans receiving inadequate care or mistreatment at VA medical facilities.
 
I’m calling on the VA to take action and get a handle on its shortcomings so our veterans receive the care they deserve. https://t.co/jaRHUvBi7E",2019-11-11 20:53:09,False,1074518754
1193948288900325376,"This #VeteransDay, we join together as one community to honor those who selflessly serve the American values we share and the American flag we look up to today. 

Thank you to all our veterans and their families for your service &amp; sacrifice.",2019-11-11 17:47:09,False,1074518754
1194304359066144775,Today marks 20 years since the @TAMU bonfire collapsed &amp; tragically took the lives of 12 students. May we unite as a community to honor &amp; remember lives lost that day. https://t.co/qGJ1fji6jk,2019-11-12 17:22:02,False,1074480192
1194286214548992000,Yesterday I was honored to join the @AmericanLegion Post 154 in recognizing our veterans and thanking them for their service at the City of Pflugerville’s Veterans Day Ceremony. #ThankAVet https://t.co/DZpG1OO5KM,2019-11-12 16:09:56,False,1074480192
1193997973316931588,Honored to participate in the City of Pflugerville’s Veterans Day Ceremony hosted by @AmericanLegion Post 154 to celebrate the men &amp; women who have bravely served TX &amp; our country. #VeteransDay #ThankAVet #veteransday2019 https://t.co/dcowR5l0aH,2019-11-11 21:04:34,False,1074480192
1194295252154236935,"Dreamers have built their lives here since they were kids. They don’t know any other country as home. Our neighbors, colleagues, and friends are at risk of losing their legal status in the US. https://t.co/Po9rJxl7yQ",2019-11-12 16:45:51,False,1074129612
1194261565912092673,"ICYMI the FDA doesn't consider it misbranding to label products as ""natural"" even if they have manufactured &amp; synthetic chemicals. My bill would change that. It’s about time Congress paid attention to the green-washing &amp; health risks associated w/ cosmetics. #NaturalCosmeticsAct https://t.co/VfTKIzOV8b",2019-11-12 14:32:00,False,1072467470
1194028412312211456,"^My dad in ‘46. He turned 18 right after WW2 &amp; joined the Navy to serve. He instilled in me a reverence for our military &amp; taught me to respect those who defend our flag. Today &amp; every day, we honor those who risk it all to protect us. Your bravery will be remembered #VeteransDay https://t.co/xXF3v1ejHT",2019-11-11 23:05:32,False,1072467470
1194017866934304768,"A picture of medals and dog tags from my grandfather, Victor W. Daley, who served with honor in WWI. I named my first daughter for his side of the family. Thinking about the example he set and the sacrifices he made this #VeteransDay. https://t.co/C1TVnHAiwx",2019-11-11 22:23:37,False,1072467470
1193940693141610498,"We didn’t always agree, but when it came to fighting for New Yorkers on kitchen table issues like restoring the commuter tax credit @RepPeteKing &amp; I got things done. I wish him well in his retirement &amp; thank him for his work to keep NY safe on Intel &amp; Homeland Security Committees https://t.co/GVufiYtJHM",2019-11-11 17:16:58,False,1072467470
1194264543670743040,I’m honored to have been published in @afpc Defense Dossier. I discuss China’s emergence as a global power and the need for a concise US vision to combat Chinese aggression in this new geopolitical landscape. Check out the article here: https://t.co/TY5MfKhz6l,2019-11-12 14:43:50,False,1071900114
1193954496432549889,Thanking our local veterans at the Highland Park Public Library. #VeteransDay https://t.co/QP8PwpEXEd,2019-11-11 18:11:49,False,1071840474
1193976069331857408,So thankful to spend time today with veterans at the American Legion Post #1 in Omaha. We cannot thank these Nebraskans enough for their sacrifice and service to our county. #VeteransDay #LoveNE https://t.co/ASR5kMEjoU,2019-11-11 19:37:32,False,1071402577
1193979964573573122,"#VeteransDay marks an important opportunity for our nation to honor the lives &amp; service of our veterans. To America’s veterans: thank you for your dedication to this country. Today, we commit to honoring our veterans. But, it must be more than just ""thank you for your service."" https://t.co/CilTPO853E",2019-11-11 19:53:01,False,1071102246
1193936675291856896,"America is, without question, the greatest nation in the world. This #VeteransDay, we honor those who have served their country in order to protect our way of life. Thank you to all of the veterans &amp; active duty service members in Northern California &amp; across the United States! https://t.co/bnWThocRp8",2019-11-11 17:01:00,False,1069124515
1193983127510769664,"Our nation owes our veterans a debt that we can never fully repay. But we must do everything in our power to try. To those who served: thank you for your dedication, your sacrifice, and your exemplary commitment to our nation’s values.",2019-11-11 20:05:35,False,1068499286
1193982512890073090,Our responsibility to honor the service of Maine’s veterans is not limited to one day. The Veteran Mentors of Maine work every day to help veterans who are struggling get back on track; today I joined them in Waterville to celebrate their impact on our state. https://t.co/GOFSBB7N1J,2019-11-11 20:03:08,False,1068481578
1193945530621190150,"The Fisher House on the Togus VA Medical Center campus a provides a home for veterans and their families while they seek treatment and recover. Healing can be a long process, and it’s vital to have your support network close by. https://t.co/4uKkzQwhza",2019-11-11 17:36:11,False,1068481578
1194290229785563136,"Proud to join fellow #dadvocates to talk about how Congress should move to ensure that paid family leave applies to EVERYONE. It's important for families, for moms and dads, for children, and for employers. https://t.co/fTq2fz1U19",2019-11-12 16:25:54,False,1058917562
1194092206585462784,Nothing like several hundred people singing together to honor our country and those who serve it! https://t.co/A7QZmYsNXq,2019-11-12 03:19:01,False,1058917562
1194003623325454337,United we stand!!! The Veterans Day ceremony in Kitsap County is always incredible. Why? Where do I start? Perhaps it’s the more than forty organizations that are a part of the event. Perhaps it’s the presence of veterans from every era - including eight WWII vets.... https://t.co/kDrVjGAsJo,2019-11-11 21:27:01,False,1058917562
1194297784712728576,Glad to hear that President Carter’s surgery went well this morning. My thoughts are with him and his family – hoping for a speedy recovery. https://t.co/myhHhs99Fk,2019-11-12 16:55:55,False,1058717720
1193980228202377216,Honored to be at the New Hampshire State Veterans Cemetery this Veterans Day to recognize the courage and service of the brave men and women who have answered the call of duty. Thank you to all our veterans and their families. https://t.co/3luM5CBipJ,2019-11-11 19:54:04,False,1058717720
1194076724511825920,"Today, a group of Veterans was forced to celebrate #VeteransDay in Mexico because our nation's government deported them, forbidding them from setting foot in the nation they risked their lives to defend. https://t.co/Vmos8UEgg4",2019-11-12 02:17:30,False,1058520120
1193971726759186439,"Thank you to all the brave men and women in uniform for defending the freedoms that make America the greatest nation in the world. 

We owe our veterans a debt that we can never fully repay. #VeteransDay https://t.co/4ZbkaL0lif",2019-11-11 19:20:17,False,1058460818
1194000487365971969,"On #VeteransDay, we thank all of those who have worn our nation’s uniform and sacrificed for our freedom. And in our gratitude, we recommit to a country worthy of their service.",2019-11-11 21:14:34,False,1055907624
1194292422588715010,"I was so excited to visit the new Finding Grace Ministries drop-in center, ""The Harbor"" and meet Founder Doreen Page and several of the dedicated volunteers who will soon be serving at-risk youth in Jefferson County. https://t.co/rGDOvXQS0f",2019-11-12 16:34:37,False,1051446626
1193954089769586689,It was a privilege to participate in the annual Arnold Veterans Day Parade marching with so many brave heroes from every era and branch of service. https://t.co/Dqj83rxkY2,2019-11-11 18:10:12,False,1051446626
1193949853333819392,"I visited my father's grave at Jefferson Barracks for Veterans Day.  As the daughter of a Korean War veteran, I have always held a deep appreciation for our military and for the brave individuals within each branch. https://t.co/T8qiAQ8QbX",2019-11-11 17:53:22,False,1051446626
1193928717468352513,"Today is Veterans Day, and we honor the men and women who have served in our nation’s Armed Forces. We offer our profound gratitude to them for their selfless dedication to our freedom and liberty. https://t.co/bCGbJ2tlwC",2019-11-11 16:29:23,False,1051446626
1193986706451705856,"Delivered welcoming remarks this morning at the Pioneer Equipment Dealers Association’s Inaugural Convention.

As we saw with writing the Tax Cuts and Jobs Act, the advice and insight I receive from the members of this group is necessary and invaluable. https://t.co/W4kldbufTB",2019-11-11 20:19:48,False,1048784496
1193954520612651009,"Delivered opening remarks at the United Patriotic Bodies’ #VeteransDay ceremony.

Today we reflect on what it means to be a free American &amp; honor those willing to pay the ultimate price to protect our freedom. 

I am deeply grateful to our veterans for their sacrifice &amp; bravery. https://t.co/MYc2jzrARW",2019-11-11 18:11:54,False,1048784496
1194304850122694657,All of you make me proud to be a Highlander. #HomeIsHere https://t.co/bYCQDGmKus,2019-11-12 17:24:00,False,1037321378
1194274636600610818,"Thank you to the brave #Dreamers and @UCRiverside alumni for sharing your stories at #SCOTUS this morning. 

There is power in your story — the power to change minds and change hearts.

The vast majority of Americans are with you. You are #HereToStay. 🦋 https://t.co/beK1x0NZrU",2019-11-12 15:23:56,False,1037321378
1194263148083191809,"Dreamers are at #SCOTUS as a direct result of Trump's extreme, anti-immigrant agenda. 

By ending #DACA, he upended the lives of hundreds of thousands of people who've built their lives in America.

#HomeIsHere for DREAMers. I'll be fighting alongside them every step of the way. https://t.co/Sxe4ITDgjF",2019-11-12 14:38:17,False,1037321378
1193977465812738048,"With more women, LGBTQ, minority, and Native American veterans than ever before, we need to ensure VA is ready to care for our increasingly diverse community of veterans. 

Today, and every day, I am committed to ensuring we do just that. #VeteransDay https://t.co/Z3OHGE8MOM",2019-11-11 19:43:05,False,1037321378
1194091786312015872,"A few more photos from #VeteransDay events I attended in Lemont &amp; Palos Hills. Made it to a total of 5 services today. Though each ceremony was unique, what they all shared was a sense of gratitude and reverence for all the men and women who’ve served in our nation’s Armed Forces https://t.co/FUYRpee8Vt",2019-11-12 03:17:21,False,1009269193
1193958148199067648,I spent this snowy #VeteransDay morning at the Oak Lawn and Hometown VFWs honoring our nation’s veterans on this special day. I will be attending other services throughout #IL03 today to thank our veterans 🇺🇸 #thankyouforyourservice https://t.co/P5FdWXNQPl,2019-11-11 18:26:19,False,1009269193
1194046185947963393,Honored to be in Mill Creek with many of our #WA01 local heroes who served our country. Thank you for your service. #VeteransDay https://t.co/Lawl4d4Ezq,2019-11-12 00:16:09,False,995193054
1193934679906361345,"To every veteran in #WA01 and around the nation, thank you. #VeteransDay https://t.co/tI3qAlcjvT",2019-11-11 16:53:04,False,995193054
1194069498917277697,Honored to be a part of the Veterans Day ceremony in Pana today. Thank you to the men and women who have worn the uniform to protect and defend our great nation! https://t.co/oKeHUkaTcL,2019-11-12 01:48:47,False,993153006
1193937503365091328,Happy Veterans Day! Thank you to all those who have served and sacrificed for our freedoms. https://t.co/gn5ASPDN81,2019-11-11 17:04:17,False,993153006
1194259966191951873,"Great @clevelanddotcom article highlighting easy, small steps we can all take to help reduce the nutrient runoff that feeds #harmfulalgalblooms https://t.co/RFUyq5q6QT",2019-11-12 14:25:38,False,976969338
1193979940057862145,"Today, a grateful nation salutes its veterans as it has done every Nov 11 since WWI hostilities ceased.

Thank you Geauga Co Veterans Service Commission, Munroe Falls &amp; @AuroraOH1 for inviting me to help recognize our heroes for defending our nation &amp; our freedom 🇺🇸 #VeteransDay https://t.co/BWLEHbV86L",2019-11-11 19:52:55,False,976969338
1194286694566109184,"I like it.  But watch out @chiproytx , they’ll accuse you of debt shaming! https://t.co/mYgK0TyFAy",2019-11-12 16:11:51,False,975200486
1194260133985050624,Leaving the shire for DC this week. Going to try and maintain this vibe for as long as possible! https://t.co/jM8KdGxXWY,2019-11-12 14:26:18,False,975200486
1194084504559923201,"One of my sons did this pencil sketch, based on an iconic photo, four years ago when he was in high school. It’s now in my office in DC as a tribute to our veterans. https://t.co/wikuQe3FcA",2019-11-12 02:48:25,False,975200486
1193959045679456256,"A great reform idea for US Congress that comes from the states:

Some state legislatures like Ky prohibit fundraising while the legislature is in session.

Fundraising &amp; legislating are like drinking &amp; shooting. I’m not against either, but you shouldn’t do both at the same time. https://t.co/HDcDGvPZaU",2019-11-11 18:29:53,False,975200486
1193929943782187008,"Last week, I partnered with my colleagues on a bipartisan resolution urging the @USPS to commemorate some of the most courageous women veterans in our nation's history with a postage stamp series. It's one way we can honor their hard work &amp; dedication. https://t.co/SOnflO5GVx",2019-11-11 16:34:15,False,970207298
1193984296920518658,It was an honor to speak to the veterans who came out to MacArthur Park in Little Rock today to celebrate and thank all of our nation’s brave servicemembers. https://t.co/wTJlC5tps6,2019-11-11 20:10:14,False,968650362
1194271014861131777,"Still very interesting how Washington Democrats and some in the media kept demanding to hear from the whistleblower—and yet the moment the potential coordination between the informant and Adam Schiff became public, the whistleblower was “no longer relevant”",2019-11-12 15:09:33,False,963480595
1194014983211929601,This will go well with the evidence of “Russian collusion” we also heard about https://t.co/V9BPp7CCpw,2019-11-11 22:12:10,False,963480595
1194305022252769284,"The President acted outside the bounds of our constitution.

This week, the American people will hear the evidence directly from career public servants who've faithfully served our country for decades under both Democrat and Republican presidents. https://t.co/leb2VvoOcJ",2019-11-12 17:24:41,False,950783972
1194279112287965186,"Like towns and cities across America, #CA07 is home to #Dreamers and #DACA recipients. They are our neighbors, friends, teachers, and first responders. 

I'll continue to fight to #ProtectTheDream. #HomeIsHere for #Dreamers. https://t.co/LHaNYMciQ2",2019-11-12 15:41:43,False,950783972
1194013790783840256,Thank you to our #SacramentoCounty veterans. Our veterans have made incredible sacrifices and we owe them nothing more than our unwavering support. #VeteransDay https://t.co/DdvWH1OZvK,2019-11-11 22:07:26,False,950783972
1194299602163384320,I joined Nashua area students and educators at @nashuacc this morning to talk about Running Start – a program that allows high school students to earn college credits. I'm working to create more opportunities like these through my bipartisan #FastTrackAct. https://t.co/yK4uBSnSmQ,2019-11-12 17:03:08,False,946549322
1194287831549710339,"I'm wishing President Jimmy Carter a speedy recovery after his surgery this morning. His tenacity and spirit continue to inspire us, and I know he is in the thoughts and prayers of people across the country today. https://t.co/lCH57je05v",2019-11-12 16:16:22,False,946549322
1194007487231545344,"Veterans have sacrificed so much in the name of freedom. Today, I'm sharing my thoughts on our service members' brave patriotism and how we can support them after their service: https://t.co/xJcldOScJh",2019-11-11 21:42:23,False,946549322
1193986337260609538,"As Governor &amp; now as Senator, I look forward to the Veterans Day ceremony at the NH State Veterans Cemetery in Boscawen. Each year, it serves as a beautiful tribute to the many sacrifices our veterans have made in the name of freedom. Thank you to all who have served. https://t.co/7UJGfxFlyg",2019-11-11 20:18:20,False,946549322
1193936075015774208,"On Veterans Day, we must remember and honor the men and women who have risked it all in the name of freedom. https://t.co/dNaLuBKtWX",2019-11-11 16:58:37,False,946549322
1193930902893735936,"This morning, @LonzaPB celebrated the numerous veterans who work at its Portsmouth facility. I was happy to attend their Veterans Day Breakfast and meet the men and women who served our country and now work with Lonza. https://t.co/6wZYq0ePOF",2019-11-11 16:38:04,False,946549322
1194267732994342912,A big day for gun violence victims’ families who have long sought their day in court. #EnoughIsEnough https://t.co/6yd0chrfjV,2019-11-12 14:56:30,False,942156122
1194113669019385857,This game! Bay Area crowd going to bring it home now for OT. #49ers,2019-11-12 04:44:18,False,942156122
1194027026677559297,https://t.co/s2YwFiYamw https://t.co/IAbv95nnKo,2019-11-11 23:00:01,False,942156122
1193977031454871553,Perfect! https://t.co/JBnbJtUanp https://t.co/CfD6I2GOoj,2019-11-11 19:41:21,False,942156122
1193952835429437442,"I will miss my friend and constituent, Bernard Tyson. He represents the American Dream, rising through the ranks for 30 years at @KPMemberService to become CEO. He also worked with me at @BayAreaCouncil to meet the East Bay’s rail transit needs. RIP, Bernard.",2019-11-11 18:05:13,False,942156122
1193942623192539137,"Happy #VeteransDay to all of those who have served our country. Thanks to their courage, dedication and bravery we are safer at home and abroad. Today—and every day—I am grateful for their sacrifice. https://t.co/QNGIU1XCRr",2019-11-11 17:24:38,False,942156122
1193930414378934273,Let’s not torch responses like this so early in process. @MacThornberry said @realDonaldTrump’s extortion scheme was “inappropriate.” That’s more than most @HouseGOP will say. There’s lots of public testimony coming. Let’s focus on ensuring Reps like him have open mind &amp; evolve. https://t.co/piJmKaSHiR,2019-11-11 16:36:07,False,942156122
1194284409614217216,November is National #Alzheimer's Disease Awareness &amp; National Family Caregivers Month. A time to shed a light on a disease that impacts millions of American – including my late Grannie. https://t.co/V7FXp0wc2Q,2019-11-12 16:02:46,False,935033864
1194280001450979328,Toured Louisville Air Traffic Control Tower &amp; learned about federal aviation issues with National Air Traffic Controllers &amp; @PASSNational before my flight to DC. https://t.co/dvyCAos3Sy,2019-11-12 15:45:15,False,838462994
1193928594449424384,Honoring all our nation’s veterans this Veterans Day https://t.co/JtwgDny7AZ,2019-11-11 16:28:53,False,834069080
1194304096100069376,"Canada’s journey toward universal health care began with Saskatchewan in 1947. 

Two decades later, the whole country was covered. 

States should be able to bundle all their health care spending to build a universal health care system that will eventually expand across America.",2019-11-12 17:21:00,False,771152516
1194292785958064133,"I support all those fighting for dignity at the Supreme Court today as well as all the DACA recipients across this country who are watching with uncertainty.

We must reject Trump's xenophobia, restore DACA and give young immigrants and their parents a path to citizenship. https://t.co/TGY3CocbKT",2019-11-12 16:36:03,False,771152516
1194259192212807680,I appreciate the way you have campaigned @JulianCastro in recognizing the diversity within early states. One reason @BernieSanders will win Iowa is his strong support in the growing Latino community. These states are far more diverse than many assume.,2019-11-12 14:22:34,False,771152516
1194256073173217281,The only right Medicare for All takes away is the right of insurance companies to fleece working &amp; middle class families with high premiums. What Medicare for All secures is the right to quality healthcare for all Americans regardless of income. https://t.co/dBtrHpCEyQ,2019-11-12 14:10:10,False,771152516
1194250379124510722,"What is “elitist” is pretending we know more than nearly 70% of Democrats who want Medicare for All b/c it’s in their interests. What is “elitist” is telling them that if they want healthcare their only choice is to pay high premiums, copays, &amp; deductibles https://t.co/V0bFsEBODI",2019-11-12 13:47:33,False,771152516
1194064517266726913,"Newspapers, nursing homes, retail, and grocery stores have been forced into bankruptcy by some private equity firms who buy companies through leveraged buyouts and then sell the scraps.

The #StopWallStreetLooting Act will protect workers’ jobs, paychecks &amp; severance.",2019-11-12 01:29:00,False,771152516
1194030040079454208,"PG&amp;E's transmission lines were responsible for two of the deadliest wildfires in California's history but instead of investing in infrastructure, the company spent millions lobbying elected officials.

This is why we need public ownership of utilities. https://t.co/CKdQXYMHd1",2019-11-11 23:12:00,False,771152516
1194027960807804928,"Met a SV constituent who confronts friends abt the wealth tax. When billionaires threaten to take their money elsewhere, he asks them where they would take it. The US has the best investment opportunities. Plus, art &amp; hard to measure assets are less than 10% of their fortunes! https://t.co/elANq4dT65",2019-11-11 23:03:44,False,771152516
1194002609557975041,"Instead of extending this pipeline and increasing the likelihood of more spills, we need to make investments in smart grids, renewables, energy efficiency and storage. 

Big oil profits are not worth sacrificing the health of our planet. https://t.co/3ZETX94aiW",2019-11-11 21:23:00,False,771152516
1193969893768601600,"It’s an absolute shame that over 40,000 veterans are homeless on any given night and 17 veterans commit suicide every day.

Our priority must be to provide support to all those who have bravely served our country. #VeteransDay",2019-11-11 19:13:00,False,771152516
1193941204787957763,"We can’t talk about supporting the troops when they go off to fight in military conflicts then fail to support them when they return home. 

This #VeteransDay we must commit to investing in our veterans with: 

🏠 Housing
🏥 Health care
💼 Job training
🧠 Mental health treatment",2019-11-11 17:19:00,False,771152516
