tweet_id,text,created,retweet,user_id
1196134559206846464,"I was out &amp; about in #TX22 yesterday morning. Passed by ⁦Laura Ingalls Wilder Elementary. Had to stop to take a photo so I could wish Luke a very happy 9th birthday from over 1,000,000 neighbors in #TX22. HAPPY BIRTHDAY, LUKE!!!🎂🎉 ⁦@WilderElem⁩ ⁦@AlvinISD⁩ https://t.co/zfdhGQFJjj",2019-11-17 18:34:36,False,20053279
1196121781016449025,"Today is day 726 of the #Citgo6’s wrongful imprisonment. Our prayers are with them and their families as we hope for their release. #NeverGiveUp
@Citgo6C @FreeCitgo6 @Vvadell @aliriorafael8 @AZuvanich @MariaElenaCard4 @carmen_molinos https://t.co/BTuGKQYotX",2019-11-17 17:43:50,False,20053279
1196077508241821700,"#HokaHey!!! Our Lady Mavs are heading to State.  We are the Texas 5A Region III Champions!!! Lost the first game, then swept three straight. @uiltexas @ManvelHS @ManvelVBall @AlvinISD https://t.co/rD9RKXV7cG",2019-11-17 14:47:54,False,20053279
1196065966809079816,"Yesterday afternoon, after stuffing police cars &amp; fire trucks in Missouri City w/ food for our neighbors in need over Thanksgiving, dropped by to thank a #Stafford icon &amp; #TX22 job creator - TORNADO BURGER!!! The Spicy Burger Rules! https://t.co/1OyoHG29IK",2019-11-17 14:02:02,False,20053279
1195925435026153472,"ONCE AGAIN, OUR LADY PANTHERS ARE GOING BACK TO STATE!! We swept a tough Pearland Dawson Eagle team. This photo shows Panther Pride was raging in Missouri City today. We’re so proud of the 6A Region III champions! ⁦@RP_Volleyball⁩ @RPHS_Panthers ⁦⁦@FortBendISD⁩ https://t.co/wfcVCrE0br",2019-11-17 04:43:37,False,20053279
1195832999826411521,Great taking part in Operation Thanksgiving — Stuff the Squad Car and Fire Truck today in Missouri City. Proud to see the #TX22 community come together to help those in need! 🍗🌽 https://t.co/6a5G9oU2mj,2019-11-16 22:36:19,False,20053279
1196073160782823429,"This. This is the impeachment that Democrats have spent the last three years working on. ↓
 
Hours of hearsay from handpicked witnesses that have never even met the president. https://t.co/npak5HjpQG",2019-11-17 14:30:38,False,19739126
1195842620544737287,".@Repstefanik is a young, powerful, conservative woman—and Democrats are threatened by that. They are resorting to slander and fake, photoshopped images to try to damage her character.

It will not work. → Retweet if you are on #TeamElise.",2019-11-16 23:14:33,False,19739126
1196081306678919168,"Now is the time to visit New Mexico – our public lands will take your breath away!
https://t.co/4GaKyEnaID",2019-11-17 15:03:00,False,19318314
1196139999290413059,My first job in public service was as an intern and I know firsthand the benefits of offering yoing people an introduction to Congress &amp; the workings of a Senate office. My office is currently accepting applications for Summer 2020 interns. More info here: https://t.co/CO0XBEHvhZ,2019-11-17 18:56:13,False,18915145
1196126398559195139,"At a committee hearing on this week on migration at the southern border, I asked officials how they are working to ensure the safety of unaccompanied children. Last year, I introduced legislation to require agencies to better care for &amp; keep track of unaccompanied minors.",2019-11-17 18:02:11,False,18915145
1196119039283748864,Earlier this week I joined my bipartisan colleagues in sending a letter to the US Air Force urging them to ensure our retired service members receive their military pensions &amp; hard-earned benefits https://t.co/1uRZyZPVso,2019-11-17 17:32:56,False,18915145
1195858830875385856,"Ohio is immensely proud of its more than 800,000 veterans &amp; that was clear this #VeteransDay when I delivered remarks in Blue Ash, #Ohio &amp; at the National Veterans Memorial &amp; Museum in Columbus. We all must support our veterans. I will continue fight for them at the federal level https://t.co/Xsry7I19of",2019-11-17 00:18:57,False,18915145
1195821154386272257,"Earlier this week, I asked officials about the current levels of crossings our southern border &amp; how they are working to ensure the safety of unaccompanied children at the border. https://t.co/NjxqRVnrL8",2019-11-16 21:49:15,False,18915145
1196104965657387014,"#OTD in 1800, the United States Congress met for the first time in Washington D.C. After 9 capitals during 1776 – 1800, Washington D.C. has become Congress’ permanent home. I am honored to work in these halls, representing the 8th District. https://t.co/916j1bsbBm",2019-11-17 16:37:01,False,18696134
1196110879290474498,"As people peacefully assemble across the Middle East, this weekend in Iran, governments must respect the rights of their citizens to protest and express themselves. https://t.co/cPAHc4BBKL",2019-11-17 17:00:30,False,18695134
1196096012772925441,"Do you want to gain insight on how government and the legislative process works?

Apply to be a Spring 2020 intern in my D.C. or N.J. offices to gain first-hand experience. Apply today: https://t.co/sEox2FaYr8 https://t.co/o2gmbNLVTN",2019-11-17 16:01:26,False,18695134
1195869925358866433,"Reprehensible. The United States must stand up for our values, and hold accountable those responsible for horrifying human rights violations, ethnic cleansing, and bigotry. 

The Senate has passed the Uyghur Human Rights Policy Act of 2019. Now the House must act. https://t.co/NgNzDKCVhZ",2019-11-17 01:03:03,False,18695134
1196147995932102656,"In the 55 days that aid to Ukraine was delayed, President Zelensky had 5 calls and meetings with high-ranking American officials.

In each of those meetings, never was there discussion of linking aid to investigating the Bidens.

But we verified that Zelensky was the real deal. https://t.co/Ld7vwcxYaX",2019-11-17 19:28:00,False,18166778
1196135868815290370,"5 Democrat members of the Intel Committee voted to move forward on impeachment in July.

BEFORE the July 25th call between President Trump and President Zelensky. https://t.co/Gbz1UzmqU4",2019-11-17 18:39:48,False,18166778
1195829081981493253,"Morrison testified that:

-The transcript of the call is accurate
-He was concerned about leaks
-There was absolutely nothing improper or illegal on the call https://t.co/13dpLfZMv4",2019-11-16 22:20:45,False,18166778
1195833075277717504,"This week marked the grand opening of new exhibits at the @AlaskaCenters Public Lands Information Center. These new exhibits, which have been years in the making, will help continue educating the public on our public lands &amp; how we manage them through federal &amp; state cooperation. https://t.co/tdVRRgP2Yz",2019-11-16 22:36:37,False,18061669
1195849675477110785,It was a pleasure joining @nvdems at @SEIU1107 for a caucus training to celebrate the important role that women play in the electoral process. A special thank you to @JoyceWoodhouse and @donderoloopnv for participating! https://t.co/TtswZdhTWT,2019-11-16 23:42:35,False,17907578
1196111676757725191,"For the second consecutive week, the U.S. Senate—under Senator Mitch McConnell’s control—didn’t vote on a SINGLE piece of legislation.

Senator McConnell:

Stop playing games.

Put the House-passed bipartisan, universal background checks bill up for a vote immediately.",2019-11-17 17:03:41,False,17494010
1195822639077609478,"Senate Democrats just released a report showing how President Trump's administration is unfairly picking winners and losers, wealthy conglomerates over small farmers.

@USDA needs to make sure all farmers are treated fairly. Period.

https://t.co/LwYSw3ukd3",2019-11-16 21:55:09,False,17494010
1196147530150678529,Did you know? ⬇️ #NAW2019 https://t.co/GHWDRjHQYf,2019-11-17 19:26:09,False,16424044
1196125167837159424,"President Trump is in over his head. Now, he is abusing his power and lashing out. That is why we must #DefendOurDemocracy. https://t.co/4p9g0xBKd9",2019-11-17 17:57:17,False,15764644
1195861819899822080,Tune in to @FaceTheNation tomorrow at 10:30 am ET to catch my complete conversation with @MargBrennan about our ongoing work #ForThePeople and the effort to #DefendOurDemocracy. https://t.co/Et7vgzgcfL,2019-11-17 00:30:50,False,15764644
1196069570336956418,"For the day is coming, blazing like an oven, when all the arrogant and all evildoers will be stubble, And the day that is coming will set them on fire,
leaving them neither root nor branch, says the LORD of hosts.

Malachi 3:19",2019-11-17 14:16:22,False,15745368
1195923546398216193,"Nice write up about my speech two weeks ago. 

Thank you! https://t.co/YZr2Xg7hmR",2019-11-17 04:36:07,False,15745368
1195911739864432641,"Leaked documents reveal how govt of #China ordered a cruel,ruthless &amp; systematic crackdown on ethnic minorities in the #Xinjiang region through the mass incarceration of Muslims in the #Xinjiang region. They ordered officials to show “Absolutely No Mercy” https://t.co/fKXuH0pnz1",2019-11-17 03:49:12,False,15745368
1196117200605765633,"Just before the Ohio Air National Guard Change of Command of the #180thFighterWing ceremony at Toledo Express Airport in Swanton began yesterday, I had the privilege of presenting a flag flown over the Capitol to outgoing Commanding Officer Colonel Kevin Doyle. https://t.co/brLVrgNSHc",2019-11-17 17:25:38,False,15394954
1196101439279337474,"As I have said for months, the time to pass the USMCA is now. More than one million American jobs are on the line, and we cannot afford to delay any longer. Rather than focus on distracting political posturing, we need to get back to the work of the people. #USMCAnow https://t.co/xocVucaJgZ",2019-11-17 16:23:00,False,15356407
1196067122822164482,"Reminder: Open enrollment is happening now until Dec 15. I encourage everyone – regardless of age, background, or preexisting condition – to visit https://t.co/z02rmyZtnL or attend an open enrollment event to evaluate their health care coverage options and financial assistance.",2019-11-17 14:06:38,False,15324851
1196080676287787008,A convicted felon https://t.co/8Xfnxs4GEy,2019-11-17 15:00:29,False,13218102
1196065155894988806,‘Political Talking Points’: Ernst Says Democrats Know Their Violence Against Women Bill Won’t Pass https://t.co/CvjrSfiDqk via @dailycaller,2019-11-17 13:58:49,False,13218102
1196059735704952832,"Congress did something about gun sales, and it's helping https://t.co/gAIQh4SeRt",2019-11-17 13:37:17,False,13218102
1196080552320913409,"A very happy birthday to the Mountain himself, @JimInhofe, from Team Inhofe! ⛰⛰⛰ https://t.co/2IYdKruGhS",2019-11-17 15:00:00,False,7270292
