tweet_id,text,created,retweet,user_id
1194275464803545089,"Trump said he’d treat Dreamers with “great heart” — and then he turned around and cruelly ended the program that protects them. As the Supreme Court hears arguments that could determine their futures, I’ll be standing with the Dreamers who call this nation home.",2019-11-12 15:27:14,False,172858784
1194281592467922944,"As President Trump and Republicans in Congress continue to ruthlessly rip health coverage away from people, this thread explains why it is so important to never give up fighting for what is right.
 
See cliff notes here: https://t.co/M9O1q17zpb /1",2019-11-12 15:51:34,False,171598736
1193965797955297281,ICYMI: The Senate Special Committee on Aging held an important hearing to explore how we can protect Veterans from falling victim to scams targeting their benefits. This is one of many ways we can – and should – support Veterans when they return home. https://t.co/ahcK2rxJMY,2019-11-11 18:56:43,False,171598736
1193965492316377091,"On Veterans Day, we come together to honor the brave men and women who have served our nation valiantly. As we mark Veterans Day, it is not only a time to thank our Veterans for their service, but to acknowledge the debt we owe them for protecting us and preserving our freedom. https://t.co/Qwag5R2BqT",2019-11-11 18:55:30,False,171598736
1194272511212564480,Speaking this morning to @CAPimmigration’s prayer breakfast in advance of #SCOTUS oral arguments on # DACA. #HereToStay https://t.co/ghRdC8wG8Y,2019-11-12 15:15:29,False,164369297
1194300459286171649,"6 years old - that’s how old the average #DACA recipient was when they arrived in the US. 

#HomeIsHere for #DREAMers. It always has been and always will be. 

We must #ProtectTheDream at the Supreme Court. https://t.co/we4unH0CFS",2019-11-12 17:06:33,False,164007407
1194084326905929730,Addressing the #Woodlawn taxpayers this evening to close out #VeteransDay. https://t.co/8j8sYgmOXX,2019-11-12 02:47:43,False,164007407
1194046731522060288,Another beautiful #VeteransDay ceremony this evening in #Larchmont. Thank you @AmericanLegion Post 347 for hosting this wonderful event. https://t.co/rlIZ0KINzA,2019-11-12 00:18:19,False,164007407
1194016323942199297,"A nice story for #VeteransDay. After learning about #Rye veteran George Mergenthaler's story, I wrote a Congressional Record to posthumously honor his extraordinary service to our country in WWII. https://t.co/mz7sXRpZfW",2019-11-11 22:17:30,False,164007407
1193949510772363264,"It was my honor to deliver the keynote address at this morning’s #VeteransDay ceremony in #NewRochelle. It was a beautiful and moving day.

To all the #veterans and service members in #NY16: Our grateful nation thanks you. #thankyouforyourservice https://t.co/zy7X79jbZ2",2019-11-11 17:52:00,False,164007407
1194304443220668416,"It was an honor to address folks at @TheWWImuseum on #VeteransDay.

And just because the day is over doesn't mean we should stop supporting our vets, so see what you can do today to help.

@VCP_HQ is a great place to start! https://t.co/4wU5yS9810",2019-11-12 17:22:23,False,163570705
1193932203501260800,It was an honor to join my fellow countrymen and women to faithfully pay tribute to those who have served. #VeteransDay https://t.co/ADJhlk6qqx,2019-11-11 16:43:14,False,163570705
1194284181687349253,"My colleague, Rep. Mark Green, recently published a misleading op-ed claiming that the #ImpeachmentInquiry was preventing the House from passing legislation. This is simply untrue. Read my response here ⬇️
https://t.co/5HKzZXClr5",2019-11-12 16:01:52,False,162069635
1194007889637236738,Shocking on Fox that Trump has violated oath to the #Constitution!It’s about time. https://t.co/BCZgqek8Iu,2019-11-11 21:43:59,False,162069635
1193989470351233025,Today I am hosted my 11th annual #VeteransDay Luncheon to thank our #Veterans for the sacrifice they made for our country and hear how Congress can work to meet their needs. We must honor those who serve by ensuring they receive the care and support they need and deserve.,2019-11-11 20:30:47,False,162069635
1194302491359358978,"As an educator, the first black woman to serve on the Hampton School Board, and a longtime member of the House of Delegates, Dr. C. was a pillar of the Hampton community. I will personally miss her counsel, mentorship and friendship.
https://t.co/LUfw6lsk8q",2019-11-12 17:14:37,False,161791703
1194014781142962176,Joined Norfolk Mayor @KennyAlexander and @RepElaineLuria at the MacArthur Memorial for Norfolk’s annual #VeteransDay ceremony. https://t.co/zMF0hx3HQf,2019-11-11 22:11:22,False,161791703
1194012038982504448,Presented a copy of my Congressional Record statement honoring the 100th anniversary of American Legion Braxton Perkins Post 25 in Newport News. Pictured making the presentation to Commander Sean Devlin. https://t.co/3CuBgUTOz2,2019-11-11 22:00:28,False,161791703
1193964232380964864,Honored to join Sen @timkaine and @AboutChesapeake city officials for their annual #VeteransDay ceremony. https://t.co/bNdvUPB477,2019-11-11 18:50:30,False,161791703
1194073935127683072,"I was honored to participate in Sunday’s “Welcome Home” service for Vietnam veterans at Lakeside Church of God. It was a homecoming many never got, with music, cheers, and more than a few tears. Today, as we honor all our military, I say thank you and Happy #VeteransDay2019. https://t.co/SomSaSjPTN",2019-11-12 02:06:25,False,161743731
1194061798653206529,"On Veterans Day, it is important to remember that Veterans assistance programs are among the most important promises America has ever made to its citizens. https://t.co/2rlkYrbJYW",2019-11-12 01:18:12,False,161411080
1194282994191785984,"Today, the fight to #DefendDACA is being taken to the #SCOTUS. Dreamers represent the American story.

I stand with you, I support you, and I will continue to #ProtectTheDream for the 6,400 eligible DREAMers in my district and the 700,000+ across the country.",2019-11-12 15:57:09,False,155669457
1194299179314667520,"Trump’s Remain in Mexico policy is endangering lives, denying human rights, and hollowing out the right to seek asylum. Recently urged the Trump Administration to share info about the threats faced by asylum-seeking families as a result of their program: https://t.co/bT0KTNGUQh",2019-11-12 17:01:28,False,153944899
1194290291479584777,"At @atxdesignweek opening session, I visited with founders Danielle Barnes &amp; Candice Digby, &amp; experienced augmented reality with the UT School of Design Dean Doreen Lorenzo and staff. https://t.co/Ab5trohjJV",2019-11-12 16:26:08,False,153944899
1194096927350120449,Thanks to Univision for hosting an informative session about ways to support the empowerment of the Hispanic community &amp; ensure all our neighbors have the tools to be civically engaged. Especially critical with #Census2020 &amp; the presidential election next year. https://t.co/CExdm3xz56,2019-11-12 03:37:47,False,153944899
1194023802826579969,"As @fox7austin highlights, the Affordable Care Act remains the law of the land, despite all efforts to undermine it that Republicans have attempted in Congress &amp; the courts. More on how to get covered now: https://t.co/kUeCEkWNNU",2019-11-11 22:47:13,False,153944899
1193997852487368707,Today we thank Cynthia Hopkins and all Navy veterans from OH-11 and across the country for their service and sacrifice. https://t.co/qkmBt6r8xC,2019-11-11 21:04:06,False,153486399
1193981271145426944,Today we thank James Cobb and all Marine Corps veterans from OH-11 and across the country for their service and sacrifice. https://t.co/YBEJ9eTNCh,2019-11-11 19:58:12,False,153486399
1193948485629952002,Today we thank Lorne Thomas and all Coast Guard veterans from OH-11 and across the country for their service and sacrifice. https://t.co/gtITGqYyIS,2019-11-11 17:47:56,False,153486399
1193931568936566786,Today we thank Laketta Lester and all Army veterans from OH-11 and across the country for their service and sacrifice. https://t.co/CJWreASD5H,2019-11-11 16:40:42,False,153486399
1194261062734032896,"If we continue business as usual - emissions left mostly unchecked - up to 200 million more people will be put at risk just from rising sea levels by 2100. 
 https://t.co/BEYETaO7xL",2019-11-12 14:30:00,False,151963505
1194296420343398400,"🚨RT and share this far and wide

Current DACA recipients are able to renew their protections if their DACA expires before the end of 2020.

#HomeIsHere",2019-11-12 16:50:30,False,150078976
1194255425748840451,"Ok. But nobody says there was any problem with the first call. 

The problem is the massive coordinated extortion campaign that virtually every official in your Administration connected to Ukraine was working on. https://t.co/JkHIXXbEeZ",2019-11-12 14:07:36,False,150078976
1193961160615301120,"This should be simple.

Anyone who served our country should have access to the mental health care they need. 

But 2 years after the Honor our Commitment Act I wrote was signed into law, the VA is still denying care. 

Our veterans deserve so much better.
https://t.co/jnFlAKgnNN",2019-11-11 18:38:18,False,150078976
1194292079691743232,"DACA protects young, undocumented immigrants who were brought to the U.S. through no fault of their own. They are part of our community, and President Trump's actions to end DACA are immoral. #HomeIsHere https://t.co/UHrRWBO2sV https://t.co/ohGj3Xqpbx",2019-11-12 16:33:15,False,140519774
1193965724940812288,Thank you to all the brave men and women who have served and sacrificed for our country. #VeteransDay https://t.co/YW2OOWSHm7,2019-11-11 18:56:26,False,140519774
1194285618530004993,"Today we stand with #DREAMERs as they make their voices heard before #SCOTUS . They are members of our community who cannot be used as political pawns. Though they were not born here, America is the country they proudly call home and they are #HereToStay. https://t.co/EEnO2ZoStF",2019-11-12 16:07:34,False,137794015
1194274303438655488,"There must be accountability for gun manufacturers’ reckless marketing of  assault-style weapons, which was used to kill 20 children &amp; 6 adults in Sandy Hook.

With the Supreme Court’s decision, the families of the victims will be allowed the chance to hold Remington accountable. https://t.co/8VxakYlaOm",2019-11-12 15:22:37,False,137794015
1194259218204942336,"It was great meeting with healthcare navigators at @BrowardHealth last week.Whether through medical centers or https://t.co/fF0TmZI0CR, there are resources to help you find the right healthcare plan for you and your family.  Open enrollment is open now through Dec. 15 #GetCovered https://t.co/47Z6cYd67u",2019-11-12 14:22:40,False,137794015
1194255249428623360,"Rockets from Islamic Jihad continue to hit Israel, following Israeli operation to kill terrorist leader. This indiscriminate rocket fire against civilians must be condemned. Israel has the absolute right to protect its people from these attacks. https://t.co/oenST29XDs",2019-11-12 14:06:54,False,137794015
1193946849666842624,"Happy #VeteransDay to the brave men and women who have risked their lives in the name of our great country. We as a nation, will forever be grateful for your sacrifice and we must commit to ensure no veteran is left behind when they come home. https://t.co/kTJwVdfxlz",2019-11-11 17:41:26,False,137794015
1194301948822016000,"Morales has been doing his best @NicolasMaduro impression for a while, so it’s no surprise that Maduro backs Morales.

Just like in #Venezuela, the people of Bolivia deserve freedom and democracy. That was never going to happen with Morales in power. https://t.co/jxdPDgpsgs",2019-11-12 17:12:28,False,131546062
1194276163687981056,"It’s no surprise that @AOC, @SenSanders &amp; the Squad are backing Morales. They haven’t met a Socialist they don’t like. They won’t even denounce Maduro!

This wasn’t a coup. The people of Bolivia simply demanded free &amp; fair elections. Not complicated. 
https://t.co/zDwg40i4pt https://t.co/Mc3EDjiRp7",2019-11-12 15:30:00,False,131546062
1194262145220907021,"NY &amp; CT are draining the life out of their states with burdensome tax policies. It’s a death spiral.

In FL we cut taxes by more than $10 billion, decreased debt, &amp; invested in things that matter to families - safety, infrastructure &amp; education. The answer is simple, move to FL! https://t.co/Qcj2wMjslr",2019-11-12 14:34:18,False,131546062
1194054489562656768,"Our veterans fought to defend the values that make America great. These values can &amp; should be part of our country’s future.

Unfortunately there are many that want to discredit and undermine these values. We can’t let that happen. https://t.co/4DYtrOUHYH",2019-11-12 00:49:09,False,131546062
1194002286533627904,"Beijing’s puppet Carrie Lam has made it clear that she stands with her puppet-masters rather than the people of #HongKong fighting for autonomy &amp; human rights.

Communist China could easily end the violence in the country by granting them the freedom &amp; human rights they deserve. https://t.co/1K7T0CbeE9",2019-11-11 21:21:43,False,131546062
1193950105122025478,"Last week members of @SenateAging sent a letter to the @DeptVetAffairs urging them to take further action to ensure that our nations heroes are protected from fraudulent and malicious scammers.

Our veterans have fought to protect us and now it is our turn to protect them. https://t.co/wd4QvCZfL3",2019-11-11 17:54:22,False,131546062
1194273058317582337,"Met w/ Veterans at the Coloma Veterans Day Breakfast - a tradition that's lasted for more than four decades. So often when a Veteran comes home - like my dad - they don't talk about it. But Veterans Day, and every day, provides for an opportunity to honor them for their service. https://t.co/Z2COU1wEbh",2019-11-12 15:17:40,False,124224165
1194266240803573763,"Yesterday was such a special day spending time with our veterans, recognizing not only their sacrifices but also recognizing their families' sacrifices. Honored to be part of the Veterans Day ceremony in Kalamazoo. #MI06 https://t.co/Q3wRAxWzjT",2019-11-12 14:50:34,False,124224165
1194069549634772992,Last stop of the day was at the Eau Claire Veterans Day ceremony - great performance by student singers &amp; wonderful discussions with our veterans. They’re heroes &amp; we’re so thankful for their service. God bless! #MI06 🇺🇸 https://t.co/bLNg5HPI1F,2019-11-12 01:49:00,False,124224165
1194018737759936513,Spoke to veterans at the Kalamazoo County Veterans Day Ceremony - we will never forget their service. We will always be grateful for them and their families for what they did to protect our nation &amp; our freedoms. 🇺🇸 #MI06 https://t.co/6PAOdhWrnY,2019-11-11 22:27:05,False,124224165
1193981956167491585,Spoke earlier today at the Portage Veterans Day Ceremony. These men and women are American heroes - we are all so grateful for the service of our veterans. Thank you! #MI06 🇺🇸 https://t.co/7Esc8EA0cT,2019-11-11 20:00:56,False,124224165
1193976370700935175,Met with Veterans at StoryPoint - an assisted living center in Portage - for their Veterans Day lunch. An incredible group of people - thank you all for the sacrifices you and your families made for our country. 🇺🇸 https://t.co/9LJfFiyQC8,2019-11-11 19:38:44,False,124224165
1194027485215653888,#TeamTitus joined @NVDeptVeterans for a special #VeteransDay celebration at the Nevada State Veterans Home in Boulder City. https://t.co/FC1IGW0olo,2019-11-11 23:01:51,False,122174004
1193998912580804608,I will always keep fighting for the brave men and women who served in our armed forces. It is an honor to be with @VetsVillageLV during their 8th Annual #VeteransDay Celebration. Special thanks to @John_Fogerty for joining us to pay tribute! #OnlyInDistrict1 https://t.co/VgRUvsdywk,2019-11-11 21:08:18,False,122174004
1194260245373165575,"The calendar is crowded this week, with Fed Chair Powell testimony &amp; retail data:
Wed.:
* Powell testifies before Joint Economic Committee
* @USTreasury Oct. budget result
Thurs.:
* Powell testifies before House Budget Committee
Fri.: 
* Oct. retail sales 
* Oct. factory output https://t.co/27jL4iBRkG",2019-11-12 14:26:45,False,116505994
1193920543168311302,"Today and every day, we honor the sacrifice and dedication of our veterans. 🇺🇸 #VeteransDay #HappyVeteransDay https://t.co/K5DyU0UX5Q",2019-11-11 15:56:54,False,116505994
1193999430489378817,"I’m so very grateful to the brave patriots who serve our country, and sacrifice so much for all of us. 

Let's each do all we can to support those who risk everything to protect our freedom and keep us safe, not just today but every day. #SupportOurVeterans #VeteransDay",2019-11-11 21:10:22,False,115979444
1193970944693411840,"Recognizing the 74 sailors, including 2 Granite Staters, who lost their lives onboard the USS Frank E. Evans 50 years ago is long overdue. That’s why I’m supporting a bill that would add the names of these brave men to the Vietnam Veterans Memorial Wall. https://t.co/0qcnDntmKP",2019-11-11 19:17:10,False,109287731
1193944209683865605,"At the Veterans Day Ceremony at the New Hampshire State Veterans Cemetery, it was an honor to pay tribute to the generations of veterans that answered the call of duty to defend our nation. We cannot thank you enough and are deeply indebted to your service. https://t.co/8LtCGTLFig",2019-11-11 17:30:56,False,109287731
1194267875290341377,"In a cross-city comparison, major cities with more restrictive residential zoning are less effective at providing high quality public education at low, affordable price. Below are some prime examples: https://t.co/VTh0NyG3VU",2019-11-12 14:57:04,False,109280446
1194263570487246851,"Our latest report, ""Zoned Out: How School and Residential Zoning Limit Educational Opportunity,"" explores the relationship between housing and public education.",2019-11-12 14:39:58,False,109280446
1194259300429860866,"NEW: Our latest report, ""Zoned Out: How School and Residential Zoning Limit Educational Opportunity,"" is live on our website ⬇️",2019-11-12 14:23:00,False,109280446
1194286850917195776,"SCOTUS is hearing arguments in the case against DACA today &amp; Dreamers nationwide are standing up to #ProtectTheDream. We must stand firmly with them.

They are students, veterans, business owners and so much more - not bargaining chips in @POTUS' anti-immigrant agenda.",2019-11-12 16:12:28,False,109071031
1194033095256596480,"72 years later, Winston Churchill's words still ring true. Democracy is worth fighting for — our freedoms and our values as a nation depend on it. Let us never lose faith in this mission. https://t.co/mqAQGCoEjd",2019-11-11 23:24:08,False,109071031
1194293963919941634,"Today, the Supreme Court will hear arguments on @realDonaldTrump’s unlawful attempts to end #DACA. Thank you to those like Jung Woo and Kris who marched for 18 days to remind us their #HomeIsHere. I’m proud to stand with the 800,000+ Dreamers. We must keep the fight going. https://t.co/fUJwVDQjfb",2019-11-12 16:40:44,False,92186819
1194012206947557378,"On Veterans Day, we honor the service of millions of Americans who, through their commitment, defended the values and freedoms we cherish. Today we also renew our commitment to serve our veterans and express our sincere gratitude for the personal sacrifices they have made for us.",2019-11-11 22:01:08,False,92186819
1193932381461393409,Happy #VeteransDay to all those who have sacrificed to keep our country safe!🇺🇸 https://t.co/krqvNt0Ow8,2019-11-11 16:43:56,False,90639372
1194042514451419138,It was an honor to address and spend time with veterans in my district today. I am proud to represent so many veterans and their families in Congress. https://t.co/jkgqikCGjr,2019-11-12 00:01:34,False,88806753
1193929027074977797,"On Veterans Day, we are grateful for the men and women who have served this country. We honor your sacrifice and thank you for your service. https://t.co/XVSfR2HbTA",2019-11-11 16:30:36,False,88806753
1193958016447664128,Happy to be here with @timpview_tbirds and @provocity to honor and commemorate the bravery of our men and women in uniform. I want to thank all veterans for their sacrifice and willingness to put their lives on the line in defense of our great nation. https://t.co/FgMkAlxmIz,2019-11-11 18:25:48,False,88784440
1193947101073461251,"Veteran’s Day is a time for us to remember those who have fought for the freedoms that we hold so dear. Thank you to every brave soldier, sailor, airman, marine, and coast guardsman who pledged themselves to defend our nation and our Constitution.",2019-11-11 17:42:26,False,88784440
1193972011921477634,"As we celebrate #VeteransDay today, our nation pauses to honor all those who have served our country. Eastern Connecticut is proud be the home of so many of our state’s veterans, and it’s an honor to represent them and to work on their behalf in Congress. https://t.co/hQNllNq6eZ",2019-11-11 19:21:25,False,85396297
1194280352140926980,"Trump EPA’s new anti-science rule forces an agency responsible for keeping our air &amp; water safe to ignore vital evidence. Attacking science for politics &amp; profit makes us a sicker, weaker, poorer nation. Our kids &amp; future generations will pay a price for this. #ScienceNotSilence https://t.co/tPasIcP9JO",2019-11-12 15:46:39,False,84119348
1194292293622206466,https://t.co/LikyL7D4UQ,2019-11-12 16:34:06,False,82453460
1194270096455323648,6 years old - that’s how old the average #DACA recipient was when they arrived in the US. #HomeIsHere for #Dreamers. It always has been and always will be. We must #ProtectTheDream at #SCOTUS.,2019-11-12 15:05:54,False,80612021
1194036310710898693,"Today, we celebrated the service of our veterans and the sacrifices they and their families made to keep our country safe. We honor all those who served, and we thank those who continue to wear our nation's uniform at home and abroad. #2019VeteransDayParade. https://t.co/SwHH8R0LHC",2019-11-11 23:36:55,False,80612021
1193923699977662464,Attending the annual @CityofFairfaxVA Veterans Day observance hosted by @AmericanLegion and @VFWHQ. Thank you to all the veterans who put on the uniform of this country and fought for our shared values. Those values unite us in our common identity as Americans. https://t.co/bjm9rfGxlM,2019-11-11 16:09:26,False,78445977
1194274400897576960,Many prayers were answered with former President Carter’s successful surgery this morning. We’re keeping him and Rosalynn in our prayers as his recovery continues. https://t.co/ivXpJCQyGu,2019-11-12 15:23:00,False,78403308
1193974856959823874,"As @VAChair, our veterans have been my daily inspiration, and it has been my mission to ensure we fulfill our promises to them and to their family members. #VeteransDay https://t.co/XTjLe0GcHn",2019-11-11 19:32:43,False,78403308
1193931690898608130,"On this #VeteransDay, I encourage every American to reflect and give thanks for the service and sacrifice veterans make for their country and for us. Without them, we would not be the greatest country on this Earth. My op-ed: https://t.co/vSnn4XwdPD via @mdjonline",2019-11-11 16:41:11,False,78403308
1193922574679453697,"Winston Churchill said it best 72 years ago today. I’m proud to live in the greatest democracy on the face of this Earth, and I thank all those who have stood up to protect it. https://t.co/sgvEbuaRQ9",2019-11-11 16:04:58,False,78403308
1194297593561571330,"READ @SenatorCarper’s and my op-ed in @USATODAY: Don't stop the fight against mercury pollution 

https://t.co/vdThlu5RuP",2019-11-12 16:55:09,False,76649729
1194265281943756800,"As former governors, @SenatorCarper and I know that cleaner air means better health, a better economy and better jobs for the residents of our states. 

Read our joint op-ed about the #MercuryRule in @USATODAY here: https://t.co/vdThlu5RuP",2019-11-12 14:46:46,False,76649729
1194287170019708928,Detroit’s renaissance won’t be complete until economic opportunity extends to everyone in the city. @Develop_Detroit and @Focus_HOPE are vital to this effort and it was great to see their work highlighted on @60Minutes:  https://t.co/HD4nGwPM2Y,2019-11-12 16:13:44,False,76456274
1194022761754177536,"LR @RepMcCaul: “I stand with the Bolivian people and urge them to continue to abide by the rule of law &amp; their Constitution as they seek a peaceful transition of power.""",2019-11-11 22:43:04,False,75367781
1194251905201033218,"Right now the Chinese communist party is escalating its violent crackdown on #HongKongProtests. America stands w/ the brave protestors.

Reminder that trump promised China's dictator he would never criticize their crackdown and remains cowardly silent. https://t.co/2g6Gjf0N3z",2019-11-12 13:53:36,False,74508260
1194056833775931393,"“Transparent” = breaking the law for years running to block any oversight of your tax returns. 

“Transcript” = doctored document that still shows trump’s treachery. https://t.co/lgTXs9MZsB",2019-11-12 00:58:28,False,74508260
1194018417172516866,Under trump American taxpayers are picking up the tab for federal employees to become exclusive content providers to right-wing media organs where they spew propaganda and lies. Your tax dollars at work. https://t.co/751CfFTwtb,2019-11-11 22:25:49,False,74508260
1194000414179577856,"Justice Sotomayor’s recent dissent highlights how our High Court is becoming a rubberstamp for trump corruption.

The gop is packing the courts w/right-wing political hacks to turn them into an unelected legislature to enact republicans’ toxic agenda. 

https://t.co/GqROT67VR2",2019-11-11 21:14:16,False,74508260
