tweet_id,text,created,retweet,user_id
1197664946504556544,"I voted “no” on today’s short term spending bill. It does nothing but kick the can down the road. 

We need No Budget, No Pay. We need to reform how Washington works and stop spending money we don’t have.",2019-11-21 23:55:49,False,131546062
1197638504462901250,"Great to have @MyNews13 join me for “A Day in the Life.”

One of the greatest parts of being a Senator is getting to meet &amp; help people across the state. We’ve worked hard to make FL the most military &amp; veteran-friendly state in the country, but there’s always more we can do! https://t.co/ov3JPyNPiy",2019-11-21 22:10:45,False,131546062
1197614928141725696,"🚨LIVE TV ALERT! 

Tune in to @foxnews at 4PM and catch me live with @teamcavuto.

I’ll be talking about why I voted “no” on today’s spending bill. We need new reforms like my No Budget No Pay bill that will hold members accountable to do their jobs and pass a budget.",2019-11-21 20:37:04,False,131546062
1197594030290407424,"The people of #Iran are speaking loud and clear! And their voices are being heard!

They deserve freedom and liberty. The Iranian regime may silence their internet but they can’t silence their voices. https://t.co/yGSu3ZYg41",2019-11-21 19:14:01,False,131546062
1197570136066146304,"This attack is 100% partisan politics. Students on our college campuses should be open to hearing ALL viewpoints. 

To attack a fellow student, and one of our state’s rising stars, in such a way is shameful. We stand with Michael Murphy. https://t.co/zDzb2RDLOZ",2019-11-21 17:39:04,False,131546062
1197884233634762757,".@RepDianaDeGette &amp; I are so proud of what the first effort of 21st Century Cures has been able to achieve, but one thing we've heard from folks is we need to do more to promote ACCESS to these life-saving cures,

That's what we'll look to do w/ Cures 2.0: https://t.co/iwzAo5Zy6N https://t.co/mAJEC2ytqN",2019-11-22 14:27:11,False,124224165
1197735416712925185,"Congratulations to the winners of tonight's @HCC_Nevada Economic Development Awards: Councilwoman Gerri Schroder, @GoldenKnights and @NIAS_Nevada. #TeamTitus https://t.co/riZK9LhqEA",2019-11-22 04:35:50,False,122174004
1197716243551117312,Tonight #TeamTitus joined @ADL_Nevada and @cpicciolini to recognize Don Ross and Punam Mathur for their lifetime of work to combat hate in our community. https://t.co/c7ycFx7Yo9,2019-11-22 03:19:39,False,122174004
1197609868187836421,"At this point, no one can legitimately question whether the President abused his power to help his political campaign. The only question is whether we're going to do something about it. #DefendOurDemocracy",2019-11-21 20:16:57,False,122174004
1197626975705276431,"Moses Lake plays an important role for Washington industries like aerospace, manufacturing, and agriculture. Investing in airport infrastructure will help the regional economy continue to grow, create jobs, and keep building for future sustainability and success. https://t.co/Wkna2g8VnX",2019-11-21 21:24:56,False,117501995
1197646152549720068,"🔍 New investigation 🔍

E&amp;C Leaders announce bipartisan investigation into the live event ticketing industry

Read more about the investigation into “…potentially unfair and deceptive practices…” ⤵️

https://t.co/IEQ3yE7whL",2019-11-21 22:41:08,False,114756202
1197592021910900736,"E&amp;C GOP Leader @RepGregWalden and E&amp;C Chairman @FrankPallone wrote in @thehill on working together to get the No Surprises Act across the finish line to protect patients from surprise medical billing  ⬇️

https://t.co/UHUkMkCwTg",2019-11-21 19:06:02,False,114756202
1197619654405038107,Today is #NationalRuralHealthDay! Rural communities are the backbone of our state's economy. This is why I am working to make health care more accessible and affordable for our rural communities and our state as a whole. https://t.co/iKUVy9hhQX,2019-11-21 20:55:50,False,112740986
1197638642816172033,"Survivors of sexual assault should not have to wait decades for justice. My bill protecting survivors' rights in federal court and providing funding to help reduce the rape kit backlog was signed into law in 2016 but there is more we need to do.
https://t.co/MzEq9UW4Mn",2019-11-21 22:11:18,False,109287731
1197585397272006657,"This is a positive step forward towards helping military spouses find meaningful work and continue their careers as they move from place to place with their families. Whenever we can find ways to support military spouses, we should act.
https://t.co/yZLqRPMcii",2019-11-21 18:39:43,False,109287731
1197574007865978890,"I’ve introduced legislation with @SenMcSallyAZ to boost services for veterans experiencing domestic or sexual violence. Such violence is too pervasive in our society and military, and it demands action to eradicate. Help should never be out of reach for survivors.",2019-11-21 17:54:27,False,109287731
1197877392187908096,"“What barriers to opportunity can we identify and try to remove? How might incentives to join the workforce be strengthened? How might we more smartly invest in social capital to create new opportunities?"" Watch @SenMikeLee’s opening statement from this week’s #JECHearing 👇🏼",2019-11-22 14:00:00,False,109280446
1197656695918477313,"Colombia's most vulnerable citizens - women, indigenous people, Afro-Colombians - have long been the victims of targeted violence and human rights violations. Today, the people are standing up for their rights and freedoms.  https://t.co/V9zdrBeW2R",2019-11-21 23:23:02,False,109071031
1197608665970294789,"Any plan that doesn’t cover #PreexistingConditions or essential services shouldn’t be called health care. Yet, those are the junk plans @POTUS is promoting to the people. I’m joining my colleagues to call out this blatant attempt to sabotage the #ACA &amp; the health of all Americans",2019-11-21 20:12:11,False,109071031
1197649605179117569,"After nearly three years of negotiation, @HawaiianAFA members voted decisively to authorize a strike. There is a sense of urgency to reach a fair agreement that recognizes the significant contributions flight attendants make to the success of @HawaiianAir.",2019-11-21 22:54:51,False,92186819
1197614981832941572,"Lawrence VanDyke has one of the most extreme right-wing, ideologically driven records that we've seen. In the ABA’s words: He’s “arrogant, lazy, an ideologue.” He may be lazy, but apparently not when it comes to pushing his agenda. #StopVanDyke https://t.co/pA2OgEEmpD",2019-11-21 20:37:16,False,92186819
1197660106504261632,"Avoid the junk “health” plans the Trump administration is promoting!
 
Don’t leave https://t.co/SN67HmgLEN - ONLY sign up for Obamacare through that site.
 
More details here: https://t.co/7jLxrn4eZd",2019-11-21 23:36:35,False,90639372
1197648836069601282,"I support the 100% Clean Economy Act of 2019! It would create jobs &amp; help people of color &amp; low-income Americans, who suffer disproportionate effects from climate change. #100x50 #ReadyFor100 https://t.co/hMJNmMfCec",2019-11-21 22:51:48,False,90639372
1197643707681517568,"Congress has sent President Trump a bill that would prevent another 36-day government shutdown.
 
It’s not perfect but I voted for it because I want federal employees &amp; contractors to get paid for their work!
 
https://t.co/lJuG3UcXql",2019-11-21 22:31:25,False,90639372
1197637218925502466,"Pleased to see @HelenGymPHL’s bill to require 6 months’ advance notice of #Philly hospital closures moving forward with support of @PhillyMayor &amp; most of Council:
https://t.co/TsEvzymQLk",2019-11-21 22:05:38,False,90639372
1197623697063976972,"1/ This tragic story of a #Philly teacher shows why we need more local, state &amp; federal funding for repairs to our schools. #FundOurFacilities #PHLed https://t.co/4LQkgBohsG",2019-11-21 21:11:54,False,90639372
1197905680621088768,I look forward to addressing attendees at the Alzheimer's Education and Resource Fair in Solano County today. I will be discussing the efforts in Washington to find a cure for those living with Alzheimer's disease.,2019-11-22 15:52:24,False,88806753
1197638811016204289,"Today, in a huge victory for our nation’s nurses, healthcare workers &amp; social service workers, the House passed my bill #HR1309 to reduce the staggering rate of #workplaceviolence against workers in these industries. #SafeWorkers #SafeCare More here: https://t.co/1XIt3wzkMc https://t.co/diCETRAzjj",2019-11-21 22:11:58,False,85396297
1197618999221248001,"Miriam is a strong voice for health care workers across the country, and she was outstanding today--it's thanks in large part to courageous people like her that we got this bill passed in the House. Big thanks to Miriam Doyle &amp; @AFSCME for their support throughout this effort. https://t.co/eNJ6GUWogB",2019-11-21 20:53:14,False,85396297
1197578411251785730,"We just voted on the final passage of my bill, the Workplace Violence Prevention for Healthcare &amp; Social Service Workers Act. Watch live from the Capitol. #SafeWorkers #SafeCare https://t.co/zYwqckYF6p",2019-11-21 18:11:57,False,85396297
1197886675189452801,Thanks @EJinAction for your powerful testimony in our @EnergyCommerce climate hearing this week! Valuable insights as we build comprehensive #climate legislation that can lift up frontline communities and advance environmental justice for millions of Americans. https://t.co/kjFOoNwZpS,2019-11-22 14:36:53,False,84119348
1197638338515263488,"Today I cast my vote in support of H.R. 1309, the Workplace Violence Prevention for Health Care &amp; Social Service Workers Act and I'm pleased that it passed the House. I'm honored to have presided over the House during passage of this landmark legislation. My full statement below: https://t.co/zsxRj8uflR",2019-11-21 22:10:05,False,80612021
1197634001344901120,Must have hit a nerve...Thank you #FionaHill #impeachmentinquiry https://t.co/XUy6a4V0ME,2019-11-21 21:52:51,False,80612021
1197626039368900609,"""We are better than this."" @RepAdamSchiff (quoting @RepCummings).",2019-11-21 21:21:13,False,80612021
1197603943129526275,The voting site at Tidwell and Spaulding will be open for early voting and will be a general voting site for the runoff election in Houston.  I worked with @dtrautman.  The site was being made #ADA accessible and compliant.  The announcement will come tomorrow...,2019-11-21 19:53:25,False,80612021
1197897921175465985,"I was truly moved when members of our Georgia U.S. House delegation spoke Tuesday on the House floor. I’ve been thankful every day to have the opportunity to work with them and their staff members to help Georgia and our country. 
Watch: https://t.co/BrWvuycBTq",2019-11-22 15:21:34,False,78403308
1197657521391128578,Proud the #DriveSaferSunday resolution passed the Senate to promote safe driving and spread awareness of the dangers our roadways can present on the Sunday after Thanksgiving and throughout the holidays. https://t.co/OZ8sewrQKY https://t.co/iVRG3jrziy,2019-11-21 23:26:19,False,78403308
1197635060528230401,"When I saw the eyes of @Delta flight attendants after we passed legislation to save the airline and their pensions, I’ve never had a better feeling in my life. Our policies affect lives, and I’ve done my best to make sure we improve them for the better. https://t.co/WH5tucu7C4",2019-11-21 21:57:04,False,78403308
1197597383372279813,I’m wearing purple today to raise awareness for #PancreaticCancer and to support those dealing with the third leading cause of cancer-related death in the United States. #PANCaware https://t.co/CvRlROkdC8,2019-11-21 19:27:21,False,78403308
1197590842371923972,"Thank you, @SenatorRisch. I’ve enjoyed serving with you on @SenateForeign. I appreciate the leadership and partnership you and @USGLC have offered. Your continued focus on these critical issues is needed. https://t.co/018jTSEGwe",2019-11-21 19:01:21,False,78403308
1197610478178099200,"Our #RestoreOurParks Act would cut in half the maintenance backlog for our 419 national parks, including the @GreatSmokyNPS. This bipartisan legislation should be passed by the Senate then signed into law by @POTUS quickly so Americans can enjoy the parks for generations to come. https://t.co/xPICCwOrBK",2019-11-21 20:19:23,False,76649729
1197695638957445121,Every family in MI should have quality health care no matter where they live. The 2018 #FarmBill I co-authored expands telehealth technology so patients in rural communities can access medical care without having to travel long distances. #RuralHealthDay https://t.co/vi51LtKOsc,2019-11-22 01:57:47,False,76456274
1197608161760481280,I was so pleased to join Michigan's General Tom Cutler at @Mission_Ready's 10th annual celebration. This is a group of admirals and generals speaking out for children's health and well-being. Our wonderful partnership has made a huge difference in children's nutrition! https://t.co/FNiyQ7rtcf,2019-11-21 20:10:10,False,76456274
1197640119160840194,"""Enjoyed meeting with the UK's National Security Advisor Mark Sedwill and Chairman @RepEliotEngel today. I look forward to continuing our shared efforts to counter China's malign influence and advance democracy around the world."" -LR @RepMcCaul https://t.co/9ThAZjEUfX",2019-11-21 22:17:10,False,75367781
1197612280940236800,“I strongly condemn the continued human rights violations and attacks on religious institutions by the #OrtegaRegime. I stand with the freedom-loving people of Nicaragua in their struggle against the Ortega dictatorship.” -LR @RepMcCaul https://t.co/0k6wGH5rEt,2019-11-21 20:26:32,False,75367781
1197602854585995270,I'm proud to serve as co-chair of the Senate Rural Health Caucus on this National #RuralHealthDay and always fight for policies that address the unique challenges our rural communities face in accessing and delivering health care services. #PowerofRural https://t.co/pwRVUDVy9v,2019-11-21 19:49:05,False,75364211
1197890222912163840,"Incredible. Trump reiterates he won’t criticize China’s communist party for its violent crackdown on brave #HongKong protestors.

Not *one* republican in Congress has said a word. But they all have plenty to say about the nba! https://t.co/LBmnFHohVa",2019-11-22 14:50:59,False,74508260
1197685967701893121,Your daily reminder that trump and republicans are in court *right now* trying to destroy the ACA and have vowed to replace it with nothing. https://t.co/PmXBYg5rM4,2019-11-22 01:19:21,False,74508260
1197651462018519043,Americans just trying to enjoy a little live entertainment are fed up being gouged by hidden fees and corrupt monopolies. This watershed investigation will shed precious on light on ticket abuses. Thank you @FrankPallone for your leadership here! https://t.co/OHAr3Fjo9R,2019-11-21 23:02:14,False,74508260
1197632297077497856,The #ImpeachmentHearings this week demonstrated starkly that Democrats believe in a rule of law and our republican colleagues think trump is above all laws. https://t.co/4QDypZcIp8,2019-11-21 21:46:05,False,74508260
1197624843279179786,Your tax dollars at work #TrumpCorruption https://t.co/hgSv0PsNik,2019-11-21 21:16:28,False,74508260
1197586361898942466,Today’s witness Ms. Hill provides a perfect summary of what happened: trump hijacked America’s foreign policy for his political profit. #ImpeachmentHearing https://t.co/NMo82ob6R4,2019-11-21 18:43:33,False,74508260
1197570529915539457,"This cruelty by trump, effectuated by his lackies and laundered by congressional republicans is a stain on America that will linger for decades. It’s nothing less than an extinguishing of Lady Liberty’s torch. https://t.co/WyblxZp9kw",2019-11-21 17:40:38,False,74508260
1197615659070263296,"ICYMI: Chairman @RepEliotEngel led the Hong Kong Human Rights and Democracy Act to pass Congress.

Read his floor remarks in support of this critical measure to support Hong Kongers in their pursuit of autonomy and democracy: https://t.co/T5w2d535LP",2019-11-21 20:39:58,False,61206798
1197613053770113024,"Rep. Castro: If the Congress allows a president of the U.S. now or later to ask a foreign gov't...to investigate a political rival, what precedent does that set for American diplomacy...for the future of our country?
Hill: Sets a very bad precedent.
Holmes: Very bad precedent. https://t.co/5heVBKnDp7",2019-11-21 20:29:37,False,61206798
1197589900675207174,"Fiona Hill on Sondland:
""[Sondland] was being involved in a domestic political errand and we were being involved in national security foreign policy."" https://t.co/jfIeUGemtH",2019-11-21 18:57:37,False,61206798
1197597993471533056,"We’re trying to pass the #FUTUREact to fund Hispanic Serving Institutions, Tribal Colleges &amp; Universities—which serve thousands of students in NM—and Historically Black Colleges &amp; Universities. @SenateGOP shouldn’t stand in the way of support for these vital institutions. https://t.co/GqkEwok34W",2019-11-21 19:29:46,False,60828944
1197572535988170754,"A secret gov't list of journalists, and detaining them simply for doing their jobs? This is unconstitutional.
 
A free press is vital to our democracy. Journalists should not be intimidated for shining a light on Trump admin. policies. @aclu https://t.co/Y1cRzcnXFW",2019-11-21 17:48:37,False,60828944
1197645265290878978,"Proud to cosponsor and vote in favor of #HR1309 introduced by @RepJoeCourtney to help address workplace violence against our nation’s health care and social service workers. Thank you to @myWSNA, @NationalNurses, and the many other workers who fought to make this bill possible. https://t.co/RF3zKPMAWy",2019-11-21 22:37:37,False,58928690
1197612172202909704,Proud to join over 100 of my colleagues today saying that Stephen Miller should lose his job in the White House. It is unconscionable that the President's immigration policies are being written by an avowed white nationalist. https://t.co/SzlfzsU136,2019-11-21 20:26:07,False,58928690
1197901459221884928,"Stephen Miller is a white nationalist.

I proudly stand with my colleagues in calling for his removal. White supremacy has no place in the White House. https://t.co/zU55ARFn6K",2019-11-22 15:35:38,False,56864092
1197579206013661190,20 veterans die each day from suicide – that is 20 too many. That is why we must pass the IMPROVE Act to expand VA’s suicide prevention efforts to reach veterans who may not be aware of the mental health services VA offers. Read more here: https://t.co/SaxT2xU7wi https://t.co/BlsHlRUTzE,2019-11-21 18:15:07,False,52503751
1197907594465050625,Americans deserve a government that will keep them safe. It’s long overdue @senatemajldr and the @senategop take up and pass #UniversalBackgroundChecks #EndGunViolence https://t.co/ihpsuXFfUu,2019-11-22 16:00:01,False,50452197
1197597256716890113,"Great seeing my former student and East Hartford native, Commandant of @USCG Adm. Karl Schultz today! https://t.co/paNKEf7WDY",2019-11-21 19:26:50,False,50452197
1197587718324326400,Senseless gun violence has pierced nearly every aspect of our daily lives. Our communities shouldn’t have to constantly live in fear. It’s time @senatemajldr and the @senategop #DoSomething #EndGunViolence https://t.co/5aYBy5BOd8,2019-11-21 18:48:56,False,50452197
1197573083500077057,"Our nation’s health care and social service workers care for the most vulnerable in our society. However, they can often be at risk of workplace violence due to their unique roles. That’s why I’m proud to vote for @RepJoeCourtney's #HR1309 to address this growing epidemic!",2019-11-21 17:50:47,False,50452197
1197702616534470664,"Water Optimization for the West Act Introduced Today to Provide Pathway to Water Abundance
https://t.co/PdQsg2YQfa",2019-11-22 02:25:30,False,50152441
1197902364956487680,Really hoping my WiFi works on the plane. https://t.co/A76KWmROh2,2019-11-22 15:39:14,False,47747074
1197885363643023360,"Ambassador, please testify in front of the Congress. https://t.co/8dWtbHDo6a",2019-11-22 14:31:40,False,47747074
1197723396626247680,Sacha Baron Cohen's Keynote Address at ADL's 2019 Never Is Now Summit on Anti-Semitism and Hate | Anti-Defamation League https://t.co/LogafQdDpG,2019-11-22 03:48:05,False,47747074
1197718821785591808,I’m gonna send some more money. Who else is in? https://t.co/1YfhvC0xvu,2019-11-22 03:29:54,False,47747074
1197707439346335744,"Stop making excuses for these cowards. It’s not savvy or helpful to explain it. Everyone understands their pressures, their ambitions, the hermetically sealed media environment, fear of a primary. Still. Cowards. They choose their job over their country.",2019-11-22 02:44:40,False,47747074
1197650655013261312,"Whether this madness continues is not dependent on a new, explosive, viral moment. It doesn’t depend on media coverage or what Schiff or Nunes say. It depends on whether enough people transition from being transfixed and worried to becoming volunteers and donors.",2019-11-21 22:59:02,False,47747074
1197605998984409088,Hey we should run against corruption. People hate it!,2019-11-21 20:01:35,False,47747074
1197599230925381632,They’ve got nothing.,2019-11-21 19:34:41,False,47747074
1197570007502348288,"Proud to announce that the @EPA awarded more than $3.5M for the Great Lakes Restoration Initiative. 

We must ensure the GLRI is operating at its full strength so communities can continue the necessary work to keep Lake Erie clean for the next generation. https://t.co/FcP8hfW63f",2019-11-21 17:38:34,False,43910797
1197611698808594432,"#Today, every Republican committee member is calling on Chairwoman Waters to protect private American citizens' personal financial information from being publicly released in Democrats' #impeachment probe. Read the letter: https://t.co/2qOJWwplXG https://t.co/38iEOeHOI8",2019-11-21 20:24:14,False,42924141
1197600157552009218,"Great having the Community Impact Director, Heather Valudes, York County Economic Alliance, and the Greater Philadelphia Chamber to my office in Washington today, to discuss advancing workforce development, workforce partnerships, and workforce funding policies. #SkillsOnTheHill https://t.co/DSdApPt77V",2019-11-21 19:38:22,False,41417564
1197641925798617088,"Our nation's caregivers are 5x more likely to experience workplace violence than workers in other sectors. Today, I was proud to vote for the Workplace Violence Prevention for Health Care and Social Service Workers Act, because no one should feel unsafe in their place of work. https://t.co/5mKSQJZZmU",2019-11-21 22:24:20,False,40302336
1197872072975892480,"As @ABeautifulDay shows in theaters today, we continue to celebrate the legacy of Fred Rogers and his role in #PGH. In 2003, I introduced a resolution in his memory – and I will continue to honor his legacy of neighborly love and wisdom.
https://t.co/AsoCDfofnj",2019-11-22 13:38:52,False,39249305
1197608144647675905,"I’m an original cosponsor of the 100% Clean Economy Act, which would set a nationwide goal of achieving net zero carbon emissions by 2050. This bill would protect our planet for the future and strengthen our economy by creating new good paying jobs. #100by50 #ClimateChange https://t.co/kZabTpJSVp",2019-11-21 20:10:06,False,39249305
1197607178221375489,"Health care and social services workers are four times more likely to face workplace assault or injury than any other workers. Today, I voted yes on H.R. 1309, a bill to require health care and social services employers to develop workplace violence prevention plans.",2019-11-21 20:06:16,False,39249305
1197620842693304323,Exijo al #RégimendeOrtega permitir la asistencia a familiares de los presos políticos que se mantienen en huelga de hambre en la Iglesia San Miguel. Es inaceptable que el régimen arreste a quienes tratan de llevarles ayuda humanitaria.  #Nicaragua https://t.co/NuRjR6Z1o2,2019-11-21 21:00:34,False,37094727
1197603995822559232,"We're one step closer to finally solving the labor crisis facing our nation’s agriculture. I encourage the Speaker to bring this important legislation to the floor for a vote so that we can achieve a good-faith, bipartisan solution for our nation's farmers. #FutureFarmWorkforce https://t.co/XvPUau8ixk",2019-11-21 19:53:37,False,37094727
1197893214159720449,"T&amp;I Republicans remain committed to bipartisanship.

T&amp;I Majority’s Partisan Pipelines Bill ☹️
Bipartisan opposition? ✔️
Partisan process? ✔️

T&amp;I Republicans’ Pipeline Safety Improvement Act 🙂
Bipartisan support? ✔️
Bipartisan process? ✔️

https://t.co/CLkvVUvZVJ",2019-11-22 15:02:52,False,35829796
1197578870255423488,"Two ""Mornings with Mike"" events left for 2019.
Come see us in December (we will even have our Christmas tree up)! #AL03 https://t.co/y4bESJjVM3🎄🎄 https://t.co/wQJG1j79nB",2019-11-21 18:13:47,False,33977070
1197583252762091520,"The @BLS_gov reports that workplace violence in healthcare and social service jobs have increased by 80% over the last decade. Today the House approved HR 1309, supported by @wnycosh, providing added protections for workers.",2019-11-21 18:31:12,False,33576489
1197620004382003201,"Yesterday, I lead @HouseCommerce in advancing legislation to protect communities in the Pacific Northwest and all over the country from nuclear waste. You can learn more about the progress and read my joint statement with @RepShimkus here: https://t.co/7eksg3oB5P",2019-11-21 20:57:14,False,32010840
1197578829742723072,"Today my staff &amp; I wore purple in honor of #WorldPancreaticCancerDay. On this day, I am thinking of my friends Linda Sindt &amp; Margaret Grubb &amp; all those across the country fighting for a cure for pancreatic cancer. Join us in shining a light on one of the deadliest cancers. https://t.co/oc1C9rFbMe",2019-11-21 18:13:37,False,32010840
