tweet_id,text,created,retweet,user_id
1197688847926284289,We heard directly from young Arizonans at Pima County's Teen Town Hall about creating positive change in their communities. https://t.co/Exwdkx8uYy,2019-11-22 01:30:47,False,1080844782
1197660860744970240,Check out DeDe Alexander’s firsthand account of her students’ Odyssey of the Mind world championship! Thank you for fostering creativity in AZ kids. ➡️ @SraAlexander #AmericanEducationWeek,2019-11-21 23:39:35,False,1080844782
1197626849200873479,"We secured grant funding to create jobs, expand opportunities, and ensure Sky Harbor remains an economic driver for Arizona. https://t.co/MoJkAoJjtp",2019-11-21 21:24:26,False,1080844782
1197574190473392129,AZ Veterans: we want to hear from you. Take our confidential VA Services Survey so we can ensure you’re getting the care you’ve earned. https://t.co/3fYZHpIq8Q https://t.co/i1ayZoQpZZ,2019-11-21 17:55:11,False,1080844782
1197892494694002689,Honored to welcome the 2019 NCAA Rifle National Champions to the Capitol and the White House! I’m proud to be a TCU alumnus and I congratulate this talented team on their well-deserved victory. #GoFrogs https://t.co/pbebBjS901,2019-11-22 15:00:01,False,1077446982
1197584134551605250,"Instead of passing #USMCA–like we’ve been saying from day one–House Democrats have been obsessed with impeachment hearings. 114,200 jobs in Texas depend on manufacturing exports to Canada &amp; Mexico. There's no excuse for balking at legislation that affects the American people. https://t.co/daQMduU2Gc",2019-11-21 18:34:42,False,1077446982
1197892496283463680,"#FunFactFriday: Did you know that Florida had the highest enrollment of any state in the country last year? 

Go online to https://t.co/2tc34oHOR0 today to take part in this year's #OpenEnrollment and make sure you #GetCovered in 2020. https://t.co/JMUPrvslF9",2019-11-22 15:00:01,False,1077121945
1197647124336394240,"Shameful. 

With more than 26 mil. refugees around the world, the Trump Admin is betraying American values by putting cruel policies in place to inhibit the ability of vulnerable people to come the U.S. to find safety &amp; a new life. 

This is the result. https://t.co/oG65eBwFtm",2019-11-21 22:45:00,False,1077121945
1197630062847254530,"There will always be bipartisan Congressional support for Ukraine.
 
I was very inspired by the newly elected members of Ukrainian Parliament that I met today &amp; their passion for democratic ideals. https://t.co/9PVdjI0cll",2019-11-21 21:37:12,False,1077121945
1197605604606410752,"#NativeAmericanHeritageMonth is about celebrating the incredible contributions of Native Americans to our country.

I am proud to serve with the first Native American women in Congress, @RepDebHaaland &amp; @ShariceDavids. https://t.co/6J3aAAx9vw",2019-11-21 20:00:01,False,1077121945
1197575403935686658,Prescription drug prices are surging – we need to act fast to pass @HouseDemocrats’ legislation to #LowerDrugCosts now. It would help families across the country &amp; save lives! #ForThePeople https://t.co/u1n47qCidj,2019-11-21 18:00:00,False,1077121945
1197628249804660736,Women make up less than 10% of the truck driving workforce and we need to remove barriers that get in the way of women pursuing &amp; retaining careers in trucking. Proud to lead a bipartisan effort to create more job opportunities for women. https://t.co/KYrjBQPzdc,2019-11-21 21:30:00,False,1074518754
1197606649885794305,"My legislation to protect health care &amp; social services workers from workplace violence just passed the House! Now we need action in the Senate to move this reform forward to ensure these workers can do their job in a healthy, safe work environment. https://t.co/2hI4o1q3QA https://t.co/g0sVs2nXt8",2019-11-21 20:04:10,False,1074518754
1197571626839228416,"Shipbuilding is so important to our #MadeinWI economy and I hope VP Pence will tell @POTUS to stop proposing budget cuts to our shipbuilding economy. 
https://t.co/5NEtou0ivY",2019-11-21 17:45:00,False,1074518754
1197901116635328513,I applaud @OAS_official &amp; @USAmbOAS for their strong commitment &amp; efforts in exposing the atrocious human rights abuses &amp; crimes of the brutal Ortega regime against the Nicaraguan people. The US must continue to stand against these abuses &amp; support the people of Nicaragua. https://t.co/TYGZd033mI,2019-11-22 15:34:16,False,1074480192
1197707891479896065,"There’s real work to be done in Congress, but House Democrats are using precious time and taxpayer resources to instead continue their partisan impeachment circus. The American people deserve better. 
https://t.co/wiyj2HDN75",2019-11-22 02:46:28,False,1074480192
1197625066156150784,"Tune in at ~4:30pm ET for my interview with @benshapiro where I discuss the #HongKongProtests, the #DemDebate, and more.
 
Listen here --&gt; https://t.co/MmIrtGQSsN",2019-11-21 21:17:21,False,1074480192
1197621688260796437,"FERC’s final approval of these four LNG projects is good news for both the RGV and Corpus Christi communities. These projects will further economic growth, help employ thousands of hardworking men and women, lower energy costs, and increase America’s energy independence.",2019-11-21 21:03:55,False,1074480192
1197613471271133184,"ATTN #TX: @HoustonFoodBank needs help! Following a recent ammonia leak the #Houston Food Bank is in desperate need for volunteers. 

For more information, click here --&gt; https://t.co/TlCsqY8u0z

#TexansHelpingTexans #HoustonStrong https://t.co/18mR22vpIS",2019-11-21 20:31:16,False,1074480192
1197607376242827264,Recently the House voted to pass a resolution to formally recognize the #ArmenianGenocide &amp; reject all forms of its denial. Today on the Senate floor I called upon on my Senate colleagues to take up and pass the resolution I introduced with @SenatorMenendez in the Senate. https://t.co/2XDsDPJDE3,2019-11-21 20:07:03,False,1074480192
1197601661214248960,Important historical context by @liel about @realDonaldTrump's pivot away from the Obama administration’s disgraceful anti-Israel UN resolution 2334. I will keep working with my colleagues to ensure the world knows U.S. considers it null and void. --&gt; https://t.co/S9tvMgn19t,2019-11-21 19:44:21,False,1074480192
1197573148318871553,"Saddened to hear of the loss of Ft Hood soldiers in Afghanistan. This is a solemn reminder of the sacrifices our brave men &amp; women in uniform make to protect freedom around the world. Grateful for CWO 2 Knadle from TX &amp; CWO 2 Fuchigami from Hawaii.
https://t.co/9UoryJr7PI",2019-11-21 17:51:03,False,1074480192
1197904904855212032,Excited to kick off my 7th annual job fair at @TCCollege in Fort Worth today. Stop by to connect with actively hiring North Texas employers! https://t.co/VbgC4Skncp,2019-11-22 15:49:19,False,1074129612
1197633071211798529,"My prayers are with the family of David C. Knadle of Fort Worth, Texas. David was a brave serviceman, a proud North Texan, and a fellow alumni of Texas Wesleyan University. We will forever remember his service and sacrifice that protected our nation. 

https://t.co/RtvvlekxMJ",2019-11-21 21:49:09,False,1074129612
1197628904850235395,FACT: Most people who signed up to #GetCovered for 2019 received financial help. Be sure to sign up before the deadline on December 15!,2019-11-21 21:32:36,False,1074129612
1197617790657744896,"🗣️Attention Fort Worth Dallas 🗣️

Our 7th Annual Job Fair is tomorrow and it is free &amp; open to the public!  

See you there! 
https://t.co/zaAxJVa9RT",2019-11-21 20:48:26,False,1074129612
1197604687786184705,Our region has had 70 valiant Medal of Honor recipients and over 1 million veterans and active duty military call Texas home. That is why I’m proud to have introduced the bipartisan National Medal of Honor Monument Act with my fellow North Texan @RepRonWright earlier this week! https://t.co/lbnopdyfGX,2019-11-21 19:56:22,False,1074129612
1197636497832321026,"4 years ago in December, my good friend lost her battle to pancreatic cancer. 

On #WorldPancreaticCancerDay, I am thinking of Judy &amp; all those across the country fighting for a cure for pancreatic cancer. https://t.co/Nr64m3IQyX",2019-11-21 22:02:46,False,1074101017
1197714241668685824,Tired? Long week? We don’t know what you’re talking about. @maddow https://t.co/ph4FInGK6J,2019-11-22 03:11:42,False,1072467470
1197709717948243968,"On with @maddow @MSNBC. It’s been a long few weeks and there’s a lot more work to come. Congress is going to determine what response is appropriate, if the president abused his power, and if those acts are compatible with the office of the President. Tune in. https://t.co/PvEDcyixzo",2019-11-22 02:53:43,False,1072467470
1197690479204339723,"NOW: Back on with @AC360 @CNN. Talking Dr. Hill, Holmes &amp; our next steps in this impeachment inquiry. Tune in. https://t.co/aoBpRLNUkj",2019-11-22 01:37:16,False,1072467470
1197646117430845440,Dr. Fiona Hill &amp; David Holmes confirmed how Trump conditioned official acts on Ukraine's willingness to announce politically beneficial investigations. They testified at personal &amp; professional risk. I thank them for their courage &amp; dedication to the truth. #DefendOurDemocracy https://t.co/wWPw7c0jNF,2019-11-21 22:41:00,False,1072467470
1197618601777410049,It was. Got to call it when I see it - especially here in Congress. https://t.co/XzPx3OOw0g,2019-11-21 20:51:39,False,1072467470
1197618080400236546,Just doing my part... I've got two daughters at home. https://t.co/Ac9vL717PY,2019-11-21 20:49:35,False,1072467470
1197617601867894785,"FACT CHECK: The Mueller investigation netted dozens of indictments &amp; more than 6 convictions - including Roger Stone.

It exposed Russia's effort to help Trump win in '16 &amp; their intent to do so again in '20. It did NOT exonerate Trump.

How about telling the truth @Jim_Jordan? https://t.co/Zs9XSqsw6n",2019-11-21 20:47:41,False,1072467470
1197613900386230274,"Important clarification here from Dr. Hill: President Trump's Ukraine pressure campaign was a domestic political errand that clashed with U.S. foreign policy. The two things diverged, and she was right: it ALL blew up. https://t.co/1V3oOx2MCb",2019-11-21 20:32:59,False,1072467470
1197601687265042433,"Powerful reminder that these witnesses have come to Capitol Hill at great personal and professional risk. They do so because they feel a duty to this country and a duty to the truth.

Thank you, Dr. Hill and Mr. Holmes for your courage today. https://t.co/27uejnlr4w",2019-11-21 19:44:27,False,1072467470
1197600885490274305,Agreed. https://t.co/3boq4mqqGs,2019-11-21 19:41:16,False,1072467470
1197617375778086913,"Today, I joined @SenBlumenthal &amp; @SenMarkey to introduce the #SCOPEAct. This bill would require cars with keyless ignitions to automatically shut off after a certain amount of time in order to prevent deaths from carbon monoxide (CO) poisoning. https://t.co/Jl1P5RF1Vd",2019-11-21 20:46:47,False,1071402577
1197678218733588481,This #WorldFisheriesDay is the perfect opportunity to highlight the importance of crafting fisheries policy based on science that meets the needs of our communities and the environment. 🐟,2019-11-22 00:48:33,False,1071102246
1197622969801023493,"It appears the bipartisan #USMCA is the latest victim of @SpeakerPelosi &amp; @RepAdamSchiff's impeachment obsession.

Not much productivity left for Congress in 2019 - only more theatrics &amp; hysteria from Dems. It's a shame. We should pass the #USMCAnow.

https://t.co/xrIQ3l29gs",2019-11-21 21:09:01,False,1069124515
1197613539701202944,"The facts are no longer in dispute. The President pressured a foreign government for made-up dirt on a political opponent, compromised our national security, and endangered the integrity of our elections.

The President did it.

The only question remaining is: What will we do? https://t.co/fjbap2DeLT",2019-11-21 20:31:33,False,1068499286
1197573291814408198,"Maine is one of the most rural states in the nation – on #NationalRuralHealth Day, I want to thank providers and advocates who work to improve care throughout our state. Maine people deserve access to quality, affordable healthcare, regardless of where they choose to live.",2019-11-21 17:51:37,False,1068481578
1197694658421436416,"Good luck on the Thursday night stage, @deshaunwatson! You make Gainesville proud. #GA09",2019-11-22 01:53:53,False,1060487274
1197596685435887618,"When you're trying to overturn 63 million votes and take down a sitting president, you better come up with something more than the fact that you don’t like him.
https://t.co/KPXPQ99PQD",2019-11-21 19:24:34,False,1060487274
1197665999505514497,It’s a shame that Nancy Pelosi playing politics instead of creating jobs for the American people. https://t.co/aq0aKRXBdW,2019-11-22 00:00:00,False,1060370282
1197649645050245120,"Today is National Rural Health Day. Rural areas like the Second District have unique needs when it comes to health care and in Congress, I am committed to making sure my constituents have access to quality, affordable health care.",2019-11-21 22:55:01,False,1060370282
1197688395834638336,Honored to be recognized by @IssueOneReform for my ongoing work to reform Congress and reduce money in politics. I'm working every day to ensure Congress takes concrete steps toward creating a government that works better for the American people. https://t.co/omAvYOLgnW,2019-11-22 01:29:00,False,1058917562
1197605653461774336,Data from @BLS_gov shows that incidents of workplace violence in the health care &amp; social services sectors have increased by 80% over the last 10 yrs. I was proud to co-sponsor &amp; vote in favor of legislation to provide health &amp; social service workers the protections they deserve https://t.co/Rie9OLLygT,2019-11-21 20:00:12,False,1058917562
1197631058226929665,Proud to join my colleagues to pass the SAFER Pipelines Act through @energycommerce this week to protect communities from gas explosions like the Merrimack Valley tragedy of 2018. Glad to see this vital legislation move forward to prevent future tragedy &amp; improve our air quality. https://t.co/MpMkupAciP,2019-11-21 21:41:09,False,1058717720
1197605775277010945,"Proud to join my colleagues in introducing the 100% Clean Economy Act to #actonclimate in a much-needed step toward 100% clean energy by 2050. Our bill will:
🌎Create a clean &amp; safe future for Granite Staters
🌎 Creating green jobs
🌎 Improve public health https://t.co/c6rXpBLzCd",2019-11-21 20:00:41,False,1058717720
1197602985053970433,"President Trump &amp; his Admin continue to sabotage #ACA. Gutting funding for open enrollment advertising stifles Americans' access to info &amp; resources they need to sign up for quality, affordable care. Visit https://t.co/X3VaOo9BC1 to #GetCovered in 2020. https://t.co/Rn7oDnZdUf",2019-11-21 19:49:36,False,1058717720
1197577917875621890,"Far too often, mothers &amp; moms-to-be in rural communities  struggle to access the care needed to raise a healthy family. On #RuralHealthDay I’m proud to voice my support for the Maternal Health Quality Improvement Act to improve access to maternal care for all families. https://t.co/ewv0BhC1qS",2019-11-21 18:10:00,False,1058717720
1197903757218078726,"Is your family insured? It’s easy to sign up for health care coverage – many people are able to pick a plan and enroll in a single visit.

Head to https://t.co/Exlg5xuNqg to take part in this year's #OpenEnrollment and make sure you #GetCovered in 2020.",2019-11-22 15:44:46,False,1058520120
1197666217844195329,"Generations of economic &amp; racial inequality have exposed workers, low-income communities, communities of color &amp; others to toxic pollution &amp; climate threats.

Honored to chair @SenDemsClimate hearing on #EnvironmentalJustice earlier—let's #ActOnClimate &amp; uplift these communities. https://t.co/tQbB0Z5cBS",2019-11-22 00:00:52,False,1058520120
1197644570126888962,"HBD, @Fermilab, which has helped lead the world in scientific &amp; technological innovation for 52 yrs. This week, my bill to help prepare the next generation of students to work in our National Labs passed out of committee – one step closer to becoming law! https://t.co/9NvcJJqk3g",2019-11-21 22:34:51,False,1058520120
1197634480774766594,"A recent study found that *95%* of baby food tested had toxic heavy metals.

Today I sent a letter – along with 8 colleagues – to the @US_FDA asking them to take immediate action and ensure our nation’s baby and toddler food is safe. 

https://t.co/H9WNadCoeB",2019-11-21 21:54:45,False,1058520120
1197630937850417154,"Happy, happy birthday to my friend and mentor in the Senate, @SenatorDurbin. I hope you have a wonderful day! 🥳🎉",2019-11-21 21:40:41,False,1058520120
1197624669563768832,"Half of adults who need mental health care don’t get it. And it’s worse for kids.  

Our Behavioral Health Coverage Transparency Act would make sure insurers don’t skirt the law. https://t.co/6Hsy8125mr",2019-11-21 21:15:46,False,1055907624
1197889471083089920,"The facts are clear. President Trump used the power of his office to corruptly force a foreign government to interfere in our election, and to smear Vice President Biden. This is wrong. No President, of any party, can be allowed to undermine our democratic process. https://t.co/NQPSUS1HCn",2019-11-22 14:48:00,False,1055730738
1197611631032844289,President Trump’s defenders have been relying on absurd conspiracy theories about Ukraine to sow confusion. I thank Dr. Hill for her testimony to set the record straight. https://t.co/DxG3NarWM4,2019-11-21 20:23:58,False,1055730738
1197585467807608837,"The GOP has dismissed the shocking testimony of the career officials who have voiced concerns about the quid pro quo with Ukraine, claiming that they lacked firsthand knowledge of President Trump’s actions. Ambassador Sondland proved them wrong.",2019-11-21 18:40:00,False,1055730738
1197627996179439641,"I appreciate Congress preserving these highway funding investments as we work to pass legislation for improving our nation’s infrastructure.

Without today’s repeal, this rescission would harm states, slow the economy, and cost us American jobs. https://t.co/e8nRKZQZS2",2019-11-21 21:28:59,False,1048784496
1197575276277981184,"Senate Democrats continue to block a normal appropriations process from advancing.

At a certain point, we have to quit kicking the can down the road. https://t.co/UusqWuqIez",2019-11-21 17:59:30,False,1048784496
1197886512756641792,"A #surfacetransportation reauthorization this Congress is critical for #rail passengers in #IL03 &amp; across our nation. I lay out my priorities as Chair of the House Railroads, Pipelines &amp; Hazmat Subcommittee in this @rail_pro_mag op-ed #transportation https://t.co/dXKd4Up8do",2019-11-22 14:36:14,False,1009269193
1197698342781890561,"#100x50 legislation will ensure that our planet is protected. I am proud to support the 100% Clean Economy Act of 2019, which not only addresses the climate crisis, but also strengthens our economy and public health.",2019-11-22 02:08:31,False,1009269193
1197662510071070722,Proud to be a co-sponsor of the workplace violence prevention legislation that passed the House today. #HR1309 compels @OSHA_DOL to issue a standard requiring employers within the health care &amp; social service sectors to implement comprehensive #ViolencePrevention programs. 1/2,2019-11-21 23:46:08,False,1009269193
1197600095107244033,Only 9% of Americans with #pancreaticcancer survive 5+ years &amp; it’s the 3rd leading cause of cancer-related deaths in the US. I’m raising awareness on #WPCD to bring attention to the world’s deadliest major cancer and prioritize lifesaving research. #PANCaware,2019-11-21 19:38:07,False,1009269193
1197650857661227008,Don’t miss a chance to see the Northern Lights. https://t.co/AWJuIAIPhG,2019-11-21 22:59:50,False,995193054
1197625943218630657,"Thanks to the American Society of Association Executives for our conversation on consumer privacy. Privacy spans all sectors, from educational institutions to nonprofits &amp; I'm always happy to discuss my bill H.R. 2013, which would give consumers back control of their data online. https://t.co/i4Sf8Flee0",2019-11-21 21:20:50,False,995193054
1197593309855789056,Glacier Peak High School – here’s another one for the yearbook! Great meeting your yearbook team yesterday. #WA01 https://t.co/V1QQ2qAizL,2019-11-21 19:11:09,False,995193054
1197611334764023809,Proud to support the @ConnectTransit and their Better Bus Stop Campaign to increase and improve mobility in the Bloomington-Normal area! https://t.co/FJcTK8LjUI,2019-11-21 20:22:47,False,993153006
1197569551837343746,"This is extremely disappointing. When Speaker Pelosi visited Springfield in August, she promised farmers that this trade deal would be on the House floor in October. The USMCA would increase ag exports by at least $2 Billion annually. #USMCAnow https://t.co/Xc8D7N3C49",2019-11-21 17:36:45,False,993153006
1197614761258688522,"Madam Speaker, we've had all year to pass #USMCA. Let's use our eight remaining legislative days to get this bipartisan win on the books for the American people. #USMCAnow https://t.co/m4EAlzWlhO",2019-11-21 20:36:24,False,976969338
1197851697462292480,"Have a few minutes and want to know what went on this week in Congress? Want to know how they always get away with it?  Check out this interview...

https://t.co/LTPuPZGAdU",2019-11-22 12:17:54,False,975200486
1197666640005128192,"I wondered what his retirement would be like. 😂 
#sassywithmassie 
#thisarticleagedwell
https://t.co/2r5B6m020w",2019-11-22 00:02:33,False,975200486
1197631709732392962,"A couple of years ago, I travelled to S Korea with a congressional delegation. The US state dept assigned one of their in-country experts to assist us. As our bus drove to the DMZ, we passed many rice paddies. A congressman asked the state dept. expert, “are these rice fields?”",2019-11-21 21:43:45,False,975200486
1197624518577152001,I tweeted this based on my observations at the closed depositions a few weeks ago. I stand by this statement 💯 % now that the hearings are public... https://t.co/3cKQzjHOiw,2019-11-21 21:15:10,False,975200486
1197615895402733568,"ICYMI: Spoke with Kevin Gordon on @55KRC yesterday on red flag gun laws in Kentucky and the latest antics in Congress

Click here if you missed it:
https://t.co/pUPtaHUjMc",2019-11-21 20:40:54,False,975200486
1197573300450418688,"Joined @KennedyNation last night to discuss House Dems ramming through Patriot Act in this week’s spending bill, something few in media have been talking about.

Watch here to learn more about the latest example of Nancy Pelosi’s cognitive dissonance: https://t.co/P5Ultcnq0A",2019-11-21 17:51:39,False,975200486
1197628454046441472,"I'm concerned by reports that @Google collected personal health information from 50 million Americans without their consent. @SenBlumenthal, @SenBillCassidy &amp; I want Google to explain “Project Nightingale” &amp; how they’re planning to use this private data. https://t.co/ezJv10CBnM",2019-11-21 21:30:48,False,970207298
1197903604415373313,"Combating the feral hog problem will require involvement across local, state, and federal entities. Glad to see USDA’s commitment to to help Arkansans! https://t.co/fESB6U57b4",2019-11-22 15:44:09,False,968650362
1197618479274303488,"Convicted killers like Daniel Lewis Lee have delayed their sentences for years with endless appeals. Now, after all the due process in the world, a judge in D.C. has decided to manufacture more ways to deny justice to Lee’s victims. https://t.co/yOojxS2AEo",2019-11-21 20:51:10,False,968650362
1197614108134252547,.@SenSchumer and I sent a letter to the president requesting that the Department of Commerce immediately suspend approval the export licenses that allow U.S. exports to the Chinese spy company Huawei.   https://t.co/ien2DlGdWK,2019-11-21 20:33:48,False,968650362
1197602921187332102,"A white supremacist has been on death row for decades after murdering an Arkansas family, including a young girl. He’s spent years trying to thwart justice, and now he has help from a liberal judge in D.C. who halted his execution. https://t.co/bL5OwKCsu1",2019-11-21 19:49:21,False,968650362
1197588317598093313,A district judge in Washington just issued an opinion halting the execution of a criminal who committed a brutal murder in AR &amp; was sentenced by juries of his peers. He spent years exhausting every avenue of due process. It’s time for justice to be served. https://t.co/zhsAAS7r28,2019-11-21 18:51:19,False,968650362
1197620856706523137,"The Democrats closed out their witness lineup today with one witness who claims he partially overheard a vague call in a restaurant, and another who pointed back to a witness (Sondland) that already debunked his own claims yesterday.

This is not serious. Let's back to work.",2019-11-21 21:00:37,False,963480595
1197606800884977664,"The ""Impeachment Effect""

""Speaker Pelosi casts doubt Congress has enough time left to pass the USMCA this year"" https://t.co/wC7tpV33KN",2019-11-21 20:04:46,False,963480595
1197596250398482434,"Sondland was asked about this statement, about an hour later, and said:

""I've never heard from President Trump that the aid was conditioned on the investigations""

Asked if he had any evidence POTUS linked aid/political investigations:

[No] ""...other than my presumption"" https://t.co/DrJ4u2o1Rr",2019-11-21 19:22:51,False,963480595
1197593273914855424,"For those seizing on the Fiona Hill comment about Sondland and a ""domestic political operation"" - you do realize we just heard from Sondland yesterday, who admitted @realDonaldTrump never asked him for a political quid pro quo, ever, and it was all his evidence-free assumption",2019-11-21 19:11:01,False,963480595
