tweet_id,text,created,retweet,user_id
1194029282328227845,"I am proud to welcome Andrew Lutz to our DC office this week as a military fellow.

Andrew served as a combat engineer and IED detection dog handler during two tours to Afghanistan with the First Marine Division.

Thank you for your service Andrew and welcome to the team! https://t.co/noxRrg7VAd",2019-11-11 23:08:59,False,1083474782602125318
1194016413142409216,"Happy Veterans Day to all those who fought to defend our nation and American way of life.

One of my great privileges has been meeting so many of our military heroes and hearing their stories of courage, service and valor.

Thank you, veterans for your service and sacrifice. https://t.co/d0Vg9caxDh",2019-11-11 22:17:51,False,1083474782602125318
1193989384044982272,I walked in Lower Townships 2nd Annual Veterans Day Parade over the weekend and got to stop by and chat with a bunch of amazing members of the South Jersey community. https://t.co/WfYJou42S4,2019-11-11 20:30:27,False,1083469084648505344
1193974327760375808,"The VFW Post 8098 in Egg Harbor Township, New Jersey held their Quilts of Valor Ceremony on Saturday and I stopped by to say hello to the community and our veterans. https://t.co/LNo4O5eEaK",2019-11-11 19:30:37,False,1083469084648505344
1193952053787340809,"Over the weekend I joined the @littoralsociety American Littoral Society at Cooks Beach in Middle Township, NJ for their dedication to our veterans ceremony. https://t.co/bNz6Tr2yoZ",2019-11-11 18:02:06,False,1083469084648505344
1193950032153776128,Today I joined Egg Harbor Township High School at their Wall of Honor Dedication Ceremony. #VeteransDay,2019-11-11 17:54:04,False,1083469084648505344
1194025731157872641,"Grateful for the opportunity to join Bethany Middle and High School for their Veteran’s Day Assembly to honor our veterans, service members, and military families who have and continue to sacrifice for our country. https://t.co/iIJinb6K4m",2019-11-11 22:54:52,False,1083019402046513152
1193946632351600640,"Thanks to Girl Scouts from Troops 3279, 654, and 547 for posting the colors at our town hall today!  Great to exchange stories about the opportunities and lessons @GirlScouts provides. @GSWestOK https://t.co/v8xTsCJwbw",2019-11-11 17:40:34,False,1083019402046513152
1193946317904633857,"Thanks to everyone who attended our town hall yesterday. I appreciate hearing from you! Many had concerns about education, healthcare, our military and veterans and more - all issues I’m working on every day. https://t.co/cqYWOE0wVs",2019-11-11 17:39:19,False,1083019402046513152
1194273635927769092,"This month our nation topped $23 trillion in debt. In response to such a sad achievement, I introduced legislation titled the “Know Debt Resolution,” which would place debt clocks in the main meeting rooms of the House Budget Committee and House Appropriations Committee.",2019-11-12 15:19:57,False,1082790600292925440
1194250077214248961,"ICYMI: I discussed my bill #HR1700 (designating certain Mexican drug cartel factions Foreign Terrorist Organizations) w/ @foxandfriends Sunday morning. 

#StateOfOurBorder
#EndBorderCrisisNow

https://t.co/JrPqekoove",2019-11-12 13:46:21,False,1082790600292925440
1194283125901279233,The Supreme Court should recognize that #HomeIsHere for DACA recipients. They built their lives here since they were kids. They don't know any other country as home. We must uphold #DACA in the highest court of our country. https://t.co/EteBJx9CtG,2019-11-12 15:57:40,False,1082427779583541248
1194261284981813253,"Joined faith leaders, @SenatorDurbin, @RepSylviaGarcia, &amp; @JoaquinCastrotx for a prayer breakfast in support of  #DACA recipients. We’ll keep fighting to #ProtectTheDream. #HomeisHere #HereToStay https://t.co/PvygT6kIn0",2019-11-12 14:30:53,False,1082427779583541248
1194104224826740736,"DACA recipients and advocates from around the country marched from New York to DC to urge the Supreme Court to protect the #DACA program. I met with young people tonight from Chicago, Arizona, and California to offer my support and send a clear message: #HomeisHere. #HereToStay https://t.co/6qJSrXBP8O",2019-11-12 04:06:47,False,1082427779583541248
1194037120572235776,I was honored to join the #VeteransDay ceremony at the Manuel Perez Memorial Plaza this morning with Latino veterans whose courage and love for this country remain to this day. https://t.co/7wxOygc0qy,2019-11-11 23:40:08,False,1082427779583541248
1194019528612761606,"Winter is arriving with heavy snow and record-low temperatures.  With forecasts predicting days in the single digits this week, make sure you know about resources and warming centers in Cook County to keep you and your family safe. Click here👇
 
https://t.co/FqvDVfSWlK",2019-11-11 22:30:14,False,1082427779583541248
1194295405435117569,I’m glad to read this. It’s critical we stay on offense if we want to remain successful in the fight against ISIS — and that means we must keep a small presence of special forces in Syria to continue the mission. https://t.co/FZuRR7fPS8,2019-11-12 16:46:28,False,1082416697380913152
1194273396193996800,"Gentlemen, start your engines! Thrilled to be the Grand Master at the New Smyrna Speedway’s 54th Annual Governor’s Cup. 

@congbillposey &amp; I had a great time cheering on drivers at one of Florida’s most prestigious races! https://t.co/IdVEGDZW6g",2019-11-12 15:19:00,False,1082416697380913152
1194252995191549954,"Mixed feelings. Great ⁦@realDonaldTrump and Afghan Pres. Ghani focused on bringing US hostages home. Happy for Weeks and King families.

My jury is out on whether the #Taliban are serious about peace. I pray this is a first step. https://t.co/BhVoW8mrTm",2019-11-12 13:57:56,False,1082416697380913152
1194037970338304001,"As we honor our veterans today, Congress is distracted by hyper-partisan issues. 

For the first time in 11 years, deployed troops do not have the money or resources to successfully &amp; safely accomplish their missions abroad. Our military deserves better. https://t.co/yPZ7DB07v4",2019-11-11 23:43:30,False,1082416697380913152
1193945582039175169,"Happy Veterans Day to all who have served and their families! 

Today and every day, I’m proud to be a solider serving our great country alongside brave men and women! De Opresso Liber! 🇺🇸 https://t.co/eI47qeo07Z",2019-11-11 17:36:23,False,1082416697380913152
1193938988220010496,"On #VeteransDay, we recognize the service and sacrifice of our men and women in uniform, and the families who support them. I will never forget the amazing soldiers I have fought alongside. Our freedom is owed to their bravery. #SemperFi https://t.co/2X2DkyOJ1T",2019-11-11 17:10:11,False,1082369392229400576
1194292947023474688,"#HomeIsHere for Dreamers - where their families, friends, and lives are. 

That’s why I’m proud to support DACA and the  Dream And Promise Act. 

We must protect the dream in Congress and at #SCOTUS.",2019-11-12 16:36:42,False,1082334352711790593
1193957566281334788,"On #VeteransDay we honor the lives and service of our veterans. 

To America’s veterans: thank you for your dedication to this country. 

I will do everything I can to make sure you do not have to fight in needless wars are taken care of when you get home. https://t.co/gNiJSZQxng",2019-11-11 18:24:01,False,1082334352711790593
1193976106724003841,"This morning, it was my privilege to participate in the Blair County Veterans Day Parade and honor our local veterans. Today and every day, these brave men and women deserve our gratitude for their enduring service to our community and to our nation. https://t.co/JgE04XX5SS",2019-11-11 19:37:41,False,1082311988926124036
1194300357209407488,"Today, #SCOTUS declined to hear a case against #Remington, and will allow the #SandyHook lawsuit to continue. Families who lost their loved ones on that December day in 2012 have fought for years to hold gun manufacturers accountable. https://t.co/tt40VqfAXQ",2019-11-12 17:06:08,False,1082086081238102018
1194247628336386048,Can’t forget #Roxbury. #HayesInYourHouse: Honoring those who served in Roxbury with First Selectman Barbara Henry. #VeteransDay https://t.co/xIEjy2HYNN,2019-11-12 13:36:37,False,1082086081238102018
1194237959328948224,Student #Veterans at CCSU were celebrated yesterday. On campuses across America we also honor the next generation of soldiers. #HayesInYourHouse https://t.co/wjwaRBFTYX,2019-11-12 12:58:12,False,1082086081238102018
1194223726902022144,"#OTD in 1954, #EllisIsland closed its doors for the last time, after processing more than 12 million immigrants. Immigrants are the lifeblood of America - we need comprehensive immigration reform now! https://t.co/ifcuuvsqDv",2019-11-12 12:01:38,False,1082086081238102018
1193972390604222466,"Spoke at the Gold Star Mothers Luncheon in #Waterbury. While on #VeteransDay we honor those who have served, we also recognize the sacrifices made by their loved ones. In Congress I have introduced bipartisan legislation to support our nation’s Gold Star families. https://t.co/0dp53jsXni",2019-11-11 19:22:55,False,1082086081238102018
1193969904002711554,"#HayesInYourHouse: In #Meriden, the Antique Veterans Honor Guard show that those who wore the uniform never stop serving. Henry, their oldest member, is 100 years young! #VeteransDay https://t.co/ygYO4s3kfB",2019-11-11 19:13:02,False,1082086081238102018
1193961058219761664,"Humbled to join the #Waterbury Veterans Memorial Committee for a tribute of appreciation and gratitude to those who served in our armed forces. “All gave some, some gave all” https://t.co/OvWiyBdmV2",2019-11-11 18:37:53,False,1082086081238102018
1193960723086491648,Attended the #Oakville Veterans of Foreign Wars annual event on the Green. This community has a long tradition of honoring their service men and women as Oakville has the largest VFW in CT and all of New England. https://t.co/2HaYScfTJD,2019-11-11 18:36:33,False,1082086081238102018
1193956687943745537,"Thank you for your service 🇺🇸🇺🇸🇺🇸🇺🇸🇺🇸🇺🇸

It is the Soldier, not the minister
Who has given us freedom of religion.

It is the Soldier, not the reporter
Who has given us freedom of the press.

It is the Soldier, not the poet
Who has given us freedom of speech. https://t.co/nDIVpVRK2D",2019-11-11 18:20:31,False,1082086081238102018
1194102059999678465,Moving Veterans Day remembrance and recognition of our vets and families at Punchbowl. But this day is also about recommitting to keeping our nation’s promises where there is too much still undone. https://t.co/Bc1GBHc6NW,2019-11-12 03:58:11,False,1081350574589833221
1193957937015853057,"Each #VeteransDay we gather to honor the brave men and women who make up our nation’s armed forces. These courageous individuals are true heroes and defenders of freedom. Today, I was humbled to thank some of our community’s veterans in person. 🇺🇸 https://t.co/BFu1rqnnju",2019-11-11 18:25:29,False,1081318716573470720
1193925796454424576,"This morning I joined Assistant Secretary, Dr. Fleming, and @SenCapito, to announce @US_EDA grants for West Virginia. Thank you for this investment, for @marshallu and Pocahontas County, that will build up our infrastructure and create new jobs. https://t.co/QYBynM7ZrP",2019-11-11 16:17:46,False,1081318716573470720
1193989329850376194,"Today, we salute our nation’s veterans, and we thank them for their service. To all of those in #TN6 who have bravely served our country, it is an honor to offer you our heartfelt gratitude. https://t.co/uZt4as8Oer",2019-11-11 20:30:14,False,1081312310059253763
1193983925007327232,"Today, I stand with Iowans and Americans as we say thank you to the men and women who sacrificed so much to to serve our country. It was an honor to take part in this morning’s Veterans Day ceremony in Cedar Rapids. #IA01 https://t.co/GjhItTxtI0",2019-11-11 20:08:45,False,1081256295469068288
1193919736259776512,Thank you to our many veterans who have served our nation. Please join me in thanking a veteran or a member of our armed forces for their service to our great country. https://t.co/Di3yjYJqC4,2019-11-11 15:53:41,False,1081243468327018496
1194276558174932992,"Arizona is home to over 25,000 DACA recipients. Our Dreamers work hard, play by the rules, and contribute billions to our economy. They are Americans in every sense and deserve a pathway to citizenship. I will do everything in my power to see that these Dreamers are protected. https://t.co/QU2PfsXpXG",2019-11-12 15:31:34,False,1081240074946252801
1193924352120631296,"I've kept a quote on my desk given to me by a veteran, ”Because they have already paid the price, fight for veterans with all your might.” Today we honor all our veterans who sacrificed their lives for our democracy. https://t.co/Xn9cRlyAnw",2019-11-11 16:12:02,False,1081240074946252801
1194282432616382464,"I’m standing with our #Dreamers today as the Supreme Court hears arguments that could decide the fate of #DACA. As a professor at UCI, I’m proud that the University of California is arguing this case for our families, neighborhoods, and communities. #HomeIsHere #UC4DACA",2019-11-12 15:54:55,False,1081222837459996672
1194004920598437888,"I was proud to join @City_of_Irvine for a #VeteransDay ceremony honoring the men and women who put their lives on the line to keep us safe.

To our troops, past and present, and to our military and veteran families, thank you. https://t.co/QkpKwtsHc0",2019-11-11 21:32:11,False,1081222837459996672
1194300897007943683,"DREAMers are students, servicemembers, neighbors &amp; friends that contribute to the rich diversity of our nation. The #SCOTUS case will decide the fate of #DREAMers living in America &amp; I hope that #SCOTUS rules on the right side of history. #HomeIsHere 
https://t.co/bWUpSXLYdc",2019-11-12 17:08:17,False,1080986167003230208
1194087420133666816,"Public lands are places for healing, not only for all of us, but for our veterans. That's why we must fight to protect our environment. To honor #VeteransDay, I'm sharing an Op-Ed that I wrote on the importance of permanently funding the LWCF. Read here:
https://t.co/dAuyUr40ZB",2019-11-12 03:00:00,False,1080986167003230208
1193927258420977666,"Proud of my family’s commitment to service throughout our country’s history &amp; proud to have followed in their footsteps. Pictured from left to right are my Father, Gilbert Cisneros Sr.,Grandfather Joe Cisneros, Grandfather Peter Barrera &amp; myself Gilbert Cisneros Jr. #VeteransDay https://t.co/fSuIY3cNq0",2019-11-11 16:23:35,False,1080986167003230208
1194216755847139328,"THE SPECTRUM FIGHT: Unconventional, but totally needed, later this morning I’ll be detailing the next step in our fight to hold Spectrum accountable for rising rates in our area. They’re unready for their closeup. https://t.co/jUD6xqeZme",2019-11-12 11:33:56,False,1080978331535896576
1193962716731518977,"Thank you to everyone who came out to our Veterans Day town hall. It is always an honor to meet the brave men and women who have served our country. I will keep fighting to ensure you get all the benefits, resources, and recognition you earned. Thank you for your service. https://t.co/3VXq77pUSk",2019-11-11 18:44:29,False,1080978331535896576
1193939713146736640,Thank you to all of our Veterans and their families for their service and sacrifice for our country. #VeteransDay https://t.co/jf9eP3dSsa,2019-11-11 17:13:04,False,1080978331535896576
1194287357803073537,"Sen. Hawley said U.S. foreign policy should be ""one that honors our workers by protecting their livelihoods, protects our way of life by thwarting hegemons, and respects our service-members by asking them to sacrifice only for a justified purpose and only with a reasonable plan."" https://t.co/t3bCpynIS3",2019-11-12 16:14:29,False,1080960924687704064
1194286820906995718,"""China’s bid for domination is the greatest security threat to this country in this century. And our foreign policy around the globe must be oriented to this challenge and focused principally on this threat.""
—Sen. Josh Hawley https://t.co/lp9pupcpno",2019-11-12 16:12:21,False,1080960924687704064
1194286357935464449,"Senator Hawley at @CNASdc: ""As Americans, we have long defined political liberty at home as freedom from domination. That is the theory of our Constitution. And that same principle should be the keystone of our foreign policy abroad."" https://t.co/xLKHeri3hM",2019-11-12 16:10:31,False,1080960924687704064
1194285258201538562,"Sen. Hawley on ensuring our policies preserve the dignity of our working men and women who founded this country: ""Ours is a middle-class republic, and to preserve the American nation means to preserve the security and prosperity of this American middle."" https://t.co/rXhvhnYxNl",2019-11-12 16:06:08,False,1080960924687704064
1194283248043646977,"Senator Hawley: ""It is time for a new departure, based on America’s needs in this new century. Because the point of American foreign policy should not be to remake the world, but to keep Americans safe and prosperous."" https://t.co/u2ZrojS82Z",2019-11-12 15:58:09,False,1080960924687704064
1194280605938323456,"Taking the stage at @CNASdc, Senator Hawley warns that our current foreign policy consensus ""has left us distracted from the dangers at hand, it has left us unprepared for the challenges we face, and it has been rejected by the people of this country."" https://t.co/XnD5s468ZL",2019-11-12 15:47:39,False,1080960924687704064
1194277620483055623,"🚨NOW LIVE🚨

Watch as Senator Hawley tackles a present foreign policy consensus not adequate to our time, and puts forth a new vision for the future of American foreign policy. https://t.co/ihKiIokVTx",2019-11-12 15:35:47,False,1080960924687704064
1194265683275796480,"DON’T MISS → This morning Senator Hawley takes the stage at @CNASdc to argue that it is time to reconsider the foreign policy consensus in light of a new era of great power competition.

Watch live here at 10:30am ET: https://t.co/ihKiIokVTx",2019-11-12 14:48:21,False,1080960924687704064
1194270996846567426,I stand with Dreamers. #HomeIsHere #ProtectTheDream https://t.co/YJN179atfd,2019-11-12 15:09:28,False,1080941062028447744
1194269629109149702,"I had a great week in the district hearing from constituents and highlighting the unique challenges we face in South Florida. Read about it all below:
https://t.co/gJdWfExpFI",2019-11-12 15:04:02,False,1080941062028447744
1194046757312835585,La OEA descubrió una clara manipulación de las elecciones en #Bolivia que condujo a la renuncia de Evo Morales. Los informes de violencia son inquietantes. Insto a la civilidad en este momento de transición. Estoy con los Bolivianos que luchan por una democracia pacífica.,2019-11-12 00:18:25,False,1080941062028447744
1194029260119384064,The OAS audit discovered clear manipulation of the elections in #Bolivia leading to @evoespueblo’s resignation. The reports of violence in the streets are disturbing. I urge civility in this time of transition. I stand w/the Bolivian ppl who are fighting for a peaceful democracy.,2019-11-11 23:08:54,False,1080941062028447744
1193999727383187456,Immigrants are as American as any of us! It’s time to recognize and respect their contributions to our country. #HomeIsHere https://t.co/3qBY6dSNLk,2019-11-11 21:11:33,False,1080941062028447744
1193920143535071237,Thank you to the brave women and men who have put their lives on the line in service to our country. Your invaluable sacrifice will never be forgotten. #VeteransDay https://t.co/TLrHT6DnXq,2019-11-11 15:55:18,False,1080941062028447744
1194288258450182144,Tom joined @FiOS1NewsNJ to discuss his work in Washington to protect our #electionsecurity and how the House is combatting the rise of white supremacist terrorism. https://t.co/vGVSM6sZA3,2019-11-12 16:18:04,False,1080898026418384897
1193998430303145984,"Today Tom joined Deerfield Middle School in Mountainside to recognize the 6th, 7th, and 8th grade winners of the Annual VFW Patriot's Pen Writing Competition. Congratulations to all! https://t.co/WZnM3xq5Wn",2019-11-11 21:06:23,False,1080898026418384897
1194055809879158791,"Today we commemorate veterans of past and present. 

Thank a veteran for their service, we appreciate it. 

But I also like to say “Never Forget.” Here is why. https://t.co/9i6m3dCZ98",2019-11-12 00:54:24,False,1080894931311431682
1194063567672270858,"Honored to join my fellow vets to mark Veterans Day at the Northern Maine Veterans Cemetery in Caribou. Thank you to all those who’ve served, no matter when. https://t.co/grPX2sWNEb",2019-11-12 01:25:13,False,1080891667308298240
1194270473716191233,"I’m at the Supreme Court this morning to hear the arguments that will determine the fate of #DACA. Dreamers are an integral part of our communities, and they deserve to contribute and participate fully without fear of their legal status being taken away. #HomeIsHere https://t.co/VAbB5JvY2c",2019-11-12 15:07:24,False,1080885078425784320
1193979748352974849,"Today and every day, we honor all the people who’ve answered the call to serve this great nation. 

Thank you for your service and tremendous sacrifice. 
#VeteransDay | #SaluteToService https://t.co/qiRMSr9kKT",2019-11-11 19:52:09,False,1080875913926139910
1193936509331804160,"Happy Veterans Day to all the men and women that have served this great nation. Thank you for fighting to preserve the freedoms we love and cherish.
 
I want to take this opportunity to highlight a veteran in our community. Thank you for your service, James! 🇺🇸 https://t.co/gNMS3FuwxM",2019-11-11 17:00:20,False,1080854935535800320
1194000596275253249,"To all the veterans across the Central Valley, thank you for all you have sacrificed in service of our country. https://t.co/EXe7lJNGbt",2019-11-11 21:15:00,False,1080851152151953410
1194047205373599744,"This weekend I met with veterans across the district, from Roswell to Alamogordo to Carlsbad to LC. I continue to be amazed by the bravery, courage, &amp; sacrifice that has kept our country safe. I’m committed to making sure we support our service members when they return home. https://t.co/uB10qV6EiZ",2019-11-12 00:20:12,False,1080830346915209216
1193967922877730816,Met with Mayor Miller &amp; constitutents at my Artesia COYC. Thank you to all who joined! https://t.co/GQpabhyDfV,2019-11-11 19:05:10,False,1080830346915209216
1193947719288721408,Happy Veteran’s Day! 🇺🇸 Thank you to our nation’s service men and women for their sacrifice and service.,2019-11-11 17:44:53,False,1080830346915209216
1193966566142074881,"Happy #VeteransDay, everyone! I’m forever grateful to our veterans and their families. 🇺🇸 https://t.co/EY3zlt5Wdi",2019-11-11 18:59:46,False,1080695666760929280
1194284117891919873,"#TeamSylvia in Washington stands with all the #Dreamers who are fighting to protect #DACA.

We love you, we support you, and we have your back.

You’re #HereToStay because your #HomeIsHere. #ProtectTheDream https://t.co/6tUi7xdZVl",2019-11-12 16:01:37,False,1080587263132733442
1194273407250108416,"I stand with all the #Dreamers across our country who are making their voices heard today.

I won’t stop fighting for you and your families because you matter.

You are American. You’re #HereToStay because your #HomeIsHere. https://t.co/D1YZfhZPeD",2019-11-12 15:19:03,False,1080587263132733442
1194253499460132864,"Proud to stand w/ @JoaquinCastrotx, @RepChuyGarcia, @SenatorDurbin, @RepLouCorrea, &amp; @NydiaVelazquez in support of the #Dreamers fighting to protect #DACA.

They are #HereToStay because their #HomeIsHere.

We’ll continue fighting alongside you to #ProtectTheDream. https://t.co/jfJeTYq192",2019-11-12 13:59:57,False,1080587263132733442
1193962236571783170,"This #VeteransDay, I was proud to join @SylvesterTurner, @JoeWalsh of the Eagles, and members of the #Houston Congressional delegation to thank our veterans for their patriotism.

Because of their service, we continue to be the land of the free and the home of the brave. https://t.co/EY3P8LE4at",2019-11-11 18:42:34,False,1080587263132733442
1193931862936297473,"Este #VeteransDay, honramos a todos que han servido valientemente en el ejercito de nuestro país y defendido a nuestros valores como Americanos.

Estoy comprometida a honrar su servicio con acción en el Congreso. Gracias por su valentía, servicio y sobre todo amor por el país. https://t.co/L1MKYtJFwp",2019-11-11 16:41:52,False,1080587263132733442
1193929649727954949,"On this #VeteransDay, we honor the men and women who have bravely served in our country's military and defended our values as Americans.

I am committed to honoring your service every day with action in Congress. Thank you for your bravery, service, and above all love of country. https://t.co/VMSFmACOFC",2019-11-11 16:33:05,False,1080587263132733442
1194259885871026176,"Their voices matter. Their presence matters. All #immigrants are a vital part of communities across #MA7 &amp; the country. As #DACA heads to the #SCOTUS today, we must continue to resist the xenophobic, cruel, inhumane policies that are threatening the lives of families #HomeIsHere https://t.co/OEhm1X1TDM",2019-11-12 14:25:19,False,1080584229510172678
1193932678543884291,"From City Hall to the State House to the halls of Congress, women are shaking the table &amp; demanding that our voices be heard. Grateful to serve alongside my #mapoli sisters in service as we fight to affirm justice and equity for all. https://t.co/Bav7Bm9sIs",2019-11-11 16:45:07,False,1080584229510172678
